mesure,indicateur,id_indicateur,code_departement,libelle_departement,valeur_actuelle,date_valeur_actuelle,valeur_initiale,date_valeur_initiale,progression,pourcentage_progression,cible,pourcentage_cible,date_cible,unite
Renforcer la sécurité du quotidien,Nombre d’heures de patrouille de voie publique,nb-heures-patrouille,27,Eure,605613.0,2022-01-31,627815.0,2017-12-31,-22202.0,-4.0,,,,heures de patrouille sur douze mois *
Renforcer la sécurité du quotidien,Atteintes aux personnes dans les transports en commun,nb-atteintes-personnes,27,Eure,62.0,2021-12-31,53.0,2017-12-31,9.0,17.0,,,,atteintes aux personnes dans l'année
Renforcer la sécurité du quotidien,Atteintes aux biens dans les transports en commun,nb-atteintes-biens,27,Eure,248.0,2021-12-31,284.0,2017-12-31,-36.0,-13.0,,,,atteintes aux biens dans l'année
Lutter contre les stupéfiants,Nombre d'amendes forfaitaires délictuelles dressées,nb-amendes-delictuelles-dressees,27,Eure,763.0,2021-12-31,0.0,2020-05-31,763.0,,,,,amendes dressées
Lutter contre les violences faites aux femmes,Nombre d’ordonnances de protection délivrées,nb-ordonnances-delivrees,27,Eure,55.0,2020-12-31,14.0,2017-12-31,41.0,293.0,,,,ordonnances dans l'année
Lutter contre les atteintes aux principes républicains,Nombre de contrôles réalisés dans le cadre des CLIR ou des dispositifs existant localement avant la mise en place progressive des CLIR,nb-controles-clir,27,Eure,5.0,2021-12-31,,,,,,,,contrôles
Réduire la mortalité sur les routes,Nombre de morts sur les routes,nb-morts-routes,27,Eure,41.0,2021-12-31,33.0,2017-12-31,8.0,24.0,,,,morts
