mesure,indicateur,id_indicateur,code_departement,libelle_departement,valeur_actuelle,date_valeur_actuelle,valeur_initiale,date_valeur_initiale,progression,pourcentage_progression,cible,pourcentage_cible,date_cible,unite
Renforcer la sécurité du quotidien,Nombre d’heures de patrouille de voie publique,nb-heures-patrouille,79,Deux-Sèvres,364186.0,2021-05-31,348966.0,2018-01-31,15220.0,4.0,,,,heures de patrouille sur douze mois *
Renforcer la sécurité du quotidien,Atteintes aux personnes dans les transports en commun,nb-atteintes-personnes,79,Deux-Sèvres,16.0,2021-06-30,10.0,2017-06-30,6.0,60.0,,,,atteintes aux personnes entre janvier et juin
Renforcer la sécurité du quotidien,Atteintes aux biens dans les transports en commun,nb-atteintes-biens,79,Deux-Sèvres,29.0,2021-06-30,43.0,2017-06-30,-14.0,-33.0,,,,atteintes aux biens entre janvier et juin
Lutter contre les stupéfiants,Nombre d'amendes forfaitaires délictuelles dressées,nb-amendes-delictuelles-dressees,79,Deux-Sèvres,103.0,2021-06-30,0.0,,103.0,,,,,amendes dressées dans l'année
Lutter contre les violences faites aux femmes,Nombre d’ordonnances de protection délivrées,nb-ordonnances-delivrees,79,Deux-Sèvres,18.0,2020-12-31,3.0,2017-06-30,15.0,500.0,,,,ordonnances dans l'année
Lutter contre les atteintes aux principes républicains,Nombre de contrôles réalisés dans le cadre des CLIR ou des dispositifs existant localement avant la mise en place progressive des CLIR,nb-controles-clir,79,Deux-Sèvres,0.0,2020-12-31,,,,,,,,contrôles dans l'année
Réduire la mortalité sur les routes,Nombre de morts sur les routes,nb-morts-routes,79,Deux-Sèvres,17.0,2020-12-31,28.0,2017-12-31,-11.0,-39.0,,,,morts dans l'année
