mesure,indicateur,id_indicateur,code_departement,libelle_departement,valeur_actuelle,date_valeur_actuelle,valeur_initiale,date_valeur_initiale,progression,pourcentage_progression,cible,pourcentage_cible,date_cible,unite
Lutter contre les impayés de pensions alimentaires,Nombre de familles bénéficiaires d'une pension alimentaire versée par l'intermédiaire du service public des pensions alimentaires,nb-familles-aripa,88,Vosges,25.0,2021-03-31,6.0,2020-12-31,19.0,317.0,,,,familles
"Proposer une offre de lunettes, appareils auditifs et prothèses dentaires remboursée à 100%",Part des équipements/soins auditives 100% santé dans le total des soins,tx-equipements-audio,88,Vosges,7.52,2020-12-31,7.92,2019-01-31,-0.0,-5.0,40.0,-1.0,2022-12-31,%
"Proposer une offre de lunettes, appareils auditifs et prothèses dentaires remboursée à 100%",Part des équipements/soins 100% santé dans le total des soins dentaires,tx-equipements-dentaire,88,Vosges,61.62,2020-12-31,34.3,2019-04-30,27.0,80.0,45.0,255.0,2022-12-31,%
"Proposer une offre de lunettes, appareils auditifs et prothèses dentaires remboursée à 100%",Part des équipements/soins 100% santé dans le total des soins optiques,tx-equipements-optique,88,Vosges,12.68,2020-12-31,15.89,2020-01-31,-3.0,-20.0,20.0,-78.0,2022-12-31,%
Doubler le nombre de maisons de santé et de centres de santé dans les territoires,Nombre de maisons de santé pluri-professionnelles,nb-maisons-sante,88,Vosges,28.0,2020-12-31,21.0,2017-06-30,7.0,33.0,30.0,78.0,2022-12-31,maisons de santé
Allonger le congé paternité pour un meilleur développement de l’enfant,Nombre de pères / conjoints prenant un congé de paternité et d’accueil de l’enfant,nb-peres-conge-paternite,88,Vosges,1403.0,2020-12-31,1471.0,2019-12-31,-68.0,-5.0,1874.0,-17.0,2022-12-31,pères / conjoints dans l'année
Simplifier l’accès aux droits des personnes handicapées,Durée moyenne de traitement pour les demandes d’allocation adulte handicapé,duree-moyenne-traitement-demandes-allocation-adulte-handicape,88,Vosges,3.0,2020-12-31,2.7,2017-12-31,0.0,11.0,3.0,100.0,2022-12-31,mois de traitement
