mesure,indicateur,id_indicateur,code_departement,libelle_departement,valeur_actuelle,date_valeur_actuelle,valeur_initiale,date_valeur_initiale,progression,pourcentage_progression,cible,pourcentage_cible,date_cible,unite
Lutter contre les impayés de pensions alimentaires,Nombre de familles bénéficiaires d'une pension alimentaire versée par l'intermédiaire du service public des pensions alimentaires,nb-familles-aripa,80,Somme,870.0,2022-10-31,0.0,2020-09-30,870.0,,1830.0,48.0,2022-12-31,familles
"Proposer une offre de lunettes, appareils auditifs et prothèses dentaires remboursée à 100%",Part des équipements vendus sans reste à charge dans le total des soins audio,tx-equipements-audio,80,Somme,47.51,2022-06-30,0.0,2018-12-31,48.0,,40.0,100.0,2022-12-31,%
"Proposer une offre de lunettes, appareils auditifs et prothèses dentaires remboursée à 100%",Part des équipements vendus sans reste à charge dans le total des soins dentaires,tx-equipements-dentaire,80,Somme,65.42,2022-06-30,0.0,2019-03-31,65.0,,45.0,100.0,2022-12-31,%
"Proposer une offre de lunettes, appareils auditifs et prothèses dentaires remboursée à 100%",Part des équipements vendus sans reste à charge dans le total des soins optiques,tx-equipements-optique,80,Somme,20.18,2022-06-30,0.0,2019-12-31,20.0,,20.0,100.0,2022-12-31,%
Doubler le nombre de maisons de santé et de centres de santé dans les territoires,Nombre de maisons de santé pluri-professionnelles,nb-maisons-sante,80,Somme,37.0,2022-12-31,17.0,2017-06-30,20.0,118.0,33.0,100.0,2022-12-31,maisons de santé
Doubler le nombre de maisons de santé et de centres de santé dans les territoires,Nombre de centres de santé,nb-centres-sante,80,Somme,0.0,2021-12-31,0.0,2017-12-31,0.0,,1.0,0.0,2022-12-31,centres de santé
Allonger le congé paternité pour un meilleur développement de l’enfant,Nombre de pères / conjoints prenant un congé de paternité,nb-peres-conge-paternite,80,Somme,2569.0,2021-12-31,2448.0,2018-12-31,121.0,5.0,2763.0,38.0,2022-12-31,pères / conjoints dans l'année
Simplifier l’accès aux droits des personnes handicapées,Durée moyenne de traitement pour les demandes d’allocation adulte handicapé,duree-moyenne-traitement-demandes-allocation-adulte-handicape,80,Somme,3.35,2022-09-30,2.4,2017-12-31,1.0,40.0,3.0,0.0,2022-12-31,mois de traitement
Accompagner les aidants,Nombre de bénéficiaires d'un congé de proche aidant indemnisé,nb-beneficiaires-ajpa,80,Somme,86.0,2022-12-31,0.0,2020-09-30,86.0,,510.0,17.0,2022-12-31,bénéficiaires
