mesure,indicateur,id_indicateur,code_departement,libelle_departement,valeur_actuelle,date_valeur_actuelle,valeur_initiale,date_valeur_initiale,progression,pourcentage_progression,cible,pourcentage_cible,date_cible,unite
Lutter contre les impayés de pensions alimentaires,Nombre de familles bénéficiaires d'une pension alimentaire versée par l'intermédiaire du service public des pensions alimentaires,nb-familles-aripa,01,Ain,41.0,2021-03-31,14.0,2020-12-31,27.0,193.0,,,,familles
"Proposer une offre de lunettes, appareils auditifs et prothèses dentaires remboursée à 100%",Part des équipements/soins auditives 100% santé dans le total des soins,tx-equipements-audio,01,Ain,5.2,2020-12-31,6.16,2019-01-31,-1.0,-16.0,40.0,-3.0,2022-12-31,%
"Proposer une offre de lunettes, appareils auditifs et prothèses dentaires remboursée à 100%",Part des équipements/soins 100% santé dans le total des soins dentaires,tx-equipements-dentaire,01,Ain,47.83,2020-12-31,26.14,2019-04-30,22.0,83.0,45.0,115.0,2022-12-31,%
"Proposer une offre de lunettes, appareils auditifs et prothèses dentaires remboursée à 100%",Part des équipements/soins 100% santé dans le total des soins optiques,tx-equipements-optique,01,Ain,10.26,2020-12-31,12.69,2020-01-31,-2.0,-19.0,20.0,-33.0,2022-12-31,%
Doubler le nombre de maisons de santé et de centres de santé dans les territoires,Nombre de maisons de santé pluri-professionnelles,nb-maisons-sante,01,Ain,30.0,2020-12-31,21.0,2017-06-30,9.0,43.0,30.0,100.0,2022-12-31,maisons de santé
Doubler le nombre de maisons de santé et de centres de santé dans les territoires,Nombre de centres de santé,nb-centres-sante,01,Ain,2.0,2020-12-31,,,,,,,,centres de santé
Allonger le congé paternité pour un meilleur développement de l’enfant,Nombre de pères / conjoints prenant un congé de paternité et d’accueil de l’enfant,nb-peres-conge-paternite,01,Ain,2929.0,2020-12-31,3043.0,2019-12-31,-114.0,-4.0,3733.0,-17.0,2022-12-31,pères / conjoints dans l'année
Simplifier l’accès aux droits des personnes handicapées,Durée moyenne de traitement pour les demandes d’allocation adulte handicapé,duree-moyenne-traitement-demandes-allocation-adulte-handicape,01,Ain,4.8,2020-12-31,4.4,2017-12-31,0.0,9.0,3.0,-29.0,2022-12-31,mois de traitement
