mesure,indicateur,id_indicateur,code_departement,libelle_departement,valeur_actuelle,date_valeur_actuelle,valeur_initiale,date_valeur_initiale,progression,pourcentage_progression,cible,pourcentage_cible,date_cible,unite
Lutter contre les impayés de pensions alimentaires,Nombre de familles bénéficiaires d'une pension alimentaire versée par l'intermédiaire du service public des pensions alimentaires,nb-familles-aripa,33,Gironde,614.0,2021-06-30,22.0,2020-12-31,592.0,2691.0,,,,familles
"Proposer une offre de lunettes, appareils auditifs et prothèses dentaires remboursée à 100%",Part des équipements vendus sans reste à charge dans le total des soins audio,tx-equipements-audio,33,Gironde,8.33,2020-12-31,8.08,2019-01-31,0.0,3.0,40.0,1.0,2022-12-31,%
"Proposer une offre de lunettes, appareils auditifs et prothèses dentaires remboursée à 100%",Part des équipements vendus sans reste à charge dans le total des soins dentaires,tx-equipements-dentaire,33,Gironde,52.22,2020-12-31,31.19,2019-04-30,21.0,67.0,45.0,100.0,2022-12-31,%
"Proposer une offre de lunettes, appareils auditifs et prothèses dentaires remboursée à 100%",Part des équipements vendus sans reste à charge dans le total des soins optiques,tx-equipements-optique,33,Gironde,14.57,2020-12-31,19.94,2020-01-31,-5.0,-27.0,20.0,0.0,2022-12-31,%
Doubler le nombre de maisons de santé et de centres de santé dans les territoires,Nombre de maisons de santé pluri-professionnelles,nb-maisons-sante,33,Gironde,17.0,2021-06-30,12.0,2017-06-30,5.0,42.0,20.0,62.0,2022-12-31,maisons de santé
Doubler le nombre de maisons de santé et de centres de santé dans les territoires,Nombre de centres de santé,nb-centres-sante,33,Gironde,6.0,2020-12-31,,,,,13.0,,2022-12-31,centres de santé
Allonger le congé paternité pour un meilleur développement de l’enfant,Nombre de pères / conjoints prenant un congé de paternité,nb-peres-conge-paternite,33,Gironde,7279.0,2020-12-31,7246.0,2018-12-31,33.0,0.0,8192.0,3.0,2022-12-31,pères / conjoints dans l'année
Simplifier l’accès aux droits des personnes handicapées,Durée moyenne de traitement pour les demandes d’allocation adulte handicapé,duree-moyenne-traitement-demandes-allocation-adulte-handicape,33,Gironde,3.1,2020-12-31,3.8,2017-12-31,-1.0,-18.0,3.0,87.0,2022-12-31,mois de traitement
Accompagner les aidants,Nombre de bénéficiaires d'un congé de proche aidant indemnisé,nb-beneficiaires-ajpa,33,Gironde,46.0,2021-03-31,,,,,1290.0,,2022-12-31,bénéficiaires
