mesure,indicateur,id_indicateur,code_departement,libelle_departement,valeur_actuelle,date_valeur_actuelle,valeur_initiale,date_valeur_initiale,progression,pourcentage_progression,cible,pourcentage_cible,date_cible,unite
Lutter contre les impayés de pensions alimentaires,Nombre de familles bénéficiaires d'une pension alimentaire versée par l'intermédiaire du service public des pensions alimentaires,nb-familles-aripa,12,Aveyron,34.0,2021-03-31,9.0,2020-12-31,25.0,278.0,,,,familles
"Proposer une offre de lunettes, appareils auditifs et prothèses dentaires remboursée à 100%",Part des équipements/soins auditives 100% santé dans le total des soins,tx-equipements-audio,12,Aveyron,15.67,2020-12-31,8.41,2019-01-31,7.0,86.0,40.0,23.0,2022-12-31,%
"Proposer une offre de lunettes, appareils auditifs et prothèses dentaires remboursée à 100%",Part des équipements/soins 100% santé dans le total des soins dentaires,tx-equipements-dentaire,12,Aveyron,65.58,2020-12-31,38.66,2019-04-30,27.0,70.0,45.0,425.0,2022-12-31,%
"Proposer une offre de lunettes, appareils auditifs et prothèses dentaires remboursée à 100%",Part des équipements/soins 100% santé dans le total des soins optiques,tx-equipements-optique,12,Aveyron,10.66,2020-12-31,14.72,2020-01-31,-4.0,-28.0,20.0,-77.0,2022-12-31,%
Doubler le nombre de maisons de santé et de centres de santé dans les territoires,Nombre de maisons de santé pluri-professionnelles,nb-maisons-sante,12,Aveyron,21.0,2020-12-31,17.0,2017-06-30,4.0,24.0,24.0,57.0,2022-12-31,maisons de santé
Doubler le nombre de maisons de santé et de centres de santé dans les territoires,Nombre de centres de santé,nb-centres-sante,12,Aveyron,1.0,2020-12-31,,,,,,,,centres de santé
Allonger le congé paternité pour un meilleur développement de l’enfant,Nombre de pères / conjoints prenant un congé de paternité et d’accueil de l’enfant,nb-peres-conge-paternite,12,Aveyron,960.0,2020-12-31,1006.0,2019-12-31,-46.0,-5.0,1184.0,-26.0,2022-12-31,pères / conjoints dans l'année
Simplifier l’accès aux droits des personnes handicapées,Durée moyenne de traitement pour les demandes d’allocation adulte handicapé,duree-moyenne-traitement-demandes-allocation-adulte-handicape,12,Aveyron,5.4,2019-12-31,4.9,2017-12-31,0.0,10.0,3.0,-26.0,2022-12-31,mois de traitement
