mesure,indicateur,id_indicateur,code_departement,libelle_departement,valeur_actuelle,date_valeur_actuelle,valeur_initiale,date_valeur_initiale,progression,pourcentage_progression,cible,pourcentage_cible,date_cible,unite
Lutter contre les impayés de pensions alimentaires,Nombre de familles bénéficiaires d'une pension alimentaire versée par l'intermédiaire du service public des pensions alimentaires,nb-familles-aripa,94,Val-de-Marne,156.0,2021-06-30,23.0,2020-12-31,133.0,578.0,,,,familles
"Proposer une offre de lunettes, appareils auditifs et prothèses dentaires remboursée à 100%",Part des équipements vendus sans reste à charge dans le total des soins audio,tx-equipements-audio,94,Val-de-Marne,10.29,2020-12-31,9.77,2019-01-31,1.0,5.0,40.0,2.0,2022-12-31,%
"Proposer une offre de lunettes, appareils auditifs et prothèses dentaires remboursée à 100%",Part des équipements vendus sans reste à charge dans le total des soins dentaires,tx-equipements-dentaire,94,Val-de-Marne,40.99,2020-12-31,21.05,2019-04-30,20.0,95.0,45.0,83.0,2022-12-31,%
"Proposer une offre de lunettes, appareils auditifs et prothèses dentaires remboursée à 100%",Part des équipements vendus sans reste à charge dans le total des soins optiques,tx-equipements-optique,94,Val-de-Marne,16.84,2020-12-31,25.17,2020-01-31,-8.0,-33.0,20.0,0.0,2022-12-31,%
Doubler le nombre de maisons de santé et de centres de santé dans les territoires,Nombre de maisons de santé pluri-professionnelles,nb-maisons-sante,94,Val-de-Marne,10.0,2021-06-30,3.0,2017-06-30,7.0,233.0,10.0,100.0,2022-12-31,maisons de santé
Doubler le nombre de maisons de santé et de centres de santé dans les territoires,Nombre de centres de santé,nb-centres-sante,94,Val-de-Marne,22.0,2020-12-31,,,,,22.0,,2022-12-31,centres de santé
Allonger le congé paternité pour un meilleur développement de l’enfant,Nombre de pères / conjoints prenant un congé de paternité,nb-peres-conge-paternite,94,Val-de-Marne,6893.0,2020-12-31,7474.0,2018-12-31,-581.0,-8.0,9205.0,0.0,2022-12-31,pères / conjoints dans l'année
Simplifier l’accès aux droits des personnes handicapées,Durée moyenne de traitement pour les demandes d’allocation adulte handicapé,duree-moyenne-traitement-demandes-allocation-adulte-handicape,94,Val-de-Marne,5.5,2020-12-31,6.7,2019-12-31,-1.0,-18.0,3.0,32.0,2022-12-31,mois de traitement
Accompagner les aidants,Nombre de bénéficiaires d'un congé de proche aidant indemnisé,nb-beneficiaires-ajpa,94,Val-de-Marne,118.0,2021-03-31,,,,,875.0,,2022-12-31,bénéficiaires
