mesure,indicateur,id_indicateur,code_departement,libelle_departement,valeur_actuelle,date_valeur_actuelle,valeur_initiale,date_valeur_initiale,progression,pourcentage_progression,cible,pourcentage_cible,date_cible,unite
Doubler le nombre de maisons de santé,Nombre de maisons de santé pluri-professionnelles,nb-maisons-sante,32,Gers,7.0,2020-06-30,3.0,2017-06-30,4.0,133.0,,,,maisons de santé
Allonger le congé paternité pour un meilleur développement de l’enfant,Nombre de pères / conjoints prenant un congé de paternité et d’accueil de l’enfant,nb-peres-conge-paternite,32,Gers,673.0,2019-12-31,,,,,,,,pères dans l'année
Simplifier l’accès aux droits des personnes handicapées,Durée moyenne de traitement pour les demandes d’allocation adulte handicapé,duree-moyenne-traitement-demandes-allocation-adulte-handicape,32,Gers,3.0,2020-09-30,2.6,2017-12-31,0.0,15.0,3.0,100.0,2022-12-31,mois de traitement
"Proposer une offre de lunettes, appareils auditifs et prothèses dentaires remboursée à 100%",Part des équipements/soins auditives 100% santé dans le total des soins,tx-equipements-audio,32,Gers,16.38,2020-10-31,7.41,2019-01-31,9.0,121.0,,,,%
"Proposer une offre de lunettes, appareils auditifs et prothèses dentaires remboursée à 100%",Part des équipements/soins 100% santé dans le total des soins dentaires,tx-equipements-dentaire,32,Gers,62.07,2020-09-30,33.44,2019-04-30,29.0,86.0,,,,%
"Proposer une offre de lunettes, appareils auditifs et prothèses dentaires remboursée à 100%",Part des équipements/soins 100% santé dans le total des soins optiques,tx-equipements-optique,32,Gers,8.93,2020-10-31,9.63,2020-01-31,-1.0,-7.0,,,,%
