mesure,indicateur,id_indicateur,code_departement,libelle_departement,valeur_actuelle,date_valeur_actuelle,valeur_initiale,date_valeur_initiale,progression,pourcentage_progression,cible,pourcentage_cible,date_cible,unite
Lutter contre les impayés de pensions alimentaires,Nombre de familles bénéficiaires d'une pension alimentaire versée par l'intermédiaire du service public des pensions alimentaires,nb-familles-aripa,06,Alpes-Maritimes,786.0,2022-02-28,0.0,2020-09-30,786.0,,4836,16.0,2022-12-31,familles
"Proposer une offre de lunettes, appareils auditifs et prothèses dentaires remboursée à 100%",Part des équipements vendus sans reste à charge dans le total des soins audio,tx-equipements-audio,06,Alpes-Maritimes,41.56,2021-09-30,0.0,2018-12-31,42.0,,40,100.0,2022-12-31,%
"Proposer une offre de lunettes, appareils auditifs et prothèses dentaires remboursée à 100%",Part des équipements vendus sans reste à charge dans le total des soins dentaires,tx-equipements-dentaire,06,Alpes-Maritimes,56.29,2021-09-30,0.0,2019-03-31,56.0,,45,100.0,2022-12-31,%
"Proposer une offre de lunettes, appareils auditifs et prothèses dentaires remboursée à 100%",Part des équipements vendus sans reste à charge dans le total des soins optiques,tx-equipements-optique,06,Alpes-Maritimes,19.23,2021-09-30,0.0,2019-12-31,19.0,,20,96.0,2022-12-31,%
Doubler le nombre de maisons de santé et de centres de santé dans les territoires,Nombre de maisons de santé pluri-professionnelles,nb-maisons-sante,06,Alpes-Maritimes,14.0,2021-12-31,3.0,2017-06-30,11.0,367.0,17,79.0,2022-12-31,maisons de santé
Doubler le nombre de maisons de santé et de centres de santé dans les territoires,Nombre de centres de santé,nb-centres-sante,06,Alpes-Maritimes,3.0,2021-12-31,2.0,2017-12-31,1.0,50.0,4,50.0,2022-12-31,centres de santé
Allonger le congé paternité pour un meilleur développement de l’enfant,Nombre de pères / conjoints prenant un congé de paternité,nb-peres-conge-paternite,06,Alpes-Maritimes,4467.0,2021-12-31,4200.0,2018-12-31,267.0,6.0,4879,39.0,2022-12-31,pères / conjoints dans l'année
Simplifier l’accès aux droits des personnes handicapées,Durée moyenne de traitement pour les demandes d’allocation adulte handicapé,duree-moyenne-traitement-demandes-allocation-adulte-handicape,06,Alpes-Maritimes,4.8,2021-09-30,3.4,2017-12-31,1.0,41.0,3,0.0,2022-12-31,mois de traitement
Accompagner les aidants,Nombre de bénéficiaires d'un congé de proche aidant indemnisé,nb-beneficiaires-ajpa,06,Alpes-Maritimes,108.0,2021-12-31,0.0,2020-09-30,108.0,,950,11.0,2022-12-31,bénéficiaires
