mesure,indicateur,id_indicateur,code_departement,libelle_departement,valeur_actuelle,date_valeur_actuelle,valeur_initiale,date_valeur_initiale,progression,pourcentage_progression,cible,pourcentage_cible,date_cible,unite
Lutter contre les impayés de pensions alimentaires,Nombre de familles bénéficiaires d'une pension alimentaire versée par l'intermédiaire du service public des pensions alimentaires,nb-familles-aripa,66,Pyrénées-Orientales,543.0,2022-02-28,0.0,2020-09-30,543.0,,1886.0,29.0,2022-12-31,familles
"Proposer une offre de lunettes, appareils auditifs et prothèses dentaires remboursée à 100%",Part des équipements vendus sans reste à charge dans le total des soins audio,tx-equipements-audio,66,Pyrénées-Orientales,45.47,2021-09-30,0.0,2018-12-31,45.0,,40.0,100.0,2022-12-31,%
"Proposer une offre de lunettes, appareils auditifs et prothèses dentaires remboursée à 100%",Part des équipements vendus sans reste à charge dans le total des soins dentaires,tx-equipements-dentaire,66,Pyrénées-Orientales,68.18,2021-09-30,0.0,2019-03-31,68.0,,45.0,100.0,2022-12-31,%
"Proposer une offre de lunettes, appareils auditifs et prothèses dentaires remboursée à 100%",Part des équipements vendus sans reste à charge dans le total des soins optiques,tx-equipements-optique,66,Pyrénées-Orientales,26.52,2021-09-30,0.0,2019-12-31,27.0,,20.0,100.0,2022-12-31,%
Doubler le nombre de maisons de santé et de centres de santé dans les territoires,Nombre de maisons de santé pluri-professionnelles,nb-maisons-sante,66,Pyrénées-Orientales,12.0,2021-12-31,7.0,2017-06-30,5.0,71.0,11.0,100.0,2022-12-31,maisons de santé
Doubler le nombre de maisons de santé et de centres de santé dans les territoires,Nombre de centres de santé,nb-centres-sante,66,Pyrénées-Orientales,3.0,2021-12-31,1.0,2017-12-31,2.0,200.0,5.0,50.0,2022-12-31,centres de santé
Allonger le congé paternité pour un meilleur développement de l’enfant,Nombre de pères / conjoints prenant un congé de paternité,nb-peres-conge-paternite,66,Pyrénées-Orientales,1585.0,2021-12-31,1400.0,2018-12-31,185.0,13.0,1608.0,89.0,2022-12-31,pères / conjoints dans l'année
Simplifier l’accès aux droits des personnes handicapées,Durée moyenne de traitement pour les demandes d’allocation adulte handicapé,duree-moyenne-traitement-demandes-allocation-adulte-handicape,66,Pyrénées-Orientales,3.6,2021-09-30,2.9,2021-03-31,1.0,24.0,3.0,0.0,2022-12-31,mois de traitement
Accompagner les aidants,Nombre de bénéficiaires d'un congé de proche aidant indemnisé,nb-beneficiaires-ajpa,66,Pyrénées-Orientales,80.0,2021-12-31,0.0,2020-09-30,80.0,,495.0,16.0,2022-12-31,bénéficiaires
