mesure,indicateur,id_indicateur,code_departement,libelle_departement,valeur_actuelle,date_valeur_actuelle,valeur_initiale,date_valeur_initiale,progression,pourcentage_progression,cible,pourcentage_cible,date_cible,unite
Lutter contre les impayés de pensions alimentaires,Nombre de familles bénéficiaires d'une pension alimentaire versée par l'intermédiaire du service public des pensions alimentaires,nb-familles-aripa,65,Hautes-Pyrénées,315.0,2022-10-31,0.0,2020-09-30,315.0,,762.0,41.0,2022-12-31,familles
"Proposer une offre de lunettes, appareils auditifs et prothèses dentaires remboursée à 100%",Part des équipements vendus sans reste à charge dans le total des soins audio,tx-equipements-audio,65,Hautes-Pyrénées,48.85,2022-06-30,0.0,2018-12-31,49.0,,40.0,100.0,2022-12-31,%
"Proposer une offre de lunettes, appareils auditifs et prothèses dentaires remboursée à 100%",Part des équipements vendus sans reste à charge dans le total des soins dentaires,tx-equipements-dentaire,65,Hautes-Pyrénées,69.43,2022-06-30,0.0,2019-03-31,69.0,,45.0,100.0,2022-12-31,%
"Proposer une offre de lunettes, appareils auditifs et prothèses dentaires remboursée à 100%",Part des équipements vendus sans reste à charge dans le total des soins optiques,tx-equipements-optique,65,Hautes-Pyrénées,21.58,2022-06-30,0.0,2019-12-31,22.0,,20.0,100.0,2022-12-31,%
Doubler le nombre de maisons de santé et de centres de santé dans les territoires,Nombre de maisons de santé pluri-professionnelles,nb-maisons-sante,65,Hautes-Pyrénées,17.0,2022-12-31,7.0,2017-06-30,10.0,143.0,15.0,100.0,2022-12-31,maisons de santé
Doubler le nombre de maisons de santé et de centres de santé dans les territoires,Nombre de centres de santé,nb-centres-sante,65,Hautes-Pyrénées,0.0,2021-12-31,,,,,1.0,,2022-12-31,centres de santé
Allonger le congé paternité pour un meilleur développement de l’enfant,Nombre de pères / conjoints prenant un congé de paternité,nb-peres-conge-paternite,65,Hautes-Pyrénées,837.0,2021-12-31,741.0,2018-12-31,96.0,13.0,794.0,100.0,2022-12-31,pères / conjoints dans l'année
Simplifier l’accès aux droits des personnes handicapées,Durée moyenne de traitement pour les demandes d’allocation adulte handicapé,duree-moyenne-traitement-demandes-allocation-adulte-handicape,65,Hautes-Pyrénées,3.04,2022-09-30,4.0,2017-12-31,-1.0,-24.0,3.0,96.0,2022-12-31,mois de traitement
Accompagner les aidants,Nombre de bénéficiaires d'un congé de proche aidant indemnisé,nb-beneficiaires-ajpa,65,Hautes-Pyrénées,68.0,2022-12-31,0.0,2020-09-30,68.0,,275.0,25.0,2022-12-31,bénéficiaires
