mesure,indicateur,id_indicateur,code_departement,libelle_departement,valeur_actuelle,date_valeur_actuelle,valeur_initiale,date_valeur_initiale,progression,pourcentage_progression,cible,pourcentage_cible,date_cible,unite
Doubler le nombre de maisons de santé,Nombre de maisons de santé pluri-professionnelles,nb-maisons-sante,19,Corrèze,14.0,2020-06-30,8.0,2017-06-30,6.0,75.0,,,,maisons de santé
Allonger le congé paternité pour un meilleur développement de l’enfant,Nombre de pères / conjoints prenant un congé de paternité et d’accueil de l’enfant,nb-peres-conge-paternite,19,Corrèze,912.0,2019-12-31,,,,,,,,pères dans l'année
Simplifier l’accès aux droits des personnes handicapées,Durée moyenne de traitement pour les demandes d’allocation adulte handicapé,duree-moyenne-traitement-demandes-allocation-adulte-handicape,19,Corrèze,2.5,2020-09-30,3.2,2017-12-31,-1.0,-22.0,3.0,350.0,2022-12-31,mois de traitement
"Proposer une offre de lunettes, appareils auditifs et prothèses dentaires remboursée à 100%",Part des équipements/soins auditives 100% santé dans le total des soins,tx-equipements-audio,19,Corrèze,8.03,2020-10-31,2.86,2019-01-31,5.0,181.0,,,,%
"Proposer une offre de lunettes, appareils auditifs et prothèses dentaires remboursée à 100%",Part des équipements/soins 100% santé dans le total des soins dentaires,tx-equipements-dentaire,19,Corrèze,62.43,2020-09-30,36.06,2019-04-30,26.0,73.0,,,,%
"Proposer une offre de lunettes, appareils auditifs et prothèses dentaires remboursée à 100%",Part des équipements/soins 100% santé dans le total des soins optiques,tx-equipements-optique,19,Corrèze,7.1,2020-10-31,8.11,2020-01-31,-1.0,-12.0,,,,%
