mesure,indicateur,id_indicateur,code_departement,libelle_departement,valeur_actuelle,date_valeur_actuelle,valeur_initiale,date_valeur_initiale,progression,pourcentage_progression,cible,pourcentage_cible,date_cible,unite
Lutter contre les impayés de pensions alimentaires,Nombre de familles bénéficiaires d'une pension alimentaire versée par l'intermédiaire du service public des pensions alimentaires,nb-familles-aripa,37,Indre-et-Loire,587.0,2022-02-28,0.0,2020-09-30,587.0,,2346,25.0,2022-12-31,familles
"Proposer une offre de lunettes, appareils auditifs et prothèses dentaires remboursée à 100%",Part des équipements vendus sans reste à charge dans le total des soins audio,tx-equipements-audio,37,Indre-et-Loire,32.1,2021-09-30,0.0,2018-12-31,32.0,,40,80.0,2022-12-31,%
"Proposer une offre de lunettes, appareils auditifs et prothèses dentaires remboursée à 100%",Part des équipements vendus sans reste à charge dans le total des soins dentaires,tx-equipements-dentaire,37,Indre-et-Loire,57.16,2021-09-30,0.0,2019-03-31,57.0,,45,100.0,2022-12-31,%
"Proposer une offre de lunettes, appareils auditifs et prothèses dentaires remboursée à 100%",Part des équipements vendus sans reste à charge dans le total des soins optiques,tx-equipements-optique,37,Indre-et-Loire,13.34,2021-09-30,0.0,2019-12-31,13.0,,20,67.0,2022-12-31,%
Doubler le nombre de maisons de santé et de centres de santé dans les territoires,Nombre de maisons de santé pluri-professionnelles,nb-maisons-sante,37,Indre-et-Loire,24.0,2021-12-31,15.0,2017-06-30,9.0,60.0,28,69.0,2022-12-31,maisons de santé
Doubler le nombre de maisons de santé et de centres de santé dans les territoires,Nombre de centres de santé,nb-centres-sante,37,Indre-et-Loire,2.0,2021-12-31,1.0,2017-12-31,1.0,100.0,6,20.0,2022-12-31,centres de santé
Allonger le congé paternité pour un meilleur développement de l’enfant,Nombre de pères / conjoints prenant un congé de paternité,nb-peres-conge-paternite,37,Indre-et-Loire,2932.0,2021-12-31,2660.0,2018-12-31,272.0,10.0,3419,36.0,2022-12-31,pères / conjoints dans l'année
Simplifier l’accès aux droits des personnes handicapées,Durée moyenne de traitement pour les demandes d’allocation adulte handicapé,duree-moyenne-traitement-demandes-allocation-adulte-handicape,37,Indre-et-Loire,6.6,2021-09-30,4.3,2017-12-31,2.0,53.0,3,0.0,2022-12-31,mois de traitement
Accompagner les aidants,Nombre de bénéficiaires d'un congé de proche aidant indemnisé,nb-beneficiaires-ajpa,37,Indre-et-Loire,40.0,2021-12-31,0.0,2020-09-30,40.0,,390,10.0,2022-12-31,bénéficiaires
