mesure,indicateur,id_indicateur,code_departement,libelle_departement,valeur_actuelle,date_valeur_actuelle,valeur_initiale,date_valeur_initiale,progression,pourcentage_progression,cible,pourcentage_cible,date_cible,unite
Doubler le nombre de maisons de santé,Nombre de maisons de santé pluri-professionnelles,nb-maisons-sante,83,Var,7.0,2020-06-30,3.0,2017-06-30,4.0,133.0,,,,maisons de santé
Allonger le congé paternité pour un meilleur développement de l’enfant,Nombre de pères / conjoints prenant un congé de paternité et d’accueil de l’enfant,nb-peres-conge-paternite,83,Var,4166.0,2019-12-31,,,,,,,,pères dans l'année
Simplifier l’accès aux droits des personnes handicapées,Durée moyenne de traitement pour les demandes d’allocation adulte handicapé,duree-moyenne-traitement-demandes-allocation-adulte-handicape,83,Var,4.1,2019-12-31,4.0,2017-12-31,0.0,2.0,3.0,-10.0,2022-12-31,mois de traitement
"Proposer une offre de lunettes, appareils auditifs et prothèses dentaires remboursée à 100%",Part des équipements/soins auditives 100% santé dans le total des soins,tx-equipements-audio,83,Var,9.82,2020-10-31,13.36,2019-03-31,-4.0,-26.0,,,,%
"Proposer une offre de lunettes, appareils auditifs et prothèses dentaires remboursée à 100%",Part des équipements/soins 100% santé dans le total des soins dentaires,tx-equipements-dentaire,83,Var,56.49,2020-09-30,24.66,2019-04-30,32.0,129.0,,,,%
"Proposer une offre de lunettes, appareils auditifs et prothèses dentaires remboursée à 100%",Part des équipements/soins 100% santé dans le total des soins optiques,tx-equipements-optique,83,Var,12.32,2020-10-31,8.45,2020-01-31,4.0,46.0,,,,%
