mesure,indicateur,id_indicateur,code_departement,libelle_departement,valeur_actuelle,date_valeur_actuelle,valeur_initiale,date_valeur_initiale,progression,pourcentage_progression,cible,pourcentage_cible,date_cible,unite
Lutter contre les impayés de pensions alimentaires,Nombre de familles bénéficiaires d'une pension alimentaire versée par l'intermédiaire du service public des pensions alimentaires,nb-familles-aripa,45,Loiret,59.0,2021-03-31,9.0,2020-12-31,50.0,556.0,,,,familles
"Proposer une offre de lunettes, appareils auditifs et prothèses dentaires remboursée à 100%",Part des équipements/soins auditives 100% santé dans le total des soins,tx-equipements-audio,45,Loiret,7.6,2020-12-31,8.89,2019-01-31,-1.0,-15.0,40.0,-4.0,2022-12-31,%
"Proposer une offre de lunettes, appareils auditifs et prothèses dentaires remboursée à 100%",Part des équipements/soins 100% santé dans le total des soins dentaires,tx-equipements-dentaire,45,Loiret,52.18,2020-12-31,33.98,2019-04-30,18.0,54.0,45.0,165.0,2022-12-31,%
"Proposer une offre de lunettes, appareils auditifs et prothèses dentaires remboursée à 100%",Part des équipements/soins 100% santé dans le total des soins optiques,tx-equipements-optique,45,Loiret,12.6,2020-12-31,14.48,2020-01-31,-2.0,-13.0,20.0,-34.0,2022-12-31,%
Doubler le nombre de maisons de santé et de centres de santé dans les territoires,Nombre de maisons de santé pluri-professionnelles,nb-maisons-sante,45,Loiret,25.0,2020-12-31,19.0,2017-06-30,6.0,32.0,30.0,55.0,2022-12-31,maisons de santé
Allonger le congé paternité pour un meilleur développement de l’enfant,Nombre de pères / conjoints prenant un congé de paternité et d’accueil de l’enfant,nb-peres-conge-paternite,45,Loiret,3256.0,2020-12-31,3409.0,2019-12-31,-153.0,-4.0,3771.0,-42.0,2022-12-31,pères / conjoints dans l'année
Simplifier l’accès aux droits des personnes handicapées,Durée moyenne de traitement pour les demandes d’allocation adulte handicapé,duree-moyenne-traitement-demandes-allocation-adulte-handicape,45,Loiret,4.2,2019-12-31,3.2,2017-12-31,1.0,31.0,3.0,-500.0,2022-12-31,mois de traitement
