mesure,indicateur,id_indicateur,code_departement,libelle_departement,valeur_actuelle,date_valeur_actuelle,valeur_initiale,date_valeur_initiale,progression,pourcentage_progression,cible,pourcentage_cible,date_cible,unite
Lutter contre les impayés de pensions alimentaires,Nombre de familles bénéficiaires d'une pension alimentaire versée par l'intermédiaire du service public des pensions alimentaires,nb-familles-aripa,69,Rhône,91.0,2021-03-31,21.0,2020-12-31,70.0,333.0,,,,familles
"Proposer une offre de lunettes, appareils auditifs et prothèses dentaires remboursée à 100%",Part des équipements/soins auditives 100% santé dans le total des soins,tx-equipements-audio,69,Rhône,6.63,2020-12-31,8.9,2019-01-31,-2.0,-26.0,40.0,-7.0,2022-12-31,%
"Proposer une offre de lunettes, appareils auditifs et prothèses dentaires remboursée à 100%",Part des équipements/soins 100% santé dans le total des soins dentaires,tx-equipements-dentaire,69,Rhône,42.29,2020-12-31,23.23,2019-04-30,19.0,82.0,45.0,88.0,2022-12-31,%
"Proposer une offre de lunettes, appareils auditifs et prothèses dentaires remboursée à 100%",Part des équipements/soins 100% santé dans le total des soins optiques,tx-equipements-optique,69,Rhône,13.93,2020-12-31,18.52,2020-01-31,-5.0,-25.0,20.0,-310.0,2022-12-31,%
Doubler le nombre de maisons de santé et de centres de santé dans les territoires,Nombre de maisons de santé pluri-professionnelles,nb-maisons-sante,69,Rhône,35.0,2020-12-31,14.0,2017-06-30,21.0,150.0,41.0,78.0,2022-12-31,maisons de santé
Doubler le nombre de maisons de santé et de centres de santé dans les territoires,Nombre de centres de santé,nb-centres-sante,69,Rhône,9.0,2020-12-31,,,,,,,,centres de santé
Allonger le congé paternité pour un meilleur développement de l’enfant,Nombre de pères / conjoints prenant un congé de paternité et d’accueil de l’enfant,nb-peres-conge-paternite,69,Rhône,11691.0,2020-12-31,11925.0,2019-12-31,-234.0,-2.0,13612.0,-14.0,2022-12-31,pères / conjoints dans l'année
Simplifier l’accès aux droits des personnes handicapées,Durée moyenne de traitement pour les demandes d’allocation adulte handicapé,duree-moyenne-traitement-demandes-allocation-adulte-handicape,69,Rhône,4.8,2020-12-31,4.8,2020-12-31,0.0,0.0,3.0,-0.0,2022-12-31,mois de traitement
