mesure,indicateur,id_indicateur,code_departement,libelle_departement,valeur_actuelle,date_valeur_actuelle,valeur_initiale,date_valeur_initiale,progression,pourcentage_progression,cible,pourcentage_cible,date_cible,unite
Lutter contre les impayés de pensions alimentaires,Nombre de familles bénéficiaires d'une pension alimentaire versée par l'intermédiaire du service public des pensions alimentaires,nb-familles-aripa,14,Calvados,130.0,2021-06-30,13.0,2020-12-31,117.0,900.0,,,,familles
"Proposer une offre de lunettes, appareils auditifs et prothèses dentaires remboursée à 100%",Part des équipements vendus sans reste à charge dans le total des soins audio,tx-equipements-audio,14,Calvados,6.28,2020-12-31,6.51,2019-01-31,-0.0,-4.0,40.0,0.0,2022-12-31,%
"Proposer une offre de lunettes, appareils auditifs et prothèses dentaires remboursée à 100%",Part des équipements vendus sans reste à charge dans le total des soins dentaires,tx-equipements-dentaire,14,Calvados,52.86,2020-12-31,32.57,2019-04-30,20.0,62.0,45.0,100.0,2022-12-31,%
"Proposer une offre de lunettes, appareils auditifs et prothèses dentaires remboursée à 100%",Part des équipements vendus sans reste à charge dans le total des soins optiques,tx-equipements-optique,14,Calvados,12.2,2020-12-31,15.85,2020-01-31,-4.0,-23.0,20.0,0.0,2022-12-31,%
Doubler le nombre de maisons de santé et de centres de santé dans les territoires,Nombre de maisons de santé pluri-professionnelles,nb-maisons-sante,14,Calvados,16.0,2021-06-30,10.0,2017-06-30,6.0,60.0,16.0,100.0,2022-12-31,maisons de santé
Doubler le nombre de maisons de santé et de centres de santé dans les territoires,Nombre de centres de santé,nb-centres-sante,14,Calvados,2.0,2020-12-31,,,,,6.0,,2022-12-31,centres de santé
Allonger le congé paternité pour un meilleur développement de l’enfant,Nombre de pères / conjoints prenant un congé de paternité,nb-peres-conge-paternite,14,Calvados,3069.0,2020-12-31,3115.0,2018-12-31,-46.0,-1.0,3623.0,0.0,2022-12-31,pères / conjoints dans l'année
Simplifier l’accès aux droits des personnes handicapées,Durée moyenne de traitement pour les demandes d’allocation adulte handicapé,duree-moyenne-traitement-demandes-allocation-adulte-handicape,14,Calvados,5.2,2020-12-31,7.9,2017-12-31,-3.0,-34.0,3.0,55.0,2022-12-31,mois de traitement
Accompagner les aidants,Nombre de bénéficiaires d'un congé de proche aidant indemnisé,nb-beneficiaires-ajpa,14,Calvados,28.0,2021-03-31,,,,,525.0,,2022-12-31,bénéficiaires
