mesure,indicateur,id_indicateur,code_departement,libelle_departement,valeur_actuelle,date_valeur_actuelle,valeur_initiale,date_valeur_initiale,progression,pourcentage_progression,cible,pourcentage_cible,date_cible,unite
Lutter contre les impayés de pensions alimentaires,Nombre de familles bénéficiaires d'une pension alimentaire versée par l'intermédiaire du service public des pensions alimentaires,nb-familles-aripa,74,Haute-Savoie,50.0,2021-03-31,10.0,2020-12-31,40.0,400.0,,,,familles
"Proposer une offre de lunettes, appareils auditifs et prothèses dentaires remboursée à 100%",Part des équipements/soins auditives 100% santé dans le total des soins,tx-equipements-audio,74,Haute-Savoie,3.89,2020-12-31,6.08,2019-01-31,-2.0,-36.0,40.0,-6.0,2022-12-31,%
"Proposer une offre de lunettes, appareils auditifs et prothèses dentaires remboursée à 100%",Part des équipements/soins 100% santé dans le total des soins dentaires,tx-equipements-dentaire,74,Haute-Savoie,45.47,2020-12-31,24.36,2019-04-30,21.0,87.0,45.0,102.0,2022-12-31,%
"Proposer une offre de lunettes, appareils auditifs et prothèses dentaires remboursée à 100%",Part des équipements/soins 100% santé dans le total des soins optiques,tx-equipements-optique,74,Haute-Savoie,9.16,2020-12-31,10.87,2020-01-31,-2.0,-16.0,20.0,-19.0,2022-12-31,%
Doubler le nombre de maisons de santé et de centres de santé dans les territoires,Nombre de maisons de santé pluri-professionnelles,nb-maisons-sante,74,Haute-Savoie,21.0,2020-12-31,15.0,2017-06-30,6.0,40.0,24.0,67.0,2022-12-31,maisons de santé
Doubler le nombre de maisons de santé et de centres de santé dans les territoires,Nombre de centres de santé,nb-centres-sante,74,Haute-Savoie,1.0,2020-12-31,,,,,,,,centres de santé
Allonger le congé paternité pour un meilleur développement de l’enfant,Nombre de pères / conjoints prenant un congé de paternité et d’accueil de l’enfant,nb-peres-conge-paternite,74,Haute-Savoie,3106.0,2020-12-31,3053.0,2019-12-31,53.0,2.0,3609.0,10.0,2022-12-31,pères / conjoints dans l'année
Simplifier l’accès aux droits des personnes handicapées,Durée moyenne de traitement pour les demandes d’allocation adulte handicapé,duree-moyenne-traitement-demandes-allocation-adulte-handicape,74,Haute-Savoie,4.8,2020-12-31,6.4,2017-12-31,-2.0,-25.0,3.0,47.0,2022-12-31,mois de traitement
