mesure,indicateur,id_indicateur,code_departement,libelle_departement,valeur_actuelle,date_valeur_actuelle,valeur_initiale,date_valeur_initiale,progression,pourcentage_progression,cible,pourcentage_cible,date_cible,unite
Lutter contre les impayés de pensions alimentaires,Nombre de familles bénéficiaires d'une pension alimentaire versée par l'intermédiaire du service public des pensions alimentaires,nb-familles-aripa,2A,Corse-du-Sud,4.0,2021-03-31,2.0,2020-12-31,2.0,100.0,,,,familles
"Proposer une offre de lunettes, appareils auditifs et prothèses dentaires remboursée à 100%",Part des équipements/soins 100% santé dans le total des soins dentaires,tx-equipements-dentaire,2A,Corse-du-Sud,61.02,2020-12-31,21.17,2019-04-30,40.0,188.0,45.0,167.0,2022-12-31,%
Doubler le nombre de maisons de santé et de centres de santé dans les territoires,Nombre de maisons de santé pluri-professionnelles,nb-maisons-sante,2A,Corse-du-Sud,2.0,2020-12-31,2.0,2017-06-30,0.0,0.0,3.0,0.0,2022-12-31,maisons de santé
Allonger le congé paternité pour un meilleur développement de l’enfant,Nombre de pères / conjoints prenant un congé de paternité et d’accueil de l’enfant,nb-peres-conge-paternite,2A,Corse-du-Sud,463.0,2020-12-31,471.0,2019-12-31,-8.0,-2.0,581.0,-7.0,2022-12-31,pères / conjoints dans l'année
Simplifier l’accès aux droits des personnes handicapées,Durée moyenne de traitement pour les demandes d’allocation adulte handicapé,duree-moyenne-traitement-demandes-allocation-adulte-handicape,2A,Corse-du-Sud,2.5,2019-12-31,2.5,2018-12-31,0.0,0.0,3.0,0.0,2022-12-31,mois de traitement
