mesure,indicateur,id_indicateur,code_departement,libelle_departement,valeur_actuelle,date_valeur_actuelle,valeur_initiale,date_valeur_initiale,progression,pourcentage_progression,cible,pourcentage_cible,date_cible,unite
Lutter contre les impayés de pensions alimentaires,Nombre de familles bénéficiaires d'une pension alimentaire versée par l'intermédiaire du service public des pensions alimentaires,nb-familles-aripa,71,Saône-et-Loire,360.0,2021-12-31,0.0,2020-09-30,360.0,,1900,19.0,2022-12-31,familles
"Proposer une offre de lunettes, appareils auditifs et prothèses dentaires remboursée à 100%",Part des équipements vendus sans reste à charge dans le total des soins audio,tx-equipements-audio,71,Saône-et-Loire,29.6,2021-09-30,0.0,2018-12-31,30.0,,40,74.0,2022-12-31,%
"Proposer une offre de lunettes, appareils auditifs et prothèses dentaires remboursée à 100%",Part des équipements vendus sans reste à charge dans le total des soins dentaires,tx-equipements-dentaire,71,Saône-et-Loire,61.87,2021-09-30,0.0,2019-03-31,62.0,,45,100.0,2022-12-31,%
"Proposer une offre de lunettes, appareils auditifs et prothèses dentaires remboursée à 100%",Part des équipements vendus sans reste à charge dans le total des soins optiques,tx-equipements-optique,71,Saône-et-Loire,13.3,2021-09-30,0.0,2019-12-31,13.0,,20,66.0,2022-12-31,%
Doubler le nombre de maisons de santé et de centres de santé dans les territoires,Nombre de maisons de santé pluri-professionnelles,nb-maisons-sante,71,Saône-et-Loire,34.0,2021-06-30,24.0,2017-06-30,10.0,42.0,35,91.0,2022-12-31,maisons de santé
Doubler le nombre de maisons de santé et de centres de santé dans les territoires,Nombre de centres de santé,nb-centres-sante,71,Saône-et-Loire,4.0,2021-06-30,1.0,2017-12-31,3.0,300.0,6,60.0,2022-12-31,centres de santé
Allonger le congé paternité pour un meilleur développement de l’enfant,Nombre de pères / conjoints prenant un congé de paternité,nb-peres-conge-paternite,71,Saône-et-Loire,2005.0,2020-12-31,2268.0,2018-12-31,-263.0,-12.0,2801,0.0,2022-12-31,pères / conjoints dans l'année
Simplifier l’accès aux droits des personnes handicapées,Durée moyenne de traitement pour les demandes d’allocation adulte handicapé,duree-moyenne-traitement-demandes-allocation-adulte-handicape,71,Saône-et-Loire,2.68,2021-06-30,2.6,2017-12-31,0.0,3.0,3,100.0,2022-12-31,mois de traitement
Accompagner les aidants,Nombre de bénéficiaires d'un congé de proche aidant indemnisé,nb-beneficiaires-ajpa,71,Saône-et-Loire,54.0,2021-12-31,0.0,2020-09-30,54.0,,555,10.0,2022-12-31,bénéficiaires
