mesure,indicateur,id_indicateur,code_departement,libelle_departement,valeur_actuelle,date_valeur_actuelle,valeur_initiale,date_valeur_initiale,progression,pourcentage_progression,cible,pourcentage_cible,date_cible,unite
Lutter contre les impayés de pensions alimentaires,Nombre de familles bénéficiaires d'une pension alimentaire versée par l'intermédiaire du service public des pensions alimentaires,nb-familles-aripa,47,Lot-et-Garonne,317.0,2021-10-31,4.0,2020-12-31,313.0,7825.0,1199.0,26.0,2022-12-31,familles
"Proposer une offre de lunettes, appareils auditifs et prothèses dentaires remboursée à 100%",Part des équipements vendus sans reste à charge dans le total des soins audio,tx-equipements-audio,47,Lot-et-Garonne,40.49,2021-09-30,5.06,2019-01-31,35.0,700.0,40.0,100.0,2022-12-31,%
"Proposer une offre de lunettes, appareils auditifs et prothèses dentaires remboursée à 100%",Part des équipements vendus sans reste à charge dans le total des soins dentaires,tx-equipements-dentaire,47,Lot-et-Garonne,63.35,2021-09-30,0.0,2019-01-31,63.0,,45.0,100.0,2022-12-31,%
"Proposer une offre de lunettes, appareils auditifs et prothèses dentaires remboursée à 100%",Part des équipements vendus sans reste à charge dans le total des soins optiques,tx-equipements-optique,47,Lot-et-Garonne,18.62,2021-09-30,0.0,2019-01-31,19.0,,20.0,93.0,2022-12-31,%
Doubler le nombre de maisons de santé et de centres de santé dans les territoires,Nombre de maisons de santé pluri-professionnelles,nb-maisons-sante,47,Lot-et-Garonne,12.0,2021-06-30,9.0,2017-06-30,3.0,33.0,15.0,50.0,2022-12-31,maisons de santé
Doubler le nombre de maisons de santé et de centres de santé dans les territoires,Nombre de centres de santé,nb-centres-sante,47,Lot-et-Garonne,0.0,2021-06-30,,,,,2.0,,2022-12-31,centres de santé
Allonger le congé paternité pour un meilleur développement de l’enfant,Nombre de pères / conjoints prenant un congé de paternité,nb-peres-conge-paternite,47,Lot-et-Garonne,1149.0,2020-12-31,1151.0,2018-12-31,-2.0,-0.0,1375.0,0.0,2022-12-31,pères / conjoints dans l'année
Simplifier l’accès aux droits des personnes handicapées,Durée moyenne de traitement pour les demandes d’allocation adulte handicapé,duree-moyenne-traitement-demandes-allocation-adulte-handicape,47,Lot-et-Garonne,3.0,2021-06-30,3.2,2017-12-31,-0.0,-6.0,3.0,100.0,2022-12-31,mois de traitement
Accompagner les aidants,Nombre de bénéficiaires d'un congé de proche aidant indemnisé,nb-beneficiaires-ajpa,47,Lot-et-Garonne,47.0,2021-11-30,,,,,235.0,,2022-12-31,bénéficiaires
