mesure,indicateur,id_indicateur,code_departement,libelle_departement,valeur_actuelle,date_valeur_actuelle,valeur_initiale,date_valeur_initiale,progression,pourcentage_progression,cible,pourcentage_cible,date_cible,unite
Lutter contre les impayés de pensions alimentaires,Nombre de familles bénéficiaires d'une pension alimentaire versée par l'intermédiaire du service public des pensions alimentaires,nb-familles-aripa,10,Aube,35.0,2021-03-31,17.0,2020-12-31,18.0,106.0,,,,familles
"Proposer une offre de lunettes, appareils auditifs et prothèses dentaires remboursée à 100%",Part des équipements/soins auditives 100% santé dans le total des soins,tx-equipements-audio,10,Aube,11.11,2020-12-31,6.48,2019-01-31,5.0,71.0,40.0,14.0,2022-12-31,%
"Proposer une offre de lunettes, appareils auditifs et prothèses dentaires remboursée à 100%",Part des équipements/soins 100% santé dans le total des soins dentaires,tx-equipements-dentaire,10,Aube,65.07,2020-12-31,36.31,2019-04-30,29.0,79.0,45.0,331.0,2022-12-31,%
"Proposer une offre de lunettes, appareils auditifs et prothèses dentaires remboursée à 100%",Part des équipements/soins 100% santé dans le total des soins optiques,tx-equipements-optique,10,Aube,16.18,2020-12-31,20.11,2020-01-31,-4.0,-20.0,20.0,3573.0,2022-12-31,%
Doubler le nombre de maisons de santé et de centres de santé dans les territoires,Nombre de maisons de santé pluri-professionnelles,nb-maisons-sante,10,Aube,14.0,2020-12-31,7.0,2017-06-30,7.0,100.0,21.0,50.0,2022-12-31,maisons de santé
Doubler le nombre de maisons de santé et de centres de santé dans les territoires,Nombre de centres de santé,nb-centres-sante,10,Aube,4.0,2020-12-31,,,,,,,,centres de santé
Allonger le congé paternité pour un meilleur développement de l’enfant,Nombre de pères / conjoints prenant un congé de paternité et d’accueil de l’enfant,nb-peres-conge-paternite,10,Aube,1138.0,2020-12-31,1213.0,2019-12-31,-75.0,-6.0,1422.0,-36.0,2022-12-31,pères / conjoints dans l'année
Simplifier l’accès aux droits des personnes handicapées,Durée moyenne de traitement pour les demandes d’allocation adulte handicapé,duree-moyenne-traitement-demandes-allocation-adulte-handicape,10,Aube,2.7,2020-12-31,3.3,2018-12-31,-1.0,-18.0,3.0,200.0,2022-12-31,mois de traitement
