mesure,indicateur,id_indicateur,code_departement,libelle_departement,valeur_actuelle,date_valeur_actuelle,valeur_initiale,date_valeur_initiale,progression,pourcentage_progression,cible,pourcentage_cible,date_cible,unite
Lutter contre les impayés de pensions alimentaires,Nombre de familles bénéficiaires d'une pension alimentaire versée par l'intermédiaire du service public des pensions alimentaires,nb-familles-aripa,23,Creuse,19.0,2021-06-30,2.0,2020-12-31,17.0,850.0,,,,familles
"Proposer une offre de lunettes, appareils auditifs et prothèses dentaires remboursée à 100%",Part des équipements vendus sans reste à charge dans le total des soins audio,tx-equipements-audio,23,Creuse,10.1,2020-12-31,0.0,2019-01-31,10.0,,40.0,25.0,2022-12-31,%
"Proposer une offre de lunettes, appareils auditifs et prothèses dentaires remboursée à 100%",Part des équipements vendus sans reste à charge dans le total des soins dentaires,tx-equipements-dentaire,23,Creuse,72.74,2020-12-31,41.43,2019-04-30,31.0,76.0,45.0,100.0,2022-12-31,%
"Proposer une offre de lunettes, appareils auditifs et prothèses dentaires remboursée à 100%",Part des équipements vendus sans reste à charge dans le total des soins optiques,tx-equipements-optique,23,Creuse,13.47,2020-12-31,14.74,2020-01-31,-1.0,-9.0,20.0,0.0,2022-12-31,%
Doubler le nombre de maisons de santé et de centres de santé dans les territoires,Nombre de maisons de santé pluri-professionnelles,nb-maisons-sante,23,Creuse,5.0,2021-06-30,3.0,2017-06-30,2.0,67.0,6.0,67.0,2022-12-31,maisons de santé
Allonger le congé paternité pour un meilleur développement de l’enfant,Nombre de pères / conjoints prenant un congé de paternité,nb-peres-conge-paternite,23,Creuse,247.0,2020-12-31,286.0,2018-12-31,-39.0,-14.0,362.0,0.0,2022-12-31,pères / conjoints dans l'année
Simplifier l’accès aux droits des personnes handicapées,Durée moyenne de traitement pour les demandes d’allocation adulte handicapé,duree-moyenne-traitement-demandes-allocation-adulte-handicape,23,Creuse,7.6,2020-12-31,5.3,2017-12-31,2.0,43.0,3.0,0.0,2022-12-31,mois de traitement
Accompagner les aidants,Nombre de bénéficiaires d'un congé de proche aidant indemnisé,nb-beneficiaires-ajpa,23,Creuse,17.0,2021-03-31,,,,,130.0,,2022-12-31,bénéficiaires
