mesure,indicateur,id_indicateur,code_region,libelle_region,valeur_actuelle,date_valeur_actuelle,valeur_initiale,date_valeur_initiale,progression,pourcentage_progression,cible,pourcentage_cible,date_cible,unite
Lutter contre les impayés de pensions alimentaires,Nombre de familles bénéficiaires d'une pension alimentaire versée par l'intermédiaire du service public des pensions alimentaires,nb-familles-aripa,93,Provence-Alpes-Côte d'Azur,2491.0,2021-10-31,83.0,2020-12-31,2408.0,2901.0,21096.0,11.0,2022-12-31,familles
"Proposer une offre de lunettes, appareils auditifs et prothèses dentaires remboursée à 100%",Part des équipements vendus sans reste à charge dans le total des soins audio,tx-equipements-audio,93,Provence-Alpes-Côte d'Azur,43.37,2021-09-30,12.68,2019-01-31,31.0,242.0,40.0,100.0,2022-12-31,%
"Proposer une offre de lunettes, appareils auditifs et prothèses dentaires remboursée à 100%",Part des équipements vendus sans reste à charge dans le total des soins dentaires,tx-equipements-dentaire,93,Provence-Alpes-Côte d'Azur,60.25,2021-09-30,28.57,2019-04-30,32.0,111.0,45.0,100.0,2022-12-31,%
"Proposer une offre de lunettes, appareils auditifs et prothèses dentaires remboursée à 100%",Part des équipements vendus sans reste à charge dans le total des soins optiques,tx-equipements-optique,93,Provence-Alpes-Côte d'Azur,21.69,2021-09-30,21.0,2020-01-31,1.0,3.0,20.0,100.0,2022-12-31,%
Doubler le nombre de maisons de santé et de centres de santé dans les territoires,Nombre de maisons de santé pluri-professionnelles,nb-maisons-sante,93,Provence-Alpes-Côte d'Azur,90.0,2021-06-30,19.0,2017-06-30,71.0,374.0,113.0,76.0,2022-12-31,maisons de santé
Doubler le nombre de maisons de santé et de centres de santé dans les territoires,Nombre de centres de santé,nb-centres-sante,93,Provence-Alpes-Côte d'Azur,25.0,2021-06-30,,,,,47.0,,2022-12-31,centres de santé
Allonger le congé paternité pour un meilleur développement de l’enfant,Nombre de pères / conjoints prenant un congé de paternité,nb-peres-conge-paternite,93,Provence-Alpes-Côte d'Azur,19969.0,2020-12-31,20454.0,2018-12-31,-485.0,-2.0,23462.0,0.0,2022-12-31,pères / conjoints dans l'année
Accompagner les aidants,Nombre de bénéficiaires d'un congé de proche aidant indemnisé,nb-beneficiaires-ajpa,93,Provence-Alpes-Côte d'Azur,504.0,2021-11-30,,,,,3690.0,,2022-12-31,bénéficiaires
