mesure,indicateur,id_indicateur,code_region,libelle_region,valeur_actuelle,date_valeur_actuelle,valeur_initiale,date_valeur_initiale,progression,pourcentage_progression,cible,pourcentage_cible,date_cible,unite
Lutter contre les impayés de pensions alimentaires,Nombre de familles bénéficiaires d'une pension alimentaire versée par l'intermédiaire du service public des pensions alimentaires,nb-familles-aripa,93,Provence-Alpes-Côte d'Azur,7209.0,2022-10-31,0.0,2020-09-30,7209.0,,21096.0,34.0,2022-12-31,familles
"Proposer une offre de lunettes, appareils auditifs et prothèses dentaires remboursée à 100%",Part des équipements vendus sans reste à charge dans le total des soins audio,tx-equipements-audio,93,Provence-Alpes-Côte d'Azur,42.78,2022-06-30,0.0,2018-12-31,43.0,,,,,%
"Proposer une offre de lunettes, appareils auditifs et prothèses dentaires remboursée à 100%",Part des équipements vendus sans reste à charge dans le total des soins dentaires,tx-equipements-dentaire,93,Provence-Alpes-Côte d'Azur,59.16,2022-06-30,0.0,2019-03-31,59.0,,,,,%
"Proposer une offre de lunettes, appareils auditifs et prothèses dentaires remboursée à 100%",Part des équipements vendus sans reste à charge dans le total des soins optiques,tx-equipements-optique,93,Provence-Alpes-Côte d'Azur,23.39,2022-06-30,0.0,2019-12-31,23.0,,,,,%
Doubler le nombre de maisons de santé et de centres de santé dans les territoires,Nombre de maisons de santé pluri-professionnelles,nb-maisons-sante,93,Provence-Alpes-Côte d'Azur,110.0,2022-12-31,19.0,2017-06-30,91.0,479.0,113.0,97.0,2022-12-31,maisons de santé
Doubler le nombre de maisons de santé et de centres de santé dans les territoires,Nombre de centres de santé,nb-centres-sante,93,Provence-Alpes-Côte d'Azur,26.0,2021-12-31,21.0,2017-12-31,5.0,24.0,47.0,19.0,2022-12-31,centres de santé
Allonger le congé paternité pour un meilleur développement de l’enfant,Nombre de pères / conjoints prenant un congé de paternité,nb-peres-conge-paternite,93,Provence-Alpes-Côte d'Azur,23337.0,2021-12-31,20454.0,2018-12-31,2883.0,14.0,23462.0,96.0,2022-12-31,pères / conjoints dans l'année
Accompagner les aidants,Nombre de bénéficiaires d'un congé de proche aidant indemnisé,nb-beneficiaires-ajpa,93,Provence-Alpes-Côte d'Azur,845.0,2022-12-31,0.0,2020-09-30,845.0,,3690.0,23.0,2022-12-31,bénéficiaires
