mesure,indicateur,id_indicateur,code_region,libelle_region,valeur_actuelle,date_valeur_actuelle,valeur_initiale,date_valeur_initiale,progression,pourcentage_progression,cible,pourcentage_cible,date_cible,unite
Lutter contre les impayés de pensions alimentaires,Nombre de familles bénéficiaires d'une pension alimentaire versée par l'intermédiaire du service public des pensions alimentaires,nb-familles-aripa,03,Guyane,10.0,2021-06-30,3.0,2020-12-31,7.0,233.0,,,,familles
"Proposer une offre de lunettes, appareils auditifs et prothèses dentaires remboursée à 100%",Part des équipements vendus sans reste à charge dans le total des soins audio,tx-equipements-audio,03,Guyane,0.0,2020-10-31,0.0,2019-01-31,0.0,,40.0,0.0,2022-12-31,%
"Proposer une offre de lunettes, appareils auditifs et prothèses dentaires remboursée à 100%",Part des équipements vendus sans reste à charge dans le total des soins dentaires,tx-equipements-dentaire,03,Guyane,46.89,2020-09-30,16.97,2019-04-30,30.0,176.0,45.0,100.0,2022-12-31,%
"Proposer une offre de lunettes, appareils auditifs et prothèses dentaires remboursée à 100%",Part des équipements vendus sans reste à charge dans le total des soins optiques,tx-equipements-optique,03,Guyane,33.17,2020-10-31,36.8,2020-01-31,-4.0,-10.0,20.0,100.0,2022-12-31,%
Doubler le nombre de maisons de santé et de centres de santé dans les territoires,Nombre de maisons de santé pluri-professionnelles,nb-maisons-sante,03,Guyane,5.0,2021-06-30,3.0,2017-06-30,2.0,67.0,5.0,100.0,2022-12-31,maisons de santé
Doubler le nombre de maisons de santé et de centres de santé dans les territoires,Nombre de centres de santé,nb-centres-sante,03,Guyane,0.0,2020-12-31,,,,,2.0,,2022-12-31,centres de santé
Allonger le congé paternité pour un meilleur développement de l’enfant,Nombre de pères / conjoints prenant un congé de paternité,nb-peres-conge-paternite,03,Guyane,279.0,2020-12-31,215.0,2018-12-31,64.0,30.0,362.0,44.0,2022-12-31,pères / conjoints dans l'année
Simplifier l’accès aux droits des personnes handicapées,Durée moyenne de traitement pour les demandes d’allocation adulte handicapé,duree-moyenne-traitement-demandes-allocation-adulte-handicape,03,Guyane,8.2,2019-12-31,9.5,2017-12-31,-1.0,-14.0,3.0,20.0,2022-12-31,mois de traitement
Accompagner les aidants,Nombre de bénéficiaires d'un congé de proche aidant indemnisé,nb-beneficiaires-ajpa,03,Guyane,1.0,2021-03-31,,,,,90.0,,2022-12-31,bénéficiaires
