mesure,indicateur,id_indicateur,code_region,libelle_region,valeur_actuelle,date_valeur_actuelle,valeur_initiale,date_valeur_initiale,progression,pourcentage_progression,cible,pourcentage_cible,date_cible,unite
Lutter contre les impayés de pensions alimentaires,Nombre de familles bénéficiaires d'une pension alimentaire versée par l'intermédiaire du service public des pensions alimentaires,nb-familles-aripa,94,Corse,227.0,2022-10-31,0.0,2020-09-30,227.0,,946.0,24.0,2022-12-31,familles
"Proposer une offre de lunettes, appareils auditifs et prothèses dentaires remboursée à 100%",Part des équipements vendus sans reste à charge dans le total des soins audio,tx-equipements-audio,94,Corse,55.73,2022-06-30,0.0,2018-12-31,56.0,,,,,%
"Proposer une offre de lunettes, appareils auditifs et prothèses dentaires remboursée à 100%",Part des équipements vendus sans reste à charge dans le total des soins dentaires,tx-equipements-dentaire,94,Corse,64.58,2022-06-30,0.0,2019-03-31,65.0,,,,,%
"Proposer une offre de lunettes, appareils auditifs et prothèses dentaires remboursée à 100%",Part des équipements vendus sans reste à charge dans le total des soins optiques,tx-equipements-optique,94,Corse,21.01,2022-06-30,0.0,2019-12-31,21.0,,,,,%
Doubler le nombre de maisons de santé et de centres de santé dans les territoires,Nombre de maisons de santé pluri-professionnelles,nb-maisons-sante,94,Corse,6.0,2022-12-31,4.0,2017-06-30,2.0,50.0,7.0,67.0,2022-12-31,maisons de santé
Doubler le nombre de maisons de santé et de centres de santé dans les territoires,Nombre de centres de santé,nb-centres-sante,94,Corse,0.0,2021-12-31,0.0,2017-12-31,0.0,,3.0,0.0,2022-12-31,centres de santé
Allonger le congé paternité pour un meilleur développement de l’enfant,Nombre de pères / conjoints prenant un congé de paternité,nb-peres-conge-paternite,94,Corse,1072.0,2021-12-31,941.0,2018-12-31,131.0,14.0,1242.0,44.0,2022-12-31,pères / conjoints dans l'année
Accompagner les aidants,Nombre de bénéficiaires d'un congé de proche aidant indemnisé,nb-beneficiaires-ajpa,94,Corse,145.0,2022-12-31,0.0,2020-09-30,145.0,,480.0,30.0,2022-12-31,bénéficiaires
