mesure,indicateur,id_indicateur,code_region,libelle_region,valeur_actuelle,date_valeur_actuelle,valeur_initiale,date_valeur_initiale,progression,pourcentage_progression,cible,pourcentage_cible,date_cible,unite
Lutter contre les impayés de pensions alimentaires,Nombre de familles bénéficiaires d'une pension alimentaire versée par l'intermédiaire du service public des pensions alimentaires,nb-familles-aripa,52,Pays de la Loire,2521.0,2022-02-28,0.0,2020-09-30,2521.0,,11151.0,23.0,2022-12-31,familles
"Proposer une offre de lunettes, appareils auditifs et prothèses dentaires remboursée à 100%",Part des équipements vendus sans reste à charge dans le total des soins audio,tx-equipements-audio,52,Pays de la Loire,32.25,2021-09-30,0.0,2018-12-31,32.0,,,,,%
"Proposer une offre de lunettes, appareils auditifs et prothèses dentaires remboursée à 100%",Part des équipements vendus sans reste à charge dans le total des soins dentaires,tx-equipements-dentaire,52,Pays de la Loire,62.42,2021-09-30,0.0,2019-03-31,62.0,,,,,%
"Proposer une offre de lunettes, appareils auditifs et prothèses dentaires remboursée à 100%",Part des équipements vendus sans reste à charge dans le total des soins optiques,tx-equipements-optique,52,Pays de la Loire,12.47,2021-09-30,0.0,2019-12-31,12.0,,,,,%
Doubler le nombre de maisons de santé et de centres de santé dans les territoires,Nombre de maisons de santé pluri-professionnelles,nb-maisons-sante,52,Pays de la Loire,113.0,2021-12-31,73.0,2017-06-30,40.0,55.0,111.0,100.0,2022-12-31,maisons de santé
Doubler le nombre de maisons de santé et de centres de santé dans les territoires,Nombre de centres de santé,nb-centres-sante,52,Pays de la Loire,15.0,2021-12-31,5.0,2017-12-31,10.0,200.0,34.0,34.0,2022-12-31,centres de santé
Allonger le congé paternité pour un meilleur développement de l’enfant,Nombre de pères / conjoints prenant un congé de paternité,nb-peres-conge-paternite,52,Pays de la Loire,22037.0,2021-12-31,20658.0,2018-12-31,1379.0,7.0,23984.0,41.0,2022-12-31,pères / conjoints dans l'année
Accompagner les aidants,Nombre de bénéficiaires d'un congé de proche aidant indemnisé,nb-beneficiaires-ajpa,52,Pays de la Loire,252.0,2021-12-31,0.0,2020-09-30,252.0,,1960.0,13.0,2022-12-31,bénéficiaires
