mesure,indicateur,id_indicateur,code_region,libelle_region,valeur_actuelle,date_valeur_actuelle,valeur_initiale,date_valeur_initiale,progression,pourcentage_progression,cible,pourcentage_cible,date_cible,unite
Lutter contre les impayés de pensions alimentaires,Nombre de familles bénéficiaires d'une pension alimentaire versée par l'intermédiaire du service public des pensions alimentaires,nb-familles-aripa,52,Pays de la Loire,678.0,2021-06-30,82.0,2020-12-31,596.0,727.0,,,,familles
"Proposer une offre de lunettes, appareils auditifs et prothèses dentaires remboursée à 100%",Part des équipements vendus sans reste à charge dans le total des soins audio,tx-equipements-audio,52,Pays de la Loire,7.43,2020-10-31,6.9,2019-01-31,1.0,8.0,40.0,2.0,2022-12-31,%
"Proposer une offre de lunettes, appareils auditifs et prothèses dentaires remboursée à 100%",Part des équipements vendus sans reste à charge dans le total des soins dentaires,tx-equipements-dentaire,52,Pays de la Loire,59.63,2020-09-30,33.73,2019-04-30,26.0,77.0,45.0,100.0,2022-12-31,%
"Proposer une offre de lunettes, appareils auditifs et prothèses dentaires remboursée à 100%",Part des équipements vendus sans reste à charge dans le total des soins optiques,tx-equipements-optique,52,Pays de la Loire,6.57,2020-10-31,8.04,2020-01-31,-1.0,-18.0,20.0,0.0,2022-12-31,%
Doubler le nombre de maisons de santé et de centres de santé dans les territoires,Nombre de maisons de santé pluri-professionnelles,nb-maisons-sante,52,Pays de la Loire,110.0,2021-06-30,73.0,2017-06-30,37.0,51.0,111.0,97.0,2022-12-31,maisons de santé
Doubler le nombre de maisons de santé et de centres de santé dans les territoires,Nombre de centres de santé,nb-centres-sante,52,Pays de la Loire,11.0,2020-12-31,,,,,34.0,,2022-12-31,centres de santé
Allonger le congé paternité pour un meilleur développement de l’enfant,Nombre de pères / conjoints prenant un congé de paternité,nb-peres-conge-paternite,52,Pays de la Loire,20234.0,2020-12-31,20658.0,2018-12-31,-424.0,-2.0,23984.0,0.0,2022-12-31,pères / conjoints dans l'année
Accompagner les aidants,Nombre de bénéficiaires d'un congé de proche aidant indemnisé,nb-beneficiaires-ajpa,52,Pays de la Loire,115.0,2021-03-31,,,,,1960.0,,2022-12-31,bénéficiaires
