mesure,indicateur,id_indicateur,code_region,libelle_region,valeur_actuelle,date_valeur_actuelle,valeur_initiale,date_valeur_initiale,progression,pourcentage_progression,cible,pourcentage_cible,date_cible,unite
Lutter contre les impayés de pensions alimentaires,Nombre de familles bénéficiaires d'une pension alimentaire versée par l'intermédiaire du service public des pensions alimentaires,nb-familles-aripa,84,Auvergne-Rhône-Alpes,3608.0,2021-10-31,152.0,2020-12-31,3456.0,2274.0,28739.0,12.0,2022-12-31,familles
"Proposer une offre de lunettes, appareils auditifs et prothèses dentaires remboursée à 100%",Part des équipements vendus sans reste à charge dans le total des soins audio,tx-equipements-audio,84,Auvergne-Rhône-Alpes,31.83,2021-09-30,8.54,2019-01-31,23.0,273.0,40.0,74.0,2022-12-31,%
"Proposer une offre de lunettes, appareils auditifs et prothèses dentaires remboursée à 100%",Part des équipements vendus sans reste à charge dans le total des soins dentaires,tx-equipements-dentaire,84,Auvergne-Rhône-Alpes,52.69,2021-09-30,28.11,2019-04-30,25.0,87.0,45.0,100.0,2022-12-31,%
"Proposer une offre de lunettes, appareils auditifs et prothèses dentaires remboursée à 100%",Part des équipements vendus sans reste à charge dans le total des soins optiques,tx-equipements-optique,84,Auvergne-Rhône-Alpes,13.83,2021-09-30,15.3,2020-01-31,-1.0,-10.0,20.0,0.0,2022-12-31,%
Doubler le nombre de maisons de santé et de centres de santé dans les territoires,Nombre de maisons de santé pluri-professionnelles,nb-maisons-sante,84,Auvergne-Rhône-Alpes,273.0,2021-06-30,155.0,2017-06-30,118.0,76.0,292.0,86.0,2022-12-31,maisons de santé
Doubler le nombre de maisons de santé et de centres de santé dans les territoires,Nombre de centres de santé,nb-centres-sante,84,Auvergne-Rhône-Alpes,49.0,2021-06-30,,,,,75.0,,2022-12-31,centres de santé
Allonger le congé paternité pour un meilleur développement de l’enfant,Nombre de pères / conjoints prenant un congé de paternité,nb-peres-conge-paternite,84,Auvergne-Rhône-Alpes,39498.0,2020-12-31,41070.0,2018-12-31,-1572.0,-4.0,46636.0,0.0,2022-12-31,pères / conjoints dans l'année
Accompagner les aidants,Nombre de bénéficiaires d'un congé de proche aidant indemnisé,nb-beneficiaires-ajpa,84,Auvergne-Rhône-Alpes,775.0,2021-11-30,,,,,5815.0,,2022-12-31,bénéficiaires
