mesure,indicateur,id_indicateur,code_region,libelle_region,valeur_actuelle,date_valeur_actuelle,valeur_initiale,date_valeur_initiale,progression,pourcentage_progression,cible,pourcentage_cible,date_cible,unite
Lutter contre les impayés de pensions alimentaires,Nombre de familles bénéficiaires d'une pension alimentaire versée par l'intermédiaire du service public des pensions alimentaires,nb-familles-aripa,01,Guadeloupe,499.0,2022-10-31,0.0,2020-09-30,499.0,,1338.0,37.0,2022-12-31,familles
"Proposer une offre de lunettes, appareils auditifs et prothèses dentaires remboursée à 100%",Part des équipements vendus sans reste à charge dans le total des soins audio,tx-equipements-audio,01,Guadeloupe,34.17,2022-06-30,0.0,2018-12-31,34.0,,,,,%
"Proposer une offre de lunettes, appareils auditifs et prothèses dentaires remboursée à 100%",Part des équipements vendus sans reste à charge dans le total des soins dentaires,tx-equipements-dentaire,01,Guadeloupe,55.77,2022-06-30,0.0,2019-03-31,56.0,,,,,%
"Proposer une offre de lunettes, appareils auditifs et prothèses dentaires remboursée à 100%",Part des équipements vendus sans reste à charge dans le total des soins optiques,tx-equipements-optique,01,Guadeloupe,29.96,2022-06-30,0.0,2019-12-31,30.0,,,,,%
Doubler le nombre de maisons de santé et de centres de santé dans les territoires,Nombre de maisons de santé pluri-professionnelles,nb-maisons-sante,01,Guadeloupe,7.0,2022-12-31,2.0,2017-06-30,5.0,250.0,11.0,56.0,2022-12-31,maisons de santé
Doubler le nombre de maisons de santé et de centres de santé dans les territoires,Nombre de centres de santé,nb-centres-sante,01,Guadeloupe,2.0,2021-12-31,1.0,2017-12-31,1.0,100.0,4.0,33.0,2022-12-31,centres de santé
Allonger le congé paternité pour un meilleur développement de l’enfant,Nombre de pères / conjoints prenant un congé de paternité,nb-peres-conge-paternite,01,Guadeloupe,528.0,2021-12-31,322.0,2018-12-31,206.0,64.0,533.0,98.0,2022-12-31,pères / conjoints dans l'année
Simplifier l’accès aux droits des personnes handicapées,Durée moyenne de traitement pour les demandes d’allocation adulte handicapé,duree-moyenne-traitement-demandes-allocation-adulte-handicape,01,Guadeloupe,6.8,2022-09-30,11.0,2017-12-31,-4.0,-38.0,3.0,52.0,2022-12-31,mois de traitement
Accompagner les aidants,Nombre de bénéficiaires d'un congé de proche aidant indemnisé,nb-beneficiaires-ajpa,01,Guadeloupe,51.0,2022-12-31,0.0,2020-09-30,51.0,,380.0,13.0,2022-12-31,bénéficiaires
