mesure,indicateur,id_indicateur,code_region,libelle_region,valeur_actuelle,date_valeur_actuelle,valeur_initiale,date_valeur_initiale,progression,pourcentage_progression,cible,pourcentage_cible,date_cible,unite
Lutter contre les impayés de pensions alimentaires,Nombre de familles bénéficiaires d'une pension alimentaire versée par l'intermédiaire du service public des pensions alimentaires,nb-familles-aripa,24,Centre-Val de Loire,1592.0,2021-10-31,61.0,2020-12-31,1531.0,2510.0,8680.0,18.0,2022-12-31,familles
"Proposer une offre de lunettes, appareils auditifs et prothèses dentaires remboursée à 100%",Part des équipements vendus sans reste à charge dans le total des soins audio,tx-equipements-audio,24,Centre-Val de Loire,33.82,2021-09-30,9.34,2019-01-31,24.0,262.0,40.0,80.0,2022-12-31,%
"Proposer une offre de lunettes, appareils auditifs et prothèses dentaires remboursée à 100%",Part des équipements vendus sans reste à charge dans le total des soins dentaires,tx-equipements-dentaire,24,Centre-Val de Loire,54.73,2021-09-30,32.77,2019-04-30,22.0,67.0,45.0,100.0,2022-12-31,%
"Proposer une offre de lunettes, appareils auditifs et prothèses dentaires remboursée à 100%",Part des équipements vendus sans reste à charge dans le total des soins optiques,tx-equipements-optique,24,Centre-Val de Loire,14.82,2021-09-30,13.68,2020-01-31,1.0,8.0,20.0,18.0,2022-12-31,%
Doubler le nombre de maisons de santé et de centres de santé dans les territoires,Nombre de maisons de santé pluri-professionnelles,nb-maisons-sante,24,Centre-Val de Loire,118.0,2021-06-30,79.0,2017-06-30,39.0,49.0,124.0,87.0,2022-12-31,maisons de santé
Doubler le nombre de maisons de santé et de centres de santé dans les territoires,Nombre de centres de santé,nb-centres-sante,24,Centre-Val de Loire,5.0,2021-06-30,,,,,22.0,,2022-12-31,centres de santé
Allonger le congé paternité pour un meilleur développement de l’enfant,Nombre de pères / conjoints prenant un congé de paternité,nb-peres-conge-paternite,24,Centre-Val de Loire,10849.0,2020-12-31,11340.0,2018-12-31,-491.0,-4.0,13573.0,0.0,2022-12-31,pères / conjoints dans l'année
Accompagner les aidants,Nombre de bénéficiaires d'un congé de proche aidant indemnisé,nb-beneficiaires-ajpa,24,Centre-Val de Loire,223.0,2021-11-30,,,,,1890.0,,2022-12-31,bénéficiaires
