mesure,indicateur,id_indicateur,code_region,libelle_region,valeur_actuelle,date_valeur_actuelle,valeur_initiale,date_valeur_initiale,progression,pourcentage_progression,cible,pourcentage_cible,date_cible,unite
Lutter contre les impayés de pensions alimentaires,Nombre de familles bénéficiaires d'une pension alimentaire versée par l'intermédiaire du service public des pensions alimentaires,nb-familles-aripa,24,Centre-Val de Loire,2455.0,2022-02-28,0.0,2020-09-30,2455.0,,8680.0,28.0,2022-12-31,familles
"Proposer une offre de lunettes, appareils auditifs et prothèses dentaires remboursée à 100%",Part des équipements vendus sans reste à charge dans le total des soins audio,tx-equipements-audio,24,Centre-Val de Loire,33.82,2021-09-30,0.0,2018-12-31,34.0,,,,,%
"Proposer une offre de lunettes, appareils auditifs et prothèses dentaires remboursée à 100%",Part des équipements vendus sans reste à charge dans le total des soins dentaires,tx-equipements-dentaire,24,Centre-Val de Loire,54.73,2021-09-30,0.0,2019-03-31,55.0,,,,,%
"Proposer une offre de lunettes, appareils auditifs et prothèses dentaires remboursée à 100%",Part des équipements vendus sans reste à charge dans le total des soins optiques,tx-equipements-optique,24,Centre-Val de Loire,14.82,2021-09-30,0.0,2019-12-31,15.0,,,,,%
Doubler le nombre de maisons de santé et de centres de santé dans les territoires,Nombre de maisons de santé pluri-professionnelles,nb-maisons-sante,24,Centre-Val de Loire,115.0,2021-12-31,79.0,2017-06-30,36.0,46.0,124.0,80.0,2022-12-31,maisons de santé
Doubler le nombre de maisons de santé et de centres de santé dans les territoires,Nombre de centres de santé,nb-centres-sante,24,Centre-Val de Loire,5.0,2021-12-31,2.0,2017-12-31,3.0,150.0,22.0,15.0,2022-12-31,centres de santé
Allonger le congé paternité pour un meilleur développement de l’enfant,Nombre de pères / conjoints prenant un congé de paternité,nb-peres-conge-paternite,24,Centre-Val de Loire,11583.0,2021-12-31,11340.0,2018-12-31,243.0,2.0,13573.0,11.0,2022-12-31,pères / conjoints dans l'année
Accompagner les aidants,Nombre de bénéficiaires d'un congé de proche aidant indemnisé,nb-beneficiaires-ajpa,24,Centre-Val de Loire,246.0,2021-12-31,0.0,2020-09-30,246.0,,1890.0,13.0,2022-12-31,bénéficiaires
