mesure,indicateur,id_indicateur,code_region,libelle_region,valeur_actuelle,date_valeur_actuelle,valeur_initiale,date_valeur_initiale,progression,pourcentage_progression,cible,pourcentage_cible,date_cible,unite
Doubler le nombre de maisons de santé,Nombre de maisons de santé pluri-professionnelles,nb-maisons-sante,28,Normandie,86.0,2020-06-30,53.0,2017-06-30,33.0,62.0,,,,maisons de santé
Allonger le congé paternité pour un meilleur développement de l’enfant,Nombre de pères / conjoints prenant un congé de paternité et d’accueil de l’enfant,nb-peres-conge-paternite,28,Normandie,17377.0,2019-12-31,,,,,,,,pères dans l'année
"Proposer une offre de lunettes, appareils auditifs et prothèses dentaires remboursée à 100%",Part des équipements/soins auditives 100% santé dans le total des soins,tx-equipements-audio,28,Normandie,8.68,2020-10-31,9.88,2019-01-31,-1.0,-12.0,,,,%
"Proposer une offre de lunettes, appareils auditifs et prothèses dentaires remboursée à 100%",Part des équipements/soins 100% santé dans le total des soins dentaires,tx-equipements-dentaire,28,Normandie,55.19,2020-09-30,31.45,2019-04-30,24.0,75.0,,,,%
"Proposer une offre de lunettes, appareils auditifs et prothèses dentaires remboursée à 100%",Part des équipements/soins 100% santé dans le total des soins optiques,tx-equipements-optique,28,Normandie,8.92,2020-10-31,9.8,2020-01-31,-1.0,-9.0,,,,%
