mesure,indicateur,id_indicateur,code_region,libelle_region,valeur_actuelle,date_valeur_actuelle,valeur_initiale,date_valeur_initiale,progression,pourcentage_progression,cible,pourcentage_cible,date_cible,unite
Doubler le nombre de maisons de santé,Nombre de maisons de santé pluri-professionnelles,nb-maisons-sante,84,Auvergne-Rhône-Alpes,229.0,2020-06-30,155.0,2017-06-30,74.0,48.0,,,,maisons de santé
Allonger le congé paternité pour un meilleur développement de l’enfant,Nombre de pères / conjoints prenant un congé de paternité et d’accueil de l’enfant,nb-peres-conge-paternite,84,Auvergne-Rhône-Alpes,44444.0,2019-12-31,,,,,,,,pères dans l'année
"Proposer une offre de lunettes, appareils auditifs et prothèses dentaires remboursée à 100%",Part des équipements/soins auditives 100% santé dans le total des soins,tx-equipements-audio,84,Auvergne-Rhône-Alpes,7.48,2020-10-31,8.48,2019-01-31,-1.0,-12.0,,,,%
"Proposer une offre de lunettes, appareils auditifs et prothèses dentaires remboursée à 100%",Part des équipements/soins 100% santé dans le total des soins dentaires,tx-equipements-dentaire,84,Auvergne-Rhône-Alpes,49.68,2020-09-30,25.61,2019-04-30,24.0,94.0,,,,%
"Proposer une offre de lunettes, appareils auditifs et prothèses dentaires remboursée à 100%",Part des équipements/soins 100% santé dans le total des soins optiques,tx-equipements-optique,84,Auvergne-Rhône-Alpes,8.19,2020-10-31,8.97,2020-01-31,-1.0,-9.0,,,,%
