mesure,indicateur,id_indicateur,maille_geographique,valeur_actuelle,date_valeur_actuelle,valeur_initiale,date_valeur_initiale,progression,pourcentage_progression,cible,pourcentage_cible,date_cible,unite
Lutter contre les impayés de pensions alimentaires,Nombre de familles bénéficiaires d'une pension alimentaire versée par l'intermédiaire du service public des pensions alimentaires,nb-familles-aripa,national,93800.0,2022-10-31,0.0,2020-09-30,93800.0,,230000.0,41.0,2022-12-31,familles
"Proposer une offre de lunettes, appareils auditifs et prothèses dentaires remboursée à 100%",Part des équipements vendus sans reste à charge dans le total des soins audio,tx-equipements-audio,national,39.9,2022-06-30,0.0,2018-12-31,40.0,,40.0,100.0,2022-12-31,%
"Proposer une offre de lunettes, appareils auditifs et prothèses dentaires remboursée à 100%",Part des équipements vendus sans reste à charge dans le total des soins dentaires,tx-equipements-dentaire,national,55.33,2022-06-30,0.0,2019-03-31,55.0,,45.0,100.0,2022-12-31,%
"Proposer une offre de lunettes, appareils auditifs et prothèses dentaires remboursée à 100%",Part des équipements vendus sans reste à charge dans le total des soins optiques,tx-equipements-optique,national,18.09,2022-06-30,0.0,2019-12-31,18.0,,20.0,90.0,2022-12-31,%
Doubler le nombre de maisons de santé et de centres de santé dans les territoires,Nombre de maisons de santé pluri-professionnelles,nb-maisons-sante,national,2251.0,2022-12-31,1034.0,2017-06-30,1217.0,118.0,2000.0,100.0,2022-12-31,maisons de santé
Doubler le nombre de maisons de santé et de centres de santé dans les territoires,Nombre de centres de santé,nb-centres-sante,national,522.0,2021-12-31,375.0,2017-12-31,147.0,39.0,700.0,45.0,2022-12-31,centres de santé
Allonger le congé paternité pour un meilleur développement de l’enfant,Nombre de pères / conjoints prenant un congé de paternité,nb-peres-conge-paternite,national,333463.0,2021-12-31,301932.0,2018-12-31,31531.0,10.0,354800.0,60.0,2022-12-31,pères / conjoints dans l'année
Simplifier l’accès aux droits des personnes handicapées,Durée moyenne de traitement pour les demandes d’allocation adulte handicapé,duree-moyenne-traitement-demandes-allocation-adulte-handicape,national,5.0,2022-09-30,4.3,2017-12-31,1.0,16.0,3.0,0.0,2022-12-31,mois de traitement
Accompagner les aidants,Nombre de bénéficiaires d'un congé de proche aidant indemnisé,nb-beneficiaires-ajpa,national,10898.0,2022-12-31,0.0,2020-09-30,10898.0,,50000.0,22.0,2022-12-31,bénéficiaires
