mesure,indicateur,id_indicateur,code_region,libelle_region,valeur_actuelle,date_valeur_actuelle,valeur_initiale,date_valeur_initiale,progression,pourcentage_progression,cible,pourcentage_cible,date_cible,unite
Assurer une bonne couverture en internet fixe et en téléphonie mobile pour tous les Français d'ici 2022,Taux de déploiement de la fibre,taux-deploiement-fibre,93,Provence-Alpes-Côte d'Azur,78.0,2022-09-30,26.0,2017-12-31,52.0,200.0,,,,% de déploiement
Déployer une offre France services dans tous les territoires ,Nombre de labellisations (atteinte de l'objectif fixé),nb-labellisations-france-services,93,Provence-Alpes-Côte d'Azur,147.0,2022-12-31,37.0,2020-01-31,110.0,297.0,143.0,100.0,2022-12-31,labellisations
Redynamiser les cœurs de ville,Nombre de logements rénovés dans les petites villes (- de 20 000 habitants),nb-logements-renoves-petites-villes,93,Provence-Alpes-Côte d'Azur,977.0,2022-06-30,0.0,2020-09-30,977.0,,,,,logements rénovés
Redynamiser les cœurs de ville,Nombre de logements ayant bénéficié d'un accompagnement (réhabilitation ou subvention),nb-logement-accompagnement,93,Provence-Alpes-Côte d'Azur,3039.0,2022-09-30,0.0,2019-12-31,3039.0,,4221.0,72.0,2022-12-31,logements
Redynamiser les cœurs de ville,Nombre de logements rénovés dans les villes moyennes (+ de 20 000 habitants),nb-logement-accompagnement,93,Provence-Alpes-Côte d'Azur,3039.0,2022-09-30,0.0,2019-12-31,3039.0,,4221.0,72.0,2022-12-31,logements rénovés
