mesure,indicateur,id_indicateur,code_region,libelle_region,valeur_actuelle,date_valeur_actuelle,valeur_initiale,date_valeur_initiale,progression,pourcentage_progression,cible,pourcentage_cible,date_cible,unite
Assurer une bonne couverture en internet fixe et en téléphonie mobile pour tous les Français d'ici 2022,Taux de déploiement de la fibre,taux-deploiement-fibre,76,Occitanie,78.0,2022-09-30,19.0,2017-12-31,59.0,311.0,,,,% de déploiement
Déployer une offre France services dans tous les territoires ,Nombre de labellisations (atteinte de l'objectif fixé),nb-labellisations-france-services,76,Occitanie,312.0,2022-12-31,71.0,2020-01-31,241.0,339.0,300.0,100.0,2022-12-31,labellisations
Redynamiser les cœurs de ville,Nombre de logements rénovés dans les petites villes (- de 20 000 habitants),nb-logements-renoves-petites-villes,76,Occitanie,3366.0,2022-06-30,0.0,2020-09-30,3366.0,,,,,logements rénovés
Redynamiser les cœurs de ville,Nombre de logements ayant bénéficié d'un accompagnement (réhabilitation ou subvention),nb-logement-accompagnement,76,Occitanie,9811.0,2022-09-30,0.0,2019-12-31,9811.0,,7884.0,100.0,2022-12-31,logements
Redynamiser les cœurs de ville,Nombre de logements rénovés dans les villes moyennes (+ de 20 000 habitants),nb-logement-accompagnement,76,Occitanie,9811.0,2022-09-30,0.0,2019-12-31,9811.0,,7884.0,100.0,2022-12-31,logements rénovés
