mesure,indicateur,id_indicateur,code_region,libelle_region,valeur_actuelle,date_valeur_actuelle,valeur_initiale,date_valeur_initiale,progression,pourcentage_progression,cible,pourcentage_cible,date_cible,unite
Assurer une bonne couverture en internet fixe et en téléphonie mobile pour tous les Français d'ici 2022,Taux de déploiement de la fibre,taux-deploiement-fibre,11,Île-de-France,91.0,2021-09-30,62.0,2017-12-31,29.0,47.0,,,,% de déploiement
Déployer une offre France services dans tous les territoires ,Nombre de labellisations (atteinte de l'objectif fixé),nb-labellisations-france-services,11,Île-de-France,128.0,2022-03-31,26.0,2020-01-31,102.0,392.0,154.0,80.0,2022-12-31,labellisations
Redynamiser les cœurs de ville,Nombre de logements rénovés dans les petites villes (- de 20 000 habitants),nb-logements-renoves-petites-villes,11,Île-de-France,330.0,2022-02-28,0.0,2020-09-30,330.0,,,,,logements rénovés
Redynamiser les cœurs de ville,Nombre de logements ayant bénéficié d'un accompagnement (réhabilitation ou subvention),nb-logement-accompagnement,11,Île-de-France,11630.0,2022-02-28,0.0,2019-12-31,11630.0,,6164.0,100.0,2022-12-31,logements
Redynamiser les cœurs de ville,Nombre de logements rénovés dans les villes moyennes (+ de 20 000 habitants),nb-logement-accompagnement,11,Île-de-France,11630.0,2022-02-28,0.0,2019-12-31,11630.0,,6164.0,100.0,2022-12-31,logements rénovés
