mesure,indicateur,id_indicateur,code_region,libelle_region,valeur_actuelle,date_valeur_actuelle,valeur_initiale,date_valeur_initiale,progression,pourcentage_progression,cible,pourcentage_cible,date_cible,unite
Améliorer la qualité du service rendu à l’usager,Part des lieux d’accueil du public qui publient leurs résultats (national et local),tx-transparence-resultats,06,Mayotte,68.0,2019-12-31,5,2017-12-31,63.0,1260.0,100.0,66.0,2022-12-31,% de réseaux
Assurer une bonne couverture en internet fixe et en téléphonie mobile pour tous les Français d'ici 2022,Taux de déploiement de la fibre,taux-deploiement-fibre,06,Mayotte,0.0,2021-09-30,0,2017-03-31,0.0,,,,,% de déploiement
Déployer une offre France services dans tous les territoires ,Nombre de labellisations (atteinte de l'objectif fixé),nb-labellisations-france-services,06,Mayotte,10.0,2022-03-31,2,2020-01-31,8.0,400.0,16.0,57.0,2022-12-31,labellisations
Redynamiser les cœurs de ville,Nombre de logements rénovés dans les petites villes (- de 20 000 habitants),nb-logements-renoves-petites-villes,06,Mayotte,21.0,2022-02-28,0,2020-09-30,21.0,,,,,logements rénovés
Redynamiser les cœurs de ville,Nombre de logements ayant bénéficié d'un accompagnement (réhabilitation ou subvention),nb-logement-accompagnement,06,Mayotte,7.0,2022-02-28,0,2019-12-31,7.0,,0.0,,2022-12-31,logements
Redynamiser les cœurs de ville,Nombre de logements rénovés dans les villes moyennes (+ de 20 000 habitants),nb-logement-accompagnement,06,Mayotte,7.0,2022-02-28,0,2019-12-31,7.0,,0.0,,2022-12-31,logements rénovés
