mesure,indicateur,id_indicateur,code_departement,libelle_departement,valeur_actuelle,date_valeur_actuelle,valeur_initiale,date_valeur_initiale,progression,pourcentage_progression,cible,pourcentage_cible,date_cible,unite
Déployer le plan vélo,Kilomètres d'aménagements cyclables sécurisés,km-amenagement-cyclables-securises,66,Pyrénées-Orientales,471.0,2020-09-30,389.0,2017-12-31,82.0,21.0,537.0,55.0,2022-03-31,kilomètres
Mettre en œuvre la sortie du plastique à usage unique et lutter contre le gaspillage,Nombre de Français qui peuvent mettre tous les emballages dans le bac jaune,nb-francais-emballages-bac-jaune,66,Pyrénées-Orientales,470000.0,2020-06-30,470000.0,2017-06-30,0.0,0.0,470000.0,,2022-12-31,habitants
Verdir le parc automobile,Nombre de primes à la conversion et de bonus écologiques,nb-primes-conversion,66,Pyrénées-Orientales,7384.0,2020-09-30,0.0,2018-03-31,7384.0,,,,,primes et bonus
Développer l’apprentissage,Nombre de contrats d’apprentissage,nombre-contrats-apprentissage,66,Pyrénées-Orientales,2544.0,2019-12-31,2024.0,2017-12-31,520.0,26.0,,,,contrats
Supprimer la taxe d’habitation sur les résidences principales,Nombre de bénéficiaires totalement exonérés,nb-beneficiaires-suppression-taxe-habitation,66,Pyrénées-Orientales,191113.0,2020-12-31,0.0,2017-01-01,191113.0,,228378.0,84.0,2023-12-31,bénéficiaires
Doubler le nombre de maisons de santé,Nombre de maisons de santé pluri-professionnelles,nb-maisons-sante,66,Pyrénées-Orientales,8.0,2020-06-30,7.0,2017-06-30,1.0,14.0,,,,maisons de santé
Allonger le congé paternité pour un meilleur développement de l’enfant,Nombre de pères / conjoints prenant un congé de paternité et d’accueil de l’enfant,nb-peres-conge-paternite,66,Pyrénées-Orientales,1656.0,2019-12-31,,,,,,,,pères dans l'année
"Proposer une offre de lunettes, appareils auditifs et prothèses dentaires remboursée à 100%",Part des équipements/soins auditives 100% santé dans le total des soins,tx-equipements-audio,66,Pyrénées-Orientales,14.53,2020-10-31,17.14,2019-03-31,-3.0,-15.0,,,,%
"Proposer une offre de lunettes, appareils auditifs et prothèses dentaires remboursée à 100%",Part des équipements/soins 100% santé dans le total des soins dentaires,tx-equipements-dentaire,66,Pyrénées-Orientales,64.59,2020-09-30,32.27,2019-04-30,32.0,100.0,,,,%
"Proposer une offre de lunettes, appareils auditifs et prothèses dentaires remboursée à 100%",Part des équipements/soins 100% santé dans le total des soins optiques,tx-equipements-optique,66,Pyrénées-Orientales,16.49,2020-10-31,18.09,2020-01-31,-2.0,-9.0,,,,%
"Dédoubler les classes en REP (grande section, CP, CE1)",Part des classes de CP et CE1 en REP dédoublées,tx-classes-cp-ce1-rep,66,Pyrénées-Orientales,100.0,2020-10-31,96.0,2019-10-31,4.0,4.0,,,,% des classes
"Dédoubler les classes en REP (grande section, CP, CE1)",Part des classes de grande section en REP dédoublées,tx-gs-rep,66,Pyrénées-Orientales,0.0,2020-11-30,1.0,2019-11-30,-1.0,-100.0,81.0,-1.0,2022-11-30,% des classes
"Limiter les classes à 24 en grande section, CP, CE1","Part des classes de GS, CP ou CE1 ayant un effectif inférieur ou égal à 24 élèves",tx-classes-cp-ce1,66,Pyrénées-Orientales,67.0,2020-09-30,64.0,2019-09-30,3.0,5.0,100.0,8.0,2022-09-30,% des classes
Offrir une scolarisation inclusive à tous les enfants handicapés,"Nombre d’unités locales d’inclusion scolaires (ULIS) pour les élèves en situation de handicap à l’école maternelle, à l’école élémentaire, au collège et au lycée",nombre-creation-ulis,66,Pyrénées-Orientales,65.0,2020-09-30,58.0,2017-09-30,7.0,12.0,69.0,64.0,2022-09-30,unités
Offrir une scolarisation inclusive à tous les enfants handicapés,Nombre de classes adaptées à la scolarisation des enfants autistes (UEMA/UEEA) à l’école maternelle et à l’école élémentaire,nombre-creation-ueea,66,Pyrénées-Orientales,3.0,2020-09-30,1.0,2017-09-30,2.0,200.0,3.0,100.0,2022-09-30,classes
Déployer Parcoursup ,Taux de réussite aux examens de licence 1,tx-reussite-examens,66,Pyrénées-Orientales,40.0,2019-10-31,33.0,2017-10-31,7.0,21.0,,,,% de réussite
Renforcer la sécurité du quotidien,Nombre d’heures de patrouille de voie publique,nb-heures-patrouille,66,Pyrénées-Orientales,393187.0,2020-10-31,,,,,,,,heures de patrouille dans l'année
Lutter contre les stupéfiants,Nombre d'amendes forfaitaires délictuelles dressées,nb-amendes-delictuelles-dressees,66,Pyrénées-Orientales,104.0,2020-10-31,,,,,,,,amendes dressées dans l'année
Réduire la mortalité sur les routes,Nombre de morts sur les routes,nb-morts-routes,66,Pyrénées-Orientales,30.0,2019-12-31,38.0,2017-12-31,-8.0,-21.0,,,,morts dans l'année
Assurer une bonne couverture en internet fixe et en téléphonie mobile pour tous les Français d'ici 2022,Taux de déploiement de la fibre,taux-deploiement-fibre,66,Pyrénées-Orientales,34.0,2020-06-30,17.0,2017-12-31,17.0,100.0,,,,% de déploiement
Déployer une offre France Services dans tous les territoires ,Nombre de labellisations (atteinte de l'objectif fixé),nb-labellisations-france-services,66,Pyrénées-Orientales,4.0,2020-11-30,0.0,2017-01-01,4.0,,23.0,17.0,2022-12-31,labellisations
Améliorer la qualité du service rendu à l’usager,Part des lieux d’accueil du public qui publient leurs résultats,tx-transparence-resultats,66,Pyrénées-Orientales,72.0,2019-12-31,11.0,2017-12-31,61.0,555.0,100.0,69.0,2022-12-31,% de réseaux
Offrir un logement aux sans-abri : Logement d’abord,Nombre de personnes sans-abri ou en hébergement ayant obtenu un logement social,logement-sans-domicile-hebergement-urgence,66,Pyrénées-Orientales,227.0,2019-12-31,178.0,2017-12-31,49.0,28.0,,,,personnes dans l'année
