mesure,indicateur,id_indicateur,code_departement,libelle_departement,valeur_actuelle,date_valeur_actuelle,valeur_initiale,date_valeur_initiale,progression,pourcentage_progression,progression_derniere_maj,pourcentage_progression_derniere_maj,progression_derniere_maj_date,cible,pourcentage_cible,date_cible,unite
"Limiter les classes à 24 en grande section, CP, CE1","Part des classes de GS, CP ou CE1 ayant un effectif inférieur ou égal à 24 élèves",tx-classes-cp-ce1,15,Cantal,97.0,2022-09-30,94.0,2019-09-30,3.0,3.0,93.0,4.0,2020-09-30,100.0,50.0,2022-09-30,% des classes
Devoirs faits au collège,Part de collégiens bénéficiant du dispositif (en %),taux-collegiens-beneficiaires,15,Cantal,37.0,2022-09-30,26.0,2018-03-31,11.0,42.0,,,,35.0,100.0,2022-12-31,% de collégiens
Offrir une scolarisation inclusive à tous les enfants handicapés,"Nombre d’unités locales d’inclusion scolaires (ULIS) pour les élèves en situation de handicap à l’école maternelle, à l’école élémentaire, au collège et au lycée",nombre-creation-ulis,15,Cantal,26.0,2022-09-30,25.0,2017-09-30,1.0,4.0,26.0,0.0,2020-09-30,27.0,50.0,2022-09-30,unités
Offrir une scolarisation inclusive à tous les enfants handicapés,Nombre de classes adaptées à la scolarisation des enfants autistes (UEMA/UEEA) à l’école maternelle et à l’école élémentaire,nombre-creation-ueea,15,Cantal,2.0,2022-09-30,1.0,2017-09-30,1.0,100.0,1.0,100.0,2020-09-30,2.0,100.0,2022-09-30,classes
Déployer Parcoursup ,Taux de réussite aux examens de licence 1,tx-reussite-examens,15,Cantal,56.7,2021-10-31,48.1,2017-10-31,9.0,18.0,53.1,7.0,2019-10-31,47.0,100.0,2022-10-31,% de réussite
Promouvoir l'engagement chez les jeunes,Nombre de volontaires ayant réalisé au moins un jour de mission de service civique dans l'année,nb-jeunes-engages,15,Cantal,360.0,2021-12-31,265.0,2017-12-31,95.0,36.0,391.0,-8.0,2020-12-31,,,,jeunes
Aide de France Relance aux entreprises,Nombre d’entreprises industrielles (dont PME) bénéficiaires des aides à l'investissement de France Relance,nb-entreprises-industrielles-agricoles,15,Cantal,22.0,2022-12-31,0.0,2020-10-31,22.0,,,,,,,,entreprises industrielles
Numérisation des petites et moyennes entreprises,Nombre d'entreprises ayant bénéficié d'un chèque numérique de 500€,nb-entreprises-cheaque-numerique,15,Cantal,212.0,2022-11-30,0.0,2020-09-30,212.0,,47.0,351.0,2021-04-30,196.0,100.0,2022-12-31,entreprises
Numérisation des petites et moyennes entreprises,Nombre d'entreprises ayant disposé d'un diagnostic numérique et d'un plan d'action individualisé,nb-diagnostics-individualises,15,Cantal,150.0,2022-11-30,0.0,2020-09-30,150.0,,30.0,400.0,2021-04-30,63.0,100.0,2022-12-31,entreprises
Développer l’apprentissage,Nombre de contrats d’apprentissage,nombre-contrats-apprentissage,15,Cantal,1381.0,2022-10-31,571.0,2017-12-31,810.0,142.0,826.0,67.0,2020-12-31,853.0,100.0,2022-12-31,contrats
Plan 1 jeune 1 solution,Nombre de recrutements de jeunes,nombre-recrutements-jeunes,15,Cantal,3694.0,2022-07-31,2707.0,2019-07-31,987.0,36.0,1836.0,101.0,2021-02-28,,,,Recrutements depuis le mois d'août précédent
Pacte d'ambition pour l'insertion par l'activité économique,Nombre de bénéficiaires en structures d'insertion par l'activité économique,nb-beneficiaires-siae,15,Cantal,511.0,2022-09-30,494.0,2017-01-31,17.0,3.0,497.0,3.0,2021-02-28,820.0,5.0,2022-12-31,bénéficiaires *
Supprimer la taxe d’habitation sur les résidences principales,Nombre de bénéficiaires totalement exonérés,nb-beneficiaires-suppression-taxe-habitation,15,Cantal,59220.0,2022-12-31,0.0,2017-12-31,59220.0,,,,,69196.0,86.0,2023-12-31,bénéficiaires
Déployer le plan vélo,Kilomètres d'aménagements cyclables sécurisés,km-amenagement-cyclables-securises,15,Cantal,105.0,2022-12-31,93.0,2017-12-31,12.0,13.0,99.0,6.0,2020-09-30,107.0,86.0,2022-03-31,kilomètres
Verdir le parc automobile,Nombre de primes à la conversion et de bonus écologiques,nb-primes-conversion,15,Cantal,4428.0,2022-12-31,0.0,2018-01-31,4428.0,,2962.0,49.0,2020-09-30,3190.0,100.0,2022-06-30,primes et bonus
Verdir le parc automobile,Nombre de bornes de recharge pour véhicules électriques déployées,nb-points-recharge,15,Cantal,95.0,2022-12-31,25.0,2019-09-30,70.0,280.0,,,,213.0,37.0,2022-03-31,bornes de recharge
Mettre en œuvre la sortie du plastique à usage unique et lutter contre le gaspillage,Nombre de Français qui peuvent mettre tous les emballages dans le bac jaune,nb-francais-emballages-bac-jaune,15,Cantal,150000.0,2022-12-31,0.0,2017-06-30,150000.0,,,,,150000.0,100.0,2022-12-31,habitants
Réduire l'utilisation des produits phytosanitaires et accélérer la transition écologique,Surface agricole cultivée en agriculture biologique,surface-agriculture-biologique,15,Cantal,7.3,2021-12-31,5.9,2017-12-31,1.0,24.0,7.0,4.0,2019-12-31,15.0,15.0,2022-12-31,% de surface agricole
Réduire l'utilisation des produits phytosanitaires et accélérer la transition écologique,Nombre d’agriculteurs engagés dans une démarche certifiée de transition agro-écologique,nb-agriculteurs-agro-eco,15,Cantal,433.0,2021-12-31,294.0,2017-12-31,139.0,47.0,,,,520.0,62.0,2022-12-31,agriculteurs
Sécuriser le paiement des aides PAC,Taux de bénéficiaires payés dans les délais prévus,taux-paiement-dpb,15,Cantal,99.86,2022-12-31,0.0,2017-12-31,100.0,,,,,99.0,100.0,2022-12-31,%
Renforcer la sécurité du quotidien,Nombre d’heures de patrouille de voie publique,nb-heures-patrouille,15,Cantal,240543.0,2022-10-31,262553.0,2017-12-31,-22010.0,-8.0,,,,,,,heures de patrouille sur douze mois *
Renforcer la sécurité du quotidien,Atteintes aux personnes dans les transports en commun,nb-atteintes-personnes,15,Cantal,11.0,2021-12-31,14.0,2017-12-31,-3.0,-21.0,,,,,,,atteintes aux personnes dans l'année
Renforcer la sécurité du quotidien,Atteintes aux biens dans les transports en commun,nb-atteintes-biens,15,Cantal,23.0,2021-12-31,27.0,2017-12-31,-4.0,-15.0,,,,,,,atteintes aux biens dans l'année
Lutter contre les stupéfiants,Nombre d'amendes forfaitaires délictuelles dressées,nb-amendes-delictuelles-dressees,15,Cantal,100.0,2022-12-31,0.0,2020-05-31,100.0,,34.0,194.0,2021-03-31,,,,amendes dressées
Lutter contre les violences faites aux femmes,Nombre d’ordonnances de protection délivrées,nb-ordonnances-delivrees,15,Cantal,13.0,2021-09-30,3.0,2017-12-31,10.0,333.0,,,,,,,ordonnances dans l'année
Lutter contre les atteintes aux principes républicains,Nombre de contrôles réalisés dans le cadre des CLIR ou des dispositifs existant localement avant la mise en place progressive des CLIR,nb-controles-clir,15,Cantal,0.0,2022-12-31,,,,,,,,,,,contrôles
Réduire la mortalité sur les routes,Nombre de morts sur les routes,nb-morts-routes,15,Cantal,8.0,2022-09-30,12.0,2017-12-31,-4.0,-33.0,10.0,-20.0,2019-12-31,,,,morts dans l'année
Lutter contre la récidive par une meilleure insertion professionnelle des personnes placées sous main de justice,Taux de personnes détenues ayant bénéficié d'une formation dans l'année,tx-detenus-formation,15,Cantal,8.0,2022-09-30,7.0,2021-06-30,1.0,14.0,,,,,,,% de détenus
Lutter contre la récidive par une meilleure insertion professionnelle des personnes placées sous main de justice,Postes de travail d’intérêt général proposés sur l’ensemble du territoire national en tant que peine,nb-postes-tig,15,Cantal,71.0,2022-12-31,62.0,2021-03-31,9.0,15.0,,,,,,,postes
Lutter contre les impayés de pensions alimentaires,Nombre de familles bénéficiaires d'une pension alimentaire versée par l'intermédiaire du service public des pensions alimentaires,nb-familles-aripa,15,Cantal,125.0,2022-10-31,0.0,2020-09-30,125.0,,7.0,1686.0,2021-03-31,363.0,34.0,2022-12-31,familles
"Proposer une offre de lunettes, appareils auditifs et prothèses dentaires remboursée à 100%",Part des équipements vendus sans reste à charge dans le total des soins audio,tx-equipements-audio,15,Cantal,47.19,2022-06-30,0.0,2018-12-31,47.0,,24.14,95.0,2020-09-30,40.0,100.0,2022-12-31,%
"Proposer une offre de lunettes, appareils auditifs et prothèses dentaires remboursée à 100%",Part des équipements vendus sans reste à charge dans le total des soins dentaires,tx-equipements-dentaire,15,Cantal,72.49,2022-06-30,0.0,2019-03-31,72.0,,74.42,-3.0,2020-09-30,45.0,100.0,2022-12-31,%
"Proposer une offre de lunettes, appareils auditifs et prothèses dentaires remboursée à 100%",Part des équipements vendus sans reste à charge dans le total des soins optiques,tx-equipements-optique,15,Cantal,11.84,2022-06-30,0.0,2019-12-31,12.0,,10.19,16.0,2020-09-30,20.0,59.0,2022-12-31,%
Doubler le nombre de maisons de santé et de centres de santé dans les territoires,Nombre de maisons de santé pluri-professionnelles,nb-maisons-sante,15,Cantal,13.0,2022-12-31,7.0,2017-06-30,6.0,86.0,10.0,30.0,2020-06-30,11.0,100.0,2022-12-31,maisons de santé
Doubler le nombre de maisons de santé et de centres de santé dans les territoires,Nombre de centres de santé,nb-centres-sante,15,Cantal,0.0,2021-12-31,,,,,,,,1.0,,2022-12-31,centres de santé
Allonger le congé paternité pour un meilleur développement de l’enfant,Nombre de pères / conjoints prenant un congé de paternité,nb-peres-conge-paternite,15,Cantal,494.0,2021-12-31,474.0,2018-12-31,20.0,4.0,330.0,50.0,2020-09-30,538.0,31.0,2022-12-31,pères / conjoints dans l'année
Simplifier l’accès aux droits des personnes handicapées,Durée moyenne de traitement pour les demandes d’allocation adulte handicapé,duree-moyenne-traitement-demandes-allocation-adulte-handicape,15,Cantal,2.96,2022-09-30,2.87,2021-06-30,0.0,3.0,,,,3.0,100.0,2022-12-31,mois de traitement
MaPrimeRénov',Nombre de dossiers MaPrimeRénov' validés,nb-maprimerenov-valides,15,Cantal,4443.0,2022-10-31,0.0,2019-12-31,4443.0,,759.0,485.0,2021-03-31,4766.0,93.0,2022-12-31,dossiers validés
Faciliter l’accès au logement des personnes sans-abri,Nombre de personnes sans-abri ou en hébergement ayant obtenu un logement social,logement-sans-domicile-hebergement-urgence,15,Cantal,92.0,2022-11-30,42.0,2017-12-31,50.0,119.0,75.0,23.0,2019-12-31,97.0,91.0,2022-12-31,personnes dans l'année*
Améliorer la qualité du service rendu à l’usager,Part des lieux d’accueil du public qui publient leurs résultats (national et local),tx-transparence-resultats,15,Cantal,84.0,2022-12-31,7.0,2017-12-31,77.0,1100.0,,,,100.0,83.0,2022-12-31,% de réseaux
Assurer une bonne couverture en internet fixe et en téléphonie mobile pour tous les Français d'ici 2022,Taux de déploiement de la fibre,taux-deploiement-fibre,15,Cantal,73.0,2022-09-30,21.0,2017-12-31,52.0,248.0,45.0,62.0,2020-09-30,,,,% de déploiement
Déployer une offre France services dans tous les territoires ,Nombre de labellisations (atteinte de l'objectif fixé),nb-labellisations-france-services,15,Cantal,18.0,2022-12-31,3.0,2020-01-31,15.0,500.0,9.0,100.0,2020-09-30,18.0,100.0,2022-12-31,labellisations
Déployer le pass Culture,Nombre d’utilisateurs du pass Culture de 18 ans,nb-utilisateurs-pass-culture,15,Cantal,1964.0,2022-12-31,0.0,2019-01-31,1964.0,,,,,2341.0,84.0,2022-12-31,utilisateurs
Accompagner les aidants,Nombre de bénéficiaires d'un congé de proche aidant indemnisé,nb-beneficiaires-ajpa,15,Cantal,34.0,2022-12-31,0.0,2020-09-30,34.0,,,,,140.0,24.0,2022-12-31,bénéficiaires
Redynamiser les cœurs de ville,Nombre de logements rénovés dans les petites villes (- de 20 000 habitants),nb-logements-renoves-petites-villes,15,Cantal,454.0,2022-06-30,0.0,2020-09-30,454.0,,,,,,,,logements rénovés
Redynamiser les cœurs de ville,Nombre de logements ayant bénéficié d'un accompagnement (réhabilitation ou subvention),nb-logement-accompagnement,15,Cantal,1148.0,2022-09-30,0.0,2019-12-31,1148.0,,494.0,132.0,2021-03-31,,,,logements
Redynamiser les cœurs de ville,Nombre de logements rénovés dans les villes moyennes (+ de 20 000 habitants),nb-logement-accompagnement,15,Cantal,1148.0,2022-09-30,0.0,2019-12-31,1148.0,,494.0,132.0,2021-03-31,,,,logements rénovés
Apprendre à nager et à circuler à vélo en toute sécurité,Nombre d'enfants ayant suivi un cycle d’Aisance Aquatique,nb-cycle-aisance-aquatique,15,Cantal,21.0,2022-12-31,0.0,2019-03-31,21.0,,,,,141.0,15.0,2022-12-31,enfants
Apprendre à nager et à circuler à vélo en toute sécurité,Nombre d’attestations « savoir rouler à vélo » délivrées,nb-attestations-savoir-rouler-velo,15,Cantal,259.0,2022-12-31,0.0,2019-03-31,259.0,,29.0,793.0,2021-06-30,329.0,79.0,2022-12-31,attestations
Simplifier l’accès à l’aide juridictionnelle,Nombre de demandes d'aide juridictionnelle formulées par voie dématérialisée,nb-aide-juridictionnelle-dematerialisee,15,Cantal,0.0,2021-03-31,0.0,2021-01-31,0.0,,,,,15.0,0.0,2022-12-31,% des demandes *
Garantir l'égalité professionnelle entre les femmes et les hommes,Part des entreprises respectant leur obligation de publier l’index égalité professionnelle,tx-entreprise-egalite-pro,15,Cantal,91.0,2022-12-31,56.0,2019-09-30,35.0,62.0,,,,90.0,100.0,2022-12-31,%
