mesure,indicateur,id_indicateur,code_departement,libelle_departement,valeur_actuelle,date_valeur_actuelle,valeur_initiale,date_valeur_initiale,progression,pourcentage_progression,cible,pourcentage_cible,date_cible,unite
Déployer le plan vélo,Kilomètres d'aménagements cyclables sécurisés,km-amenagement-cyclables-securises,37,Indre-et-Loire,696.0,2020-09-30,614.0,2017-12-31,82.0,13.0,850.0,35.0,2022-03-31,kilomètres
Mettre en œuvre la sortie du plastique à usage unique et lutter contre le gaspillage,Nombre de Français qui peuvent mettre tous les emballages dans le bac jaune,nb-francais-emballages-bac-jaune,37,Indre-et-Loire,20000.0,2020-06-30,20000.0,2017-06-30,0.0,0.0,600000.0,0.0,2022-12-31,habitants
Verdir le parc automobile,Nombre de primes à la conversion et de bonus écologiques,nb-primes-conversion,37,Indre-et-Loire,9376.0,2020-09-30,0.0,2018-03-31,9376.0,,,,,primes et bonus
Développer l’apprentissage,Nombre de contrats d’apprentissage,nombre-contrats-apprentissage,37,Indre-et-Loire,3884.0,2019-12-31,3265.0,2017-12-31,619.0,19.0,,,,contrats
Supprimer la taxe d’habitation sur les résidences principales,Nombre de bénéficiaires totalement exonérés,nb-beneficiaires-suppression-taxe-habitation,37,Indre-et-Loire,222954.0,2020-12-31,0.0,2017-01-01,222954.0,,284937.0,78.0,2023-12-31,bénéficiaires
Doubler le nombre de maisons de santé,Nombre de maisons de santé pluri-professionnelles,nb-maisons-sante,37,Indre-et-Loire,23.0,2020-06-30,15.0,2017-06-30,8.0,53.0,,,,maisons de santé
Allonger le congé paternité pour un meilleur développement de l’enfant,Nombre de pères / conjoints prenant un congé de paternité et d’accueil de l’enfant,nb-peres-conge-paternite,37,Indre-et-Loire,2997.0,2019-12-31,,,,,,,,pères dans l'année
Simplifier l’accès aux droits des personnes handicapées,Durée moyenne de traitement pour les demandes d’allocation adulte handicapé,duree-moyenne-traitement-demandes-allocation-adulte-handicape,37,Indre-et-Loire,5.0,2020-09-30,4.3,2017-12-31,1.0,16.0,3.0,-54.0,2022-12-31,mois de traitement
"Proposer une offre de lunettes, appareils auditifs et prothèses dentaires remboursée à 100%",Part des équipements/soins auditives 100% santé dans le total des soins,tx-equipements-audio,37,Indre-et-Loire,9.64,2020-10-31,7.55,2019-01-31,2.0,28.0,,,,%
"Proposer une offre de lunettes, appareils auditifs et prothèses dentaires remboursée à 100%",Part des équipements/soins 100% santé dans le total des soins dentaires,tx-equipements-dentaire,37,Indre-et-Loire,53.99,2020-09-30,31.49,2019-04-30,23.0,71.0,,,,%
"Proposer une offre de lunettes, appareils auditifs et prothèses dentaires remboursée à 100%",Part des équipements/soins 100% santé dans le total des soins optiques,tx-equipements-optique,37,Indre-et-Loire,7.37,2020-10-31,6.04,2020-01-31,1.0,22.0,,,,%
"Dédoubler les classes en REP (grande section, CP, CE1)",Part des classes de CP et CE1 en REP dédoublées,tx-classes-cp-ce1-rep,37,Indre-et-Loire,100.0,2020-10-31,100.0,2019-10-31,0.0,0.0,,,,% des classes
"Dédoubler les classes en REP (grande section, CP, CE1)",Part des classes de grande section en REP dédoublées,tx-gs-rep,37,Indre-et-Loire,56.0,2020-11-30,18.0,2019-11-30,38.0,211.0,100.0,46.0,2022-11-30,% des classes
"Limiter les classes à 24 en grande section, CP, CE1","Part des classes de GS, CP ou CE1 ayant un effectif inférieur ou égal à 24 élèves",tx-classes-cp-ce1,37,Indre-et-Loire,67.0,2020-09-30,59.0,2019-09-30,8.0,14.0,100.0,20.0,2022-09-30,% des classes
Offrir une scolarisation inclusive à tous les enfants handicapés,"Nombre d’unités locales d’inclusion scolaires (ULIS) pour les élèves en situation de handicap à l’école maternelle, à l’école élémentaire, au collège et au lycée",nombre-creation-ulis,37,Indre-et-Loire,73.0,2020-09-30,66.0,2017-09-30,7.0,11.0,78.0,58.0,2022-09-30,unités
Offrir une scolarisation inclusive à tous les enfants handicapés,Nombre de classes adaptées à la scolarisation des enfants autistes (UEMA/UEEA) à l’école maternelle et à l’école élémentaire,nombre-creation-ueea,37,Indre-et-Loire,2.0,2020-09-30,1.0,2017-09-30,1.0,100.0,4.0,33.0,2022-09-30,classes
Déployer Parcoursup ,Taux de réussite aux examens de licence 1,tx-reussite-examens,37,Indre-et-Loire,44.0,2019-10-31,42.0,2017-10-31,2.0,5.0,,,,% de réussite
Renforcer la sécurité du quotidien,Nombre d’heures de patrouille de voie publique,nb-heures-patrouille,37,Indre-et-Loire,327182.0,2020-10-31,,,,,,,,heures de patrouille dans l'année
Lutter contre les stupéfiants,Nombre d'amendes forfaitaires délictuelles dressées,nb-amendes-delictuelles-dressees,37,Indre-et-Loire,60.0,2020-10-31,,,,,,,,amendes dressées dans l'année
Réduire la mortalité sur les routes,Nombre de morts sur les routes,nb-morts-routes,37,Indre-et-Loire,26.0,2019-12-31,32.0,2017-12-31,-6.0,-19.0,,,,morts dans l'année
Assurer une bonne couverture en internet fixe et en téléphonie mobile pour tous les Français d'ici 2022,Taux de déploiement de la fibre,taux-deploiement-fibre,37,Indre-et-Loire,43.0,2020-06-30,24.0,2017-12-31,19.0,79.0,,,,% de déploiement
Déployer une offre France Services dans tous les territoires ,Nombre de labellisations (atteinte de l'objectif fixé),nb-labellisations-france-services,37,Indre-et-Loire,15.0,2020-11-30,0.0,2017-01-01,15.0,,25.0,60.0,2022-12-31,labellisations
Améliorer la qualité du service rendu à l’usager,Part des lieux d’accueil du public qui publient leurs résultats,tx-transparence-resultats,37,Indre-et-Loire,59.0,2019-12-31,12.0,2017-12-31,47.0,392.0,100.0,53.0,2022-12-31,% de réseaux
Offrir un logement aux sans-abri : Logement d’abord,Nombre de personnes sans-abri ou en hébergement ayant obtenu un logement social,logement-sans-domicile-hebergement-urgence,37,Indre-et-Loire,502.0,2019-12-31,374.0,2017-12-31,128.0,34.0,,,,personnes dans l'année
