mesure,indicateur,id_indicateur,code_departement,libelle_departement,valeur_actuelle,date_valeur_actuelle,valeur_initiale,date_valeur_initiale,progression,pourcentage_progression,cible,pourcentage_cible,date_cible,unite
Déployer le plan vélo,Kilomètres d'aménagements cyclables sécurisés,km-amenagement-cyclables-securises,65,Hautes-Pyrénées,112.0,2020-09-30,112.0,2017-12-31,0.0,0.0,156.0,0.0,2022-03-31,kilomètres
Mettre en œuvre la sortie du plastique à usage unique et lutter contre le gaspillage,Nombre de Français qui peuvent mettre tous les emballages dans le bac jaune,nb-francais-emballages-bac-jaune,65,Hautes-Pyrénées,0.0,2020-06-30,0.0,2017-06-30,0.0,,230000.0,0.0,2022-12-31,habitants
Verdir le parc automobile,Nombre de primes à la conversion et de bonus écologiques,nb-primes-conversion,65,Hautes-Pyrénées,4217.0,2020-09-30,0.0,2018-03-31,4217.0,,,,,primes et bonus
Développer l’apprentissage,Nombre de contrats d’apprentissage,nombre-contrats-apprentissage,65,Hautes-Pyrénées,1028.0,2019-12-31,852.0,2017-12-31,176.0,21.0,,,,contrats
Supprimer la taxe d’habitation sur les résidences principales,Nombre de bénéficiaires totalement exonérés,nb-beneficiaires-suppression-taxe-habitation,65,Hautes-Pyrénées,91577.0,2020-12-31,0.0,2017-01-01,91577.0,,108835.0,84.0,2023-12-31,bénéficiaires
Doubler le nombre de maisons de santé,Nombre de maisons de santé pluri-professionnelles,nb-maisons-sante,65,Hautes-Pyrénées,13.0,2020-06-30,7.0,2017-06-30,6.0,86.0,,,,maisons de santé
Allonger le congé paternité pour un meilleur développement de l’enfant,Nombre de pères / conjoints prenant un congé de paternité et d’accueil de l’enfant,nb-peres-conge-paternite,65,Hautes-Pyrénées,815.0,2019-12-31,,,,,,,,pères dans l'année
Simplifier l’accès aux droits des personnes handicapées,Durée moyenne de traitement pour les demandes d’allocation adulte handicapé,duree-moyenne-traitement-demandes-allocation-adulte-handicape,65,Hautes-Pyrénées,4.2,2019-12-31,4.0,2017-12-31,0.0,5.0,3.0,-20.0,2022-12-31,mois de traitement
"Proposer une offre de lunettes, appareils auditifs et prothèses dentaires remboursée à 100%",Part des équipements/soins auditives 100% santé dans le total des soins,tx-equipements-audio,65,Hautes-Pyrénées,18.31,2020-10-31,7.25,2019-01-31,11.0,153.0,,,,%
"Proposer une offre de lunettes, appareils auditifs et prothèses dentaires remboursée à 100%",Part des équipements/soins 100% santé dans le total des soins dentaires,tx-equipements-dentaire,65,Hautes-Pyrénées,65.6,2020-09-30,32.64,2019-04-30,33.0,101.0,,,,%
"Proposer une offre de lunettes, appareils auditifs et prothèses dentaires remboursée à 100%",Part des équipements/soins 100% santé dans le total des soins optiques,tx-equipements-optique,65,Hautes-Pyrénées,12.7,2020-10-31,12.04,2020-01-31,1.0,5.0,,,,%
"Dédoubler les classes en REP (grande section, CP, CE1)",Part des classes de CP et CE1 en REP dédoublées,tx-classes-cp-ce1-rep,65,Hautes-Pyrénées,100.0,2020-10-31,100.0,2019-10-31,0.0,0.0,,,,% des classes
"Dédoubler les classes en REP (grande section, CP, CE1)",Part des classes de grande section en REP dédoublées,tx-gs-rep,65,Hautes-Pyrénées,49.0,2020-11-30,4.0,2019-11-30,45.0,1125.0,99.0,47.0,2022-11-30,% des classes
"Limiter les classes à 24 en grande section, CP, CE1","Part des classes de GS, CP ou CE1 ayant un effectif inférieur ou égal à 24 élèves",tx-classes-cp-ce1,65,Hautes-Pyrénées,89.0,2020-09-30,86.0,2019-09-30,3.0,3.0,100.0,21.0,2022-09-30,% des classes
Offrir une scolarisation inclusive à tous les enfants handicapés,"Nombre d’unités locales d’inclusion scolaires (ULIS) pour les élèves en situation de handicap à l’école maternelle, à l’école élémentaire, au collège et au lycée",nombre-creation-ulis,65,Hautes-Pyrénées,35.0,2020-09-30,29.0,2017-09-30,6.0,21.0,38.0,67.0,2022-09-30,unités
Offrir une scolarisation inclusive à tous les enfants handicapés,Nombre de classes adaptées à la scolarisation des enfants autistes (UEMA/UEEA) à l’école maternelle et à l’école élémentaire,nombre-creation-ueea,65,Hautes-Pyrénées,1.0,2020-09-30,1.0,2017-09-30,0.0,0.0,2.0,0.0,2022-09-30,classes
Déployer Parcoursup ,Taux de réussite aux examens de licence 1,tx-reussite-examens,65,Hautes-Pyrénées,43.0,2019-10-31,43.0,2017-10-31,0.0,0.0,,,,% de réussite
Renforcer la sécurité du quotidien,Nombre d’heures de patrouille de voie publique,nb-heures-patrouille,65,Hautes-Pyrénées,244828.0,2020-10-31,,,,,,,,heures de patrouille dans l'année
Lutter contre les stupéfiants,Nombre d'amendes forfaitaires délictuelles dressées,nb-amendes-delictuelles-dressees,65,Hautes-Pyrénées,78.0,2020-10-31,,,,,,,,amendes dressées dans l'année
Réduire la mortalité sur les routes,Nombre de morts sur les routes,nb-morts-routes,65,Hautes-Pyrénées,7.0,2019-12-31,9.0,2017-12-31,-2.0,-22.0,,,,morts dans l'année
Assurer une bonne couverture en internet fixe et en téléphonie mobile pour tous les Français d'ici 2022,Taux de déploiement de la fibre,taux-deploiement-fibre,65,Hautes-Pyrénées,39.0,2020-06-30,9.0,2017-12-31,30.0,333.0,,,,% de déploiement
Déployer une offre France Services dans tous les territoires ,Nombre de labellisations (atteinte de l'objectif fixé),nb-labellisations-france-services,65,Hautes-Pyrénées,10.0,2020-11-30,0.0,2017-01-01,10.0,,22.0,45.0,2022-12-31,labellisations
Améliorer la qualité du service rendu à l’usager,Part des lieux d’accueil du public qui publient leurs résultats,tx-transparence-resultats,65,Hautes-Pyrénées,79.0,2019-12-31,14.0,2017-12-31,65.0,464.0,,,,% de réseaux
Offrir un logement aux sans-abri : Logement d’abord,Nombre de personnes sans-abri ou en hébergement ayant obtenu un logement social,logement-sans-domicile-hebergement-urgence,65,Hautes-Pyrénées,51.0,2019-12-31,68.0,2017-12-31,-17.0,-25.0,,,,personnes dans l'année
