mesure,indicateur,id_indicateur,code_departement,libelle_departement,valeur_actuelle,date_valeur_actuelle,valeur_initiale,date_valeur_initiale,progression,pourcentage_progression,cible,pourcentage_cible,date_cible,unite
Déployer le plan vélo,Kilomètres d'aménagements cyclables sécurisés,km-amenagement-cyclables-securises,70,Haute-Saône,283.0,2020-09-30,229.0,2017-12-31,54.0,24.0,316.0,62.0,2022-03-31,kilomètres
Mettre en œuvre la sortie du plastique à usage unique et lutter contre le gaspillage,Nombre de Français qui peuvent mettre tous les emballages dans le bac jaune,nb-francais-emballages-bac-jaune,70,Haute-Saône,240000.0,2020-06-30,240000.0,2017-06-30,0.0,0.0,240000.0,,2022-12-31,habitants
Verdir le parc automobile,Nombre de primes à la conversion et de bonus écologiques,nb-primes-conversion,70,Haute-Saône,3893.0,2020-09-30,0.0,2018-03-31,3893.0,,,,,primes et bonus
Développer l’apprentissage,Nombre de contrats d’apprentissage,nombre-contrats-apprentissage,70,Haute-Saône,1365.0,2019-12-31,1064.0,2017-12-31,301.0,28.0,,,,contrats
Supprimer la taxe d’habitation sur les résidences principales,Nombre de bénéficiaires totalement exonérés,nb-beneficiaires-suppression-taxe-habitation,70,Haute-Saône,90128.0,2020-12-31,0.0,2017-01-01,90128.0,,106018.0,85.0,2023-12-31,bénéficiaires
Doubler le nombre de maisons de santé,Nombre de maisons de santé pluri-professionnelles,nb-maisons-sante,70,Haute-Saône,13.0,2020-06-30,9.0,2017-06-30,4.0,44.0,,,,maisons de santé
Allonger le congé paternité pour un meilleur développement de l’enfant,Nombre de pères / conjoints prenant un congé de paternité et d’accueil de l’enfant,nb-peres-conge-paternite,70,Haute-Saône,1093.0,2019-12-31,,,,,,,,pères dans l'année
Simplifier l’accès aux droits des personnes handicapées,Durée moyenne de traitement pour les demandes d’allocation adulte handicapé,duree-moyenne-traitement-demandes-allocation-adulte-handicape,70,Haute-Saône,3.2,2019-12-31,,,,,3.0,,2022-12-31,mois de traitement
"Proposer une offre de lunettes, appareils auditifs et prothèses dentaires remboursée à 100%",Part des équipements/soins auditives 100% santé dans le total des soins,tx-equipements-audio,70,Haute-Saône,9.09,2020-10-31,10.11,2019-01-31,-1.0,-10.0,,,,%
"Proposer une offre de lunettes, appareils auditifs et prothèses dentaires remboursée à 100%",Part des équipements/soins 100% santé dans le total des soins dentaires,tx-equipements-dentaire,70,Haute-Saône,59.75,2020-09-30,35.18,2019-04-30,25.0,70.0,,,,%
"Proposer une offre de lunettes, appareils auditifs et prothèses dentaires remboursée à 100%",Part des équipements/soins 100% santé dans le total des soins optiques,tx-equipements-optique,70,Haute-Saône,7.06,2020-10-31,8.71,2020-01-31,-2.0,-19.0,,,,%
"Dédoubler les classes en REP (grande section, CP, CE1)",Part des classes de CP et CE1 en REP dédoublées,tx-classes-cp-ce1-rep,70,Haute-Saône,100.0,2020-10-31,94.0,2019-10-31,6.0,6.0,,,,% des classes
"Dédoubler les classes en REP (grande section, CP, CE1)",Part des classes de grande section en REP dédoublées,tx-gs-rep,70,Haute-Saône,68.0,2020-11-30,5.0,2019-11-30,63.0,1260.0,100.0,66.0,2022-11-30,% des classes
"Limiter les classes à 24 en grande section, CP, CE1","Part des classes de GS, CP ou CE1 ayant un effectif inférieur ou égal à 24 élèves",tx-classes-cp-ce1,70,Haute-Saône,90.0,2020-09-30,88.0,2019-09-30,2.0,2.0,100.0,17.0,2022-09-30,% des classes
Offrir une scolarisation inclusive à tous les enfants handicapés,"Nombre d’unités locales d’inclusion scolaires (ULIS) pour les élèves en situation de handicap à l’école maternelle, à l’école élémentaire, au collège et au lycée",nombre-creation-ulis,70,Haute-Saône,36.0,2020-09-30,40.0,2017-09-30,-4.0,-10.0,38.0,200.0,2022-09-30,unités
Offrir une scolarisation inclusive à tous les enfants handicapés,Nombre de classes adaptées à la scolarisation des enfants autistes (UEMA/UEEA) à l’école maternelle et à l’école élémentaire,nombre-creation-ueea,70,Haute-Saône,1.0,2020-09-30,1.0,2017-09-30,0.0,0.0,3.0,0.0,2022-09-30,classes
Déployer Parcoursup ,Taux de réussite aux examens de licence 1,tx-reussite-examens,70,Haute-Saône,45.0,2019-10-31,42.0,2017-10-31,3.0,7.0,,,,% de réussite
Renforcer la sécurité du quotidien,Nombre d’heures de patrouille de voie publique,nb-heures-patrouille,70,Haute-Saône,183156.0,2020-10-31,,,,,,,,heures de patrouille dans l'année
Lutter contre les stupéfiants,Nombre d'amendes forfaitaires délictuelles dressées,nb-amendes-delictuelles-dressees,70,Haute-Saône,15.0,2020-10-31,,,,,,,,amendes dressées dans l'année
Réduire la mortalité sur les routes,Nombre de morts sur les routes,nb-morts-routes,70,Haute-Saône,16.0,2019-12-31,33.0,2017-12-31,-17.0,-52.0,,,,morts dans l'année
Assurer une bonne couverture en internet fixe et en téléphonie mobile pour tous les Français d'ici 2022,Taux de déploiement de la fibre,taux-deploiement-fibre,70,Haute-Saône,10.0,2020-06-30,3.0,2017-12-31,7.0,233.0,,,,% de déploiement
Déployer une offre France Services dans tous les territoires ,Nombre de labellisations (atteinte de l'objectif fixé),nb-labellisations-france-services,70,Haute-Saône,8.0,2020-11-30,0.0,2017-01-01,8.0,,23.0,35.0,2022-12-31,labellisations
Améliorer la qualité du service rendu à l’usager,Part des lieux d’accueil du public qui publient leurs résultats,tx-transparence-resultats,70,Haute-Saône,64.0,2019-12-31,14.0,2017-12-31,50.0,357.0,,,,% de réseaux
Offrir un logement aux sans-abri : Logement d’abord,Nombre de personnes sans-abri ou en hébergement ayant obtenu un logement social,logement-sans-domicile-hebergement-urgence,70,Haute-Saône,106.0,2019-12-31,84.0,2017-12-31,22.0,26.0,,,,personnes dans l'année
