mesure,indicateur,id_indicateur,code_departement,libelle_departement,valeur_actuelle,date_valeur_actuelle,valeur_initiale,date_valeur_initiale,progression,pourcentage_progression,cible,pourcentage_cible,date_cible,unite
Déployer le plan vélo,Kilomètres d'aménagements cyclables sécurisés,km-amenagement-cyclables-securises,94,Val-de-Marne,402.0,2021-03-31,326.0,2017-12-31,76.0,23.0,441.0,66.0,2022-03-31,kilomètres
Instaurer des zones à faibles émissions,Nombre d'habitants vivant à l'intérieur d'une zone à faibles émissions,nb-habitants-zfe,94,Val-de-Marne,356491.0,2020-12-31,,,,,928860.0,,2022-12-31,habitants
Verdir le parc automobile,Nombre de primes à la conversion et de bonus écologiques,nb-primes-conversion,94,Val-de-Marne,10845.0,2021-05-31,0.0,2018-03-31,10845.0,,31569.0,34.0,2022-06-30,primes et bonus
Verdir le parc automobile,Nombre de bornes de recharge pour véhicules électriques déployées,nb-points-recharge,94,Val-de-Marne,570.0,2021-07-31,0.0,,570.0,,2105.0,27.0,2022-03-31,bornes de recharge
Mettre en œuvre la sortie du plastique à usage unique et lutter contre le gaspillage,Nombre de Français qui peuvent mettre tous les emballages dans le bac jaune,nb-francais-emballages-bac-jaune,94,Val-de-Marne,1150000.0,2020-12-31,430000.0,2017-06-30,720000.0,167.0,1370000.0,77.0,2022-12-31,habitants
