mesure,indicateur,id_indicateur,code_departement,libelle_departement,valeur_actuelle,date_valeur_actuelle,valeur_initiale,date_valeur_initiale,progression,pourcentage_progression,cible,pourcentage_cible,date_cible,unite
Déployer le plan vélo,Kilomètres d'aménagements cyclables sécurisés,km-amenagement-cyclables-securises,92,Hauts-de-Seine,352.0,2021-03-31,223.0,2017-12-31,129.0,58.0,380.0,82.0,2022-03-31,kilomètres
Instaurer des zones à faibles émissions,Nombre d'habitants vivant à l'intérieur d'une zone à faibles émissions,nb-habitants-zfe,92,Hauts-de-Seine,948812.0,2020-12-31,,,,,1077018.0,,2022-12-31,habitants
Verdir le parc automobile,Nombre de primes à la conversion et de bonus écologiques,nb-primes-conversion,92,Hauts-de-Seine,26094.0,2021-05-31,0.0,2018-03-31,26094.0,,36336.0,72.0,2022-06-30,primes et bonus
Verdir le parc automobile,Nombre de bornes de recharge pour véhicules électriques déployées,nb-points-recharge,92,Hauts-de-Seine,1003.0,2021-07-31,0.0,,1003.0,,2422.0,41.0,2022-03-31,bornes de recharge
Mettre en œuvre la sortie du plastique à usage unique et lutter contre le gaspillage,Nombre de Français qui peuvent mettre tous les emballages dans le bac jaune,nb-francais-emballages-bac-jaune,92,Hauts-de-Seine,760000.0,2020-12-31,160000.0,2017-06-30,600000.0,375.0,1600000.0,42.0,2022-12-31,habitants
