mesure,indicateur,id_indicateur,code_departement,libelle_departement,valeur_actuelle,date_valeur_actuelle,valeur_initiale,date_valeur_initiale,progression,pourcentage_progression,cible,pourcentage_cible,date_cible,unite
Déployer le plan vélo,Kilomètres d'aménagements cyclables sécurisés,km-amenagement-cyclables-securises,67,Bas-Rhin,1807.0,2021-03-31,1538.0,2017-12-31,269.0,17.0,1898.0,75.0,2022-03-31,kilomètres
Instaurer des zones à faibles émissions,Nombre d'habitants vivant à l'intérieur d'une zone à faibles émissions,nb-habitants-zfe,67,Bas-Rhin,0.0,2020-12-31,0.0,2017-12-31,0.0,,228826.0,0.0,2022-12-31,habitants
Verdir le parc automobile,Nombre de primes à la conversion et de bonus écologiques,nb-primes-conversion,67,Bas-Rhin,18342.0,2021-05-31,0.0,2018-03-31,18342.0,,25537.0,72.0,2022-06-30,primes et bonus
Verdir le parc automobile,Nombre de bornes de recharge pour véhicules électriques déployées,nb-points-recharge,67,Bas-Rhin,513.0,2021-07-31,0.0,,513.0,,1702.0,30.0,2022-03-31,bornes de recharge
Mettre en œuvre la sortie du plastique à usage unique et lutter contre le gaspillage,Nombre de Français qui peuvent mettre tous les emballages dans le bac jaune,nb-francais-emballages-bac-jaune,67,Bas-Rhin,120000.0,2020-12-31,100000.0,2017-06-30,20000.0,20.0,1120000.0,2.0,2022-12-31,habitants
