mesure,indicateur,id_indicateur,code_departement,libelle_departement,valeur_actuelle,date_valeur_actuelle,valeur_initiale,date_valeur_initiale,progression,pourcentage_progression,cible,pourcentage_cible,date_cible,unite
Déployer le plan vélo,Kilomètres d'aménagements cyclables sécurisés,km-amenagement-cyclables-securises,83,Var,401.0,2021-12-31,384.0,2017-12-31,17.0,4.0,522.0,12.0,2022-03-31,kilomètres
Instaurer des zones à faibles émissions,Nombre d'habitants vivant à l'intérieur d'une zone à faibles émissions,nb-habitants-zfe,83,Var,0.0,2022-02-28,0.0,2017-12-31,0.0,,281651.0,0.0,2022-12-31,habitants
Verdir le parc automobile,Nombre de primes à la conversion et de bonus écologiques,nb-primes-conversion,83,Var,24200.0,2022-01-31,0.0,2018-01-31,24200.0,,24137.0,100.0,2022-06-30,primes et bonus
Verdir le parc automobile,Nombre de bornes de recharge pour véhicules électriques déployées,nb-points-recharge,83,Var,1029.0,2022-01-31,440.0,2019-09-30,589.0,134.0,1609.0,50.0,2022-03-31,bornes de recharge
Mettre en œuvre la sortie du plastique à usage unique et lutter contre le gaspillage,Nombre de Français qui peuvent mettre tous les emballages dans le bac jaune,nb-francais-emballages-bac-jaune,83,Var,530000.0,2021-12-31,500000.0,2017-06-30,30000.0,6.0,1050000.0,5.0,2022-12-31,habitants
