mesure,indicateur,id_indicateur,code_departement,libelle_departement,valeur_actuelle,date_valeur_actuelle,valeur_initiale,date_valeur_initiale,progression,pourcentage_progression,cible,pourcentage_cible,date_cible,unite
Déployer le plan vélo,Kilomètres d'aménagements cyclables sécurisés,km-amenagement-cyclables-securises,69,Rhône,906.0,2021-12-31,769.0,2017-12-31,137.0,18.0,960.0,72.0,2022-03-31,kilomètres
Instaurer des zones à faibles émissions,Nombre d'habitants vivant à l'intérieur d'une zone à faibles émissions,nb-habitants-zfe,69,Rhône,799510.0,2022-02-28,0.0,2017-12-31,799510.0,,809664.0,99.0,2022-12-31,habitants
Verdir le parc automobile,Nombre de primes à la conversion et de bonus écologiques,nb-primes-conversion,69,Rhône,34863.0,2022-01-31,0.0,2018-01-31,34863.0,,42118.0,83.0,2022-06-30,primes et bonus
Verdir le parc automobile,Nombre de bornes de recharge pour véhicules électriques déployées,nb-points-recharge,69,Rhône,1277.0,2022-01-31,723.0,2019-09-30,554.0,77.0,2808.0,27.0,2022-03-31,bornes de recharge
Mettre en œuvre la sortie du plastique à usage unique et lutter contre le gaspillage,Nombre de Français qui peuvent mettre tous les emballages dans le bac jaune,nb-francais-emballages-bac-jaune,69,Rhône,1500000.0,2021-12-31,80000.0,2017-06-30,1420000.0,1775.0,1820000.0,82.0,2022-12-31,habitants
