mesure,indicateur,id_indicateur,code_region,libelle_region,valeur_actuelle,date_valeur_actuelle,valeur_initiale,date_valeur_initiale,progression,pourcentage_progression,cible,pourcentage_cible,date_cible,unite
Déployer le plan vélo,Kilomètres d'aménagements cyclables sécurisés,km-amenagement-cyclables-securises,52,Pays de la Loire,4770.0,2021-12-31,3359.0,2017-12-31,1411.0,42.0,4840.0,95.0,2022-03-31,kilomètres
Verdir le parc automobile,Nombre de primes à la conversion et de bonus écologiques,nb-primes-conversion,52,Pays de la Loire,95269.0,2022-01-31,0.0,2018-01-31,95269.0,,85389.0,100.0,2022-06-30,primes et bonus
Verdir le parc automobile,Nombre de bornes de recharge pour véhicules électriques déployées,nb-points-recharge,52,Pays de la Loire,2369.0,2022-01-31,1461.0,2019-09-30,908.0,62.0,5693.0,21.0,2022-03-31,bornes de recharge
Mettre en œuvre la sortie du plastique à usage unique et lutter contre le gaspillage,Nombre de Français qui peuvent mettre tous les emballages dans le bac jaune,nb-francais-emballages-bac-jaune,52,Pays de la Loire,3700000.0,2021-12-31,1270000.0,2017-06-30,2430000.0,191.0,3730000.0,99.0,2022-12-31,habitants
Plan de soutien aux petites lignes ferroviaires,Nombre de kilomètres de lignes rénovées,nb-km-lignes-regenerees,52,Pays de la Loire,139.0,2021-11-30,0.0,2017-01-31,139.0,,144.0,97.0,2022-12-31,kilomètres
