mesure,indicateur,id_indicateur,code_region,libelle_region,valeur_actuelle,date_valeur_actuelle,valeur_initiale,date_valeur_initiale,progression,pourcentage_progression,cible,pourcentage_cible,date_cible,unite
Déployer le plan vélo,Kilomètres d'aménagements cyclables sécurisés,km-amenagement-cyclables-securises,75,Nouvelle-Aquitaine,6943.0,2021-03-31,5548.0,2017-12-31,1395.0,25.0,7424.0,74.0,2022-03-31,kilomètres
Verdir le parc automobile,Nombre de primes à la conversion et de bonus écologiques,nb-primes-conversion,75,Nouvelle-Aquitaine,118185.0,2021-05-31,0.0,2018-03-31,118185.0,,134372.0,88.0,2022-06-30,primes et bonus
Verdir le parc automobile,Nombre de bornes de recharge pour véhicules électriques déployées,nb-points-recharge,75,Nouvelle-Aquitaine,3929.0,2021-07-31,0.0,,3929.0,,8958.0,44.0,2022-03-31,bornes de recharge
Mettre en œuvre la sortie du plastique à usage unique et lutter contre le gaspillage,Nombre de Français qui peuvent mettre tous les emballages dans le bac jaune,nb-francais-emballages-bac-jaune,75,Nouvelle-Aquitaine,3370000.0,2020-12-31,2050000.0,2017-06-30,1320000.0,64.0,5900000.0,34.0,2022-12-31,habitants
Plan de soutien aux petites lignes ferroviaires,Nombre de kilomètres de lignes rénovées,nb-km-lignes-regenerees,75,Nouvelle-Aquitaine,160.0,2021-05-31,23.0,2017-12-31,137.0,596.0,232.0,66.0,2022-12-31,kilomètres
