mesure,indicateur,id_indicateur,code_region,libelle_region,valeur_actuelle,date_valeur_actuelle,valeur_initiale,date_valeur_initiale,progression,pourcentage_progression,cible,pourcentage_cible,date_cible,unite
Déployer le plan vélo,Kilomètres d'aménagements cyclables sécurisés,km-amenagement-cyclables-securises,75,Nouvelle-Aquitaine,7112.0,2021-09-30,5548.0,2017-12-31,1564.0,28.0,7424.0,83.0,2022-03-31,kilomètres
Verdir le parc automobile,Nombre de primes à la conversion et de bonus écologiques,nb-primes-conversion,75,Nouvelle-Aquitaine,140736.0,2021-12-31,0.0,2018-03-31,140736.0,,134372.0,100.0,2022-06-30,primes et bonus
Verdir le parc automobile,Nombre de bornes de recharge pour véhicules électriques déployées,nb-points-recharge,75,Nouvelle-Aquitaine,4798.0,2021-11-30,3084.0,2019-09-30,1714.0,56.0,8958.0,29.0,2022-03-31,bornes de recharge
Mettre en œuvre la sortie du plastique à usage unique et lutter contre le gaspillage,Nombre de Français qui peuvent mettre tous les emballages dans le bac jaune,nb-francais-emballages-bac-jaune,75,Nouvelle-Aquitaine,3660000.0,2021-06-30,2050000.0,2017-06-30,1610000.0,79.0,5900000.0,42.0,2022-12-31,habitants
Plan de soutien aux petites lignes ferroviaires,Nombre de kilomètres de lignes rénovées,nb-km-lignes-regenerees,75,Nouvelle-Aquitaine,180.0,2021-11-30,0.0,2017-01-31,180.0,,232.0,78.0,2022-12-31,kilomètres
