mesure,indicateur,id_indicateur,code_region,libelle_region,valeur_actuelle,date_valeur_actuelle,valeur_initiale,date_valeur_initiale,progression,pourcentage_progression,cible,pourcentage_cible,date_cible,unite
Déployer le plan vélo,Kilomètres d'aménagements cyclables sécurisés,km-amenagement-cyclables-securises,53,Bretagne,4003.0,2021-03-31,2843.0,2017-12-31,1160.0,41.0,4084.0,93.0,2022-03-31,kilomètres
Verdir le parc automobile,Nombre de primes à la conversion et de bonus écologiques,nb-primes-conversion,53,Bretagne,73918.0,2021-05-31,0.0,2018-03-31,73918.0,,75004.0,99.0,2022-06-30,primes et bonus
Verdir le parc automobile,Nombre de bornes de recharge pour véhicules électriques déployées,nb-points-recharge,53,Bretagne,2051.0,2021-07-31,0.0,,2051.0,,5000.0,41.0,2022-03-31,bornes de recharge
Mettre en œuvre la sortie du plastique à usage unique et lutter contre le gaspillage,Nombre de Français qui peuvent mettre tous les emballages dans le bac jaune,nb-francais-emballages-bac-jaune,53,Bretagne,2440000.0,2020-12-31,1240000.0,2017-06-30,1200000.0,97.0,3290000.0,59.0,2022-12-31,habitants
Plan de soutien aux petites lignes ferroviaires,Nombre de kilomètres de lignes rénovées,nb-km-lignes-regenerees,53,Bretagne,84.0,2021-05-31,22.0,2017-12-31,62.0,282.0,111.0,70.0,2022-12-31,kilomètres
