mesure,indicateur,id_indicateur,code_region,libelle_region,valeur_actuelle,date_valeur_actuelle,valeur_initiale,date_valeur_initiale,progression,pourcentage_progression,cible,pourcentage_cible,date_cible,unite
Déployer le plan vélo,Kilomètres d'aménagements cyclables sécurisés,km-amenagement-cyclables-securises,52,Pays de la Loire,4601.0,2021-03-31,3359.0,2017-12-31,1242.0,37.0,4840.0,84.0,2022-03-31,kilomètres
Verdir le parc automobile,Nombre de primes à la conversion et de bonus écologiques,nb-primes-conversion,52,Pays de la Loire,81356.0,2021-05-31,0.0,2018-03-31,81356.0,,85389.0,95.0,2022-06-30,primes et bonus
Verdir le parc automobile,Nombre de bornes de recharge pour véhicules électriques déployées,nb-points-recharge,52,Pays de la Loire,1954.0,2021-07-31,0.0,,1954.0,,5693.0,34.0,2022-03-31,bornes de recharge
Mettre en œuvre la sortie du plastique à usage unique et lutter contre le gaspillage,Nombre de Français qui peuvent mettre tous les emballages dans le bac jaune,nb-francais-emballages-bac-jaune,52,Pays de la Loire,3030000.0,2020-12-31,1260000.0,2017-06-30,1770000.0,140.0,3730000.0,72.0,2022-12-31,habitants
Plan de soutien aux petites lignes ferroviaires,Nombre de kilomètres de lignes rénovées,nb-km-lignes-regenerees,52,Pays de la Loire,130.0,2021-05-31,23.0,2017-12-31,107.0,465.0,144.0,88.0,2022-12-31,kilomètres
