mesure,indicateur,id_indicateur,code_region,libelle_region,valeur_actuelle,date_valeur_actuelle,valeur_initiale,date_valeur_initiale,progression,pourcentage_progression,cible,pourcentage_cible,date_cible,unite
Renforcer la sécurité du quotidien,Nombre d’heures de patrouille de voie publique,nb-heures-patrouille,32,Hauts-de-France,632905.0,2021-02-28,954815.0,2017-03-31,-321910.0,-34.0,,,,heures de patrouille dans l'année
Lutter contre les stupéfiants,Nombre d'amendes forfaitaires délictuelles dressées,nb-amendes-delictuelles-dressees,32,Hauts-de-France,2455.0,2021-03-31,0.0,,2455.0,,,,,amendes dressées dans l'année
Lutter contre les violences faites aux femmes,Nombre d’ordonnances de protection délivrées,nb-ordonnances-delivrees,32,Hauts-de-France,199.0,2020-12-31,53.0,2017-12-31,146.0,275.0,,,,ordonnances dans l'année
Lutter contre les atteintes aux principes républicains,Nombre de contrôles réalisés dans le cadre des CLIR ou des dispositifs existant localement avant la mise en place progressive des CLIR,nb-controles-clir,32,Hauts-de-France,382.0,2020-12-31,268.0,2018-12-31,114.0,43.0,,,,contrôles dans l'année
Réduire la mortalité sur les routes,Nombre de morts sur les routes,nb-morts-routes,32,Hauts-de-France,192.0,2020-12-31,289.0,2017-12-31,-97.0,-34.0,,,,morts dans l'année
