mesure,indicateur,id_indicateur,code_departement,libelle_departement,valeur_actuelle,date_valeur_actuelle,valeur_initiale,date_valeur_initiale,progression,pourcentage_progression,cible,pourcentage_cible,date_cible,unite
"Dédoubler les classes en éducation prioritaire (grande section, CP, CE1) ",Part des classes de CP et CE1 en éducation prioritaire dédoublées,tx-classes-cp-ce1-rep,78,Yvelines,100.0,2022-09-30,96.0,2019-10-31,4.0,4.0,100.0,100.0,2021-10-31,% des classes
"Dédoubler les classes en éducation prioritaire (grande section, CP, CE1) ",Part des classes de grande section en éducation prioritaire dédoublées,tx-gs-rep,78,Yvelines,40.0,2022-09-30,1.0,2019-11-30,39.0,3900.0,60.0,66.0,2022-11-30,% des classes
"Limiter les classes à 24 en grande section, CP, CE1","Part des classes de GS, CP ou CE1 ayant un effectif inférieur ou égal à 24 élèves",tx-classes-cp-ce1,78,Yvelines,73.0,2022-09-30,55.0,2019-09-30,18.0,33.0,100.0,40.0,2022-09-30,% des classes
Devoirs faits au collège,Part de collégiens bénéficiant du dispositif (en %),taux-collegiens-beneficiaires,78,Yvelines,25.0,2022-09-30,19.0,2018-03-31,6.0,32.0,26.0,86.0,2022-12-31,% de collégiens
Offrir une scolarisation inclusive à tous les enfants handicapés,"Nombre d’unités locales d’inclusion scolaires (ULIS) pour les élèves en situation de handicap à l’école maternelle, à l’école élémentaire, au collège et au lycée",nombre-creation-ulis,78,Yvelines,167.0,2022-09-30,153.0,2017-09-30,14.0,9.0,168.0,93.0,2022-09-30,unités
Offrir une scolarisation inclusive à tous les enfants handicapés,Nombre de classes adaptées à la scolarisation des enfants autistes (UEMA/UEEA) à l’école maternelle et à l’école élémentaire,nombre-creation-ueea,78,Yvelines,6.0,2022-09-30,1.0,2017-09-30,5.0,500.0,7.0,83.0,2022-09-30,classes
Déployer Parcoursup ,Taux de réussite aux examens de licence 1,tx-reussite-examens,78,Yvelines,43.0,2021-10-31,42.3,2017-10-31,1.0,2.0,47.0,15.0,2022-10-31,% de réussite
Promouvoir l'engagement chez les jeunes,Nombre de volontaires ayant réalisé au moins un jour de mission de service civique dans l'année,nb-jeunes-engages,78,Yvelines,1588.0,2021-12-31,1324.0,2017-12-31,264.0,20.0,,,,jeunes
