mesure,indicateur,id_indicateur,code_departement,libelle_departement,valeur_actuelle,date_valeur_actuelle,valeur_initiale,date_valeur_initiale,progression,pourcentage_progression,cible,pourcentage_cible,date_cible,unite
"Dédoubler les classes en éducation prioritaire (grande section, CP, CE1) ",Part des classes de CP et CE1 en éducation prioritaire dédoublées,tx-classes-cp-ce1-rep,39,Jura,100.0,2022-09-30,95.0,2019-10-31,5.0,5.0,100.0,100.0,2021-10-31,% des classes
"Dédoubler les classes en éducation prioritaire (grande section, CP, CE1) ",Part des classes de grande section en éducation prioritaire dédoublées,tx-gs-rep,39,Jura,100.0,2022-09-30,0.0,2019-11-30,100.0,,94.0,100.0,2022-11-30,% des classes
"Limiter les classes à 24 en grande section, CP, CE1","Part des classes de GS, CP ou CE1 ayant un effectif inférieur ou égal à 24 élèves",tx-classes-cp-ce1,39,Jura,89.0,2022-09-30,72.0,2019-09-30,17.0,24.0,100.0,61.0,2022-09-30,% des classes
Devoirs faits au collège,Part de collégiens bénéficiant du dispositif (en %),taux-collegiens-beneficiaires,39,Jura,30.0,2022-09-30,23.0,2018-03-31,7.0,30.0,38.0,47.0,2022-12-31,% de collégiens
Offrir une scolarisation inclusive à tous les enfants handicapés,"Nombre d’unités locales d’inclusion scolaires (ULIS) pour les élèves en situation de handicap à l’école maternelle, à l’école élémentaire, au collège et au lycée",nombre-creation-ulis,39,Jura,46.0,2022-09-30,40.0,2017-09-30,6.0,15.0,46.0,100.0,2022-09-30,unités
Offrir une scolarisation inclusive à tous les enfants handicapés,Nombre de classes adaptées à la scolarisation des enfants autistes (UEMA/UEEA) à l’école maternelle et à l’école élémentaire,nombre-creation-ueea,39,Jura,3.0,2022-09-30,1.0,2017-09-30,2.0,200.0,3.0,100.0,2022-09-30,classes
Déployer Parcoursup ,Taux de réussite aux examens de licence 1,tx-reussite-examens,39,Jura,47.3,2021-10-31,42.5,2017-10-31,5.0,11.0,47.0,100.0,2022-10-31,% de réussite
Promouvoir l'engagement chez les jeunes,Nombre de volontaires ayant réalisé au moins un jour de mission de service civique dans l'année,nb-jeunes-engages,39,Jura,387.0,2021-12-31,288.0,2017-12-31,99.0,34.0,,,,jeunes
