mesure,indicateur,id_indicateur,code_departement,libelle_departement,valeur_actuelle,date_valeur_actuelle,valeur_initiale,date_valeur_initiale,progression,pourcentage_progression,cible,pourcentage_cible,date_cible,unite
"Dédoubler les classes en REP (grande section, CP, CE1)",Part des classes de CP et CE1 en REP dédoublées,tx-classes-cp-ce1-rep,19,Corrèze,100.0,2020-10-31,100.0,2019-10-31,0.0,0.0,100.0,,2021-10-31,% des classes
"Dédoubler les classes en REP (grande section, CP, CE1)",Part des classes de grande section en REP dédoublées,tx-gs-rep,19,Corrèze,13.0,2020-11-30,46.0,2019-11-30,-33.0,-72.0,78.0,-103.0,2022-11-30,% des classes
"Limiter les classes à 24 en grande section, CP, CE1","Part des classes de GS, CP ou CE1 ayant un effectif inférieur ou égal à 24 élèves",tx-classes-cp-ce1,19,Corrèze,88.0,2020-09-30,88.0,2019-09-30,0.0,0.0,100.0,0.0,2022-09-30,% des classes
Devoirs faits au collège,Part de collégiens bénéficiant du dispositif (en %),taux-collegiens-beneficiaires,19,Corrèze,33.0,2020-09-30,27.0,2018-03-31,6.0,22.0,34.0,86.0,2022-12-31,% de collégiens
Offrir une scolarisation inclusive à tous les enfants handicapés,"Nombre d’unités locales d’inclusion scolaires (ULIS) pour les élèves en situation de handicap à l’école maternelle, à l’école élémentaire, au collège et au lycée",nombre-creation-ulis,19,Corrèze,32.0,2020-09-30,32.0,2017-09-30,0.0,0.0,32.0,,2022-09-30,unités
Offrir une scolarisation inclusive à tous les enfants handicapés,Nombre de classes adaptées à la scolarisation des enfants autistes (UEMA/UEEA) à l’école maternelle et à l’école élémentaire,nombre-creation-ueea,19,Corrèze,2.0,2020-09-30,1.0,2017-09-30,1.0,100.0,2.0,100.0,2022-09-30,classes
Déployer Parcoursup ,Taux de réussite aux examens de licence 1,tx-reussite-examens,19,Corrèze,42.0,2019-10-31,42.0,2017-10-31,0.0,0.0,,,,% de réussite
