mesure,indicateur,id_indicateur,code_departement,libelle_departement,valeur_actuelle,date_valeur_actuelle,valeur_initiale,date_valeur_initiale,progression,pourcentage_progression,cible,pourcentage_cible,date_cible,unite
"Dédoubler les classes en éducation prioritaire (grande section, CP, CE1) ",Part des classes de CP et CE1 en éducation prioritaire dédoublées,tx-classes-cp-ce1-rep,02,Aisne,100.0,2021-10-31,95.0,2019-10-31,5.0,5.0,100.0,100.0,2021-10-31,% des classes
"Dédoubler les classes en éducation prioritaire (grande section, CP, CE1) ",Part des classes de grande section en éducation prioritaire dédoublées,tx-gs-rep,02,Aisne,44.0,2021-10-31,3.0,2019-11-30,41.0,1367.0,67.0,64.0,2022-11-30,% des classes
"Limiter les classes à 24 en grande section, CP, CE1","Part des classes de GS, CP ou CE1 ayant un effectif inférieur ou égal à 24 élèves",tx-classes-cp-ce1,02,Aisne,90.0,2021-09-30,84.0,2019-09-30,6.0,7.0,100.0,38.0,2022-09-30,% des classes
Devoirs faits au collège,Part de collégiens bénéficiant du dispositif (en %),taux-collegiens-beneficiaires,02,Aisne,39.0,2021-09-30,33.0,2018-03-31,6.0,18.0,37.0,100.0,2022-12-31,% de collégiens
Offrir une scolarisation inclusive à tous les enfants handicapés,"Nombre d’unités locales d’inclusion scolaires (ULIS) pour les élèves en situation de handicap à l’école maternelle, à l’école élémentaire, au collège et au lycée",nombre-creation-ulis,02,Aisne,122.0,2021-09-30,108.0,2017-09-30,14.0,13.0,123.0,93.0,2022-09-30,unités
Offrir une scolarisation inclusive à tous les enfants handicapés,Nombre de classes adaptées à la scolarisation des enfants autistes (UEMA/UEEA) à l’école maternelle et à l’école élémentaire,nombre-creation-ueea,02,Aisne,3.0,2021-09-30,1.0,2017-09-30,2.0,200.0,5.0,50.0,2022-09-30,classes
Déployer Parcoursup ,Taux de réussite aux examens de licence 1,tx-reussite-examens,02,Aisne,52.7,2020-10-31,39.4,2017-10-31,13.0,34.0,47.0,100.0,2022-10-31,% de réussite
Promouvoir l'engagement chez les jeunes,Nombre de volontaires ayant réalisé au moins un jour de mission de service civique dans l'année,nb-jeunes-engages,02,Aisne,1623.0,2021-12-31,1099.0,2017-12-31,524.0,48.0,,,,jeunes
