mesure,indicateur,id_indicateur,code_departement,libelle_departement,valeur_actuelle,date_valeur_actuelle,valeur_initiale,date_valeur_initiale,progression,pourcentage_progression,cible,pourcentage_cible,date_cible,unite
"Dédoubler les classes en REP (grande section, CP, CE1)",Part des classes de CP et CE1 en REP dédoublées,tx-classes-cp-ce1-rep,16,Charente,100.0,2020-10-31,90.0,2019-10-31,10.0,11.0,100.0,100.0,2021-10-31,% des classes
"Dédoubler les classes en REP (grande section, CP, CE1)",Part des classes de grande section en REP dédoublées,tx-gs-rep,16,Charente,0.0,2020-11-30,0.0,2019-11-30,0.0,,81.0,0.0,2022-11-30,% des classes
"Limiter les classes à 24 en grande section, CP, CE1","Part des classes de GS, CP ou CE1 ayant un effectif inférieur ou égal à 24 élèves",tx-classes-cp-ce1,16,Charente,78.0,2020-09-30,74.0,2019-09-30,4.0,5.0,100.0,15.0,2022-09-30,% des classes
Devoirs faits au collège,Part de collégiens bénéficiant du dispositif (en %),taux-collegiens-beneficiaires,16,Charente,33.0,2020-09-30,26.0,2018-03-31,7.0,27.0,34.0,88.0,2022-12-31,% de collégiens
Offrir une scolarisation inclusive à tous les enfants handicapés,"Nombre d’unités locales d’inclusion scolaires (ULIS) pour les élèves en situation de handicap à l’école maternelle, à l’école élémentaire, au collège et au lycée",nombre-creation-ulis,16,Charente,45.0,2020-09-30,44.0,2017-09-30,1.0,2.0,49.0,20.0,2022-09-30,unités
Offrir une scolarisation inclusive à tous les enfants handicapés,Nombre de classes adaptées à la scolarisation des enfants autistes (UEMA/UEEA) à l’école maternelle et à l’école élémentaire,nombre-creation-ueea,16,Charente,2.0,2020-09-30,1.0,2017-09-30,1.0,100.0,4.0,33.0,2022-09-30,classes
Déployer Parcoursup ,Taux de réussite aux examens de licence 1,tx-reussite-examens,16,Charente,54.3,2019-10-31,48.9,2017-10-31,5.0,11.0,47.0,100.0,2022-10-31,% de réussite
Promouvoir l'engagement chez les jeunes,Nombre de volontaires ayant réalisé au moins un jour de mission de service civique dans l'année,nb-jeunes-engages,16,Charente,598.0,2020-12-31,724.0,2017-12-31,-126.0,-17.0,,,,jeunes
