mesure,indicateur,id_indicateur,code_departement,libelle_departement,valeur_actuelle,date_valeur_actuelle,valeur_initiale,date_valeur_initiale,progression,pourcentage_progression,cible,pourcentage_cible,date_cible,unite
"Dédoubler les classes en REP (grande section, CP, CE1)",Part des classes de CP et CE1 en REP dédoublées,tx-classes-cp-ce1-rep,88,Vosges,100.0,2020-10-31,93.0,2019-10-31,7.0,8.0,,,,% des classes
"Dédoubler les classes en REP (grande section, CP, CE1)",Part des classes de grande section en REP dédoublées,tx-gs-rep,88,Vosges,44.0,2020-11-30,12.0,2019-11-30,32.0,267.0,89.0,42.0,2022-11-30,% des classes
"Limiter les classes à 24 en grande section, CP, CE1","Part des classes de GS, CP ou CE1 ayant un effectif inférieur ou égal à 24 élèves",tx-classes-cp-ce1,88,Vosges,95.0,2020-09-30,88.0,2019-09-30,7.0,8.0,100.0,58.0,2022-09-30,% des classes
Offrir une scolarisation inclusive à tous les enfants handicapés,"Nombre d’unités locales d’inclusion scolaires (ULIS) pour les élèves en situation de handicap à l’école maternelle, à l’école élémentaire, au collège et au lycée",nombre-creation-ulis,88,Vosges,88.0,2020-09-30,78.0,2017-09-30,10.0,13.0,92.0,71.0,2022-09-30,unités
Offrir une scolarisation inclusive à tous les enfants handicapés,Nombre de classes adaptées à la scolarisation des enfants autistes (UEMA/UEEA) à l’école maternelle et à l’école élémentaire,nombre-creation-ueea,88,Vosges,2.0,2020-09-30,1.0,2017-09-30,1.0,100.0,3.0,50.0,2022-09-30,classes
Déployer Parcoursup ,Taux de réussite aux examens de licence 1,tx-reussite-examens,88,Vosges,41.0,2019-10-31,37.0,2017-10-31,4.0,11.0,,,,% de réussite
