mesure,indicateur,id_indicateur,code_departement,libelle_departement,valeur_actuelle,date_valeur_actuelle,valeur_initiale,date_valeur_initiale,progression,pourcentage_progression,cible,pourcentage_cible,date_cible,unite
"Dédoubler les classes en REP (grande section, CP, CE1)",Part des classes de CP et CE1 en REP dédoublées,tx-classes-cp-ce1-rep,59,Nord,100.0,2020-10-31,97.0,2019-10-31,3.0,3.0,100.0,100.0,2021-10-31,% des classes
"Dédoubler les classes en REP (grande section, CP, CE1)",Part des classes de grande section en REP dédoublées,tx-gs-rep,59,Nord,8.0,2020-11-30,7.0,2019-11-30,1.0,14.0,72.0,2.0,2022-11-30,% des classes
"Limiter les classes à 24 en grande section, CP, CE1","Part des classes de GS, CP ou CE1 ayant un effectif inférieur ou égal à 24 élèves",tx-classes-cp-ce1,59,Nord,79.0,2020-09-30,74.0,2019-09-30,5.0,7.0,100.0,19.0,2022-09-30,% des classes
Devoirs faits au collège,Part de collégiens bénéficiant du dispositif (en %),taux-collegiens-beneficiaires,59,Nord,35.0,2020-09-30,28.0,2018-03-31,7.0,25.0,37.0,78.0,2022-12-31,% de collégiens
Offrir une scolarisation inclusive à tous les enfants handicapés,"Nombre d’unités locales d’inclusion scolaires (ULIS) pour les élèves en situation de handicap à l’école maternelle, à l’école élémentaire, au collège et au lycée",nombre-creation-ulis,59,Nord,436.0,2020-09-30,405.0,2017-09-30,31.0,8.0,465.0,52.0,2022-09-30,unités
Offrir une scolarisation inclusive à tous les enfants handicapés,Nombre de classes adaptées à la scolarisation des enfants autistes (UEMA/UEEA) à l’école maternelle et à l’école élémentaire,nombre-creation-ueea,59,Nord,4.0,2020-09-30,1.0,2017-09-30,3.0,300.0,7.0,50.0,2022-09-30,classes
Déployer Parcoursup ,Taux de réussite aux examens de licence 1,tx-reussite-examens,59,Nord,44.0,2019-10-31,40.0,2017-10-31,4.0,10.0,,,,% de réussite
