mesure,indicateur,id_indicateur,code_departement,libelle_departement,valeur_actuelle,date_valeur_actuelle,valeur_initiale,date_valeur_initiale,progression,pourcentage_progression,cible,pourcentage_cible,date_cible,unite
"Dédoubler les classes en REP (grande section, CP, CE1)",Part des classes de CP et CE1 en REP dédoublées,tx-classes-cp-ce1-rep,89,Yonne,100.0,2020-10-31,98.0,2019-10-31,2.0,2.0,,,,% des classes
"Dédoubler les classes en REP (grande section, CP, CE1)",Part des classes de grande section en REP dédoublées,tx-gs-rep,89,Yonne,61.0,2020-11-30,0.0,2019-11-30,61.0,,100.0,61.0,2022-11-30,% des classes
"Limiter les classes à 24 en grande section, CP, CE1","Part des classes de GS, CP ou CE1 ayant un effectif inférieur ou égal à 24 élèves",tx-classes-cp-ce1,89,Yonne,87.0,2020-09-30,82.0,2019-09-30,5.0,6.0,100.0,28.0,2022-09-30,% des classes
Offrir une scolarisation inclusive à tous les enfants handicapés,"Nombre d’unités locales d’inclusion scolaires (ULIS) pour les élèves en situation de handicap à l’école maternelle, à l’école élémentaire, au collège et au lycée",nombre-creation-ulis,89,Yonne,47.0,2020-09-30,42.0,2017-09-30,5.0,12.0,51.0,56.0,2022-09-30,unités
Offrir une scolarisation inclusive à tous les enfants handicapés,Nombre de classes adaptées à la scolarisation des enfants autistes (UEMA/UEEA) à l’école maternelle et à l’école élémentaire,nombre-creation-ueea,89,Yonne,2.0,2020-09-30,1.0,2017-09-30,1.0,100.0,2.0,100.0,2022-09-30,classes
Déployer Parcoursup ,Taux de réussite aux examens de licence 1,tx-reussite-examens,89,Yonne,46.0,2019-10-31,45.0,2017-10-31,1.0,2.0,,,,% de réussite
