mesure,indicateur,id_indicateur,code_departement,libelle_departement,valeur_actuelle,date_valeur_actuelle,valeur_initiale,date_valeur_initiale,progression,pourcentage_progression,cible,pourcentage_cible,date_cible,unite
"Dédoubler les classes en REP (grande section, CP, CE1)",Part des classes de CP et CE1 en REP dédoublées,tx-classes-cp-ce1-rep,45,Loiret,100.0,2020-10-31,96.0,2019-10-31,4.0,4.0,100.0,100.0,2021-10-31,% des classes
"Dédoubler les classes en REP (grande section, CP, CE1)",Part des classes de grande section en REP dédoublées,tx-gs-rep,45,Loiret,2.0,2020-11-30,1.0,2019-11-30,1.0,100.0,63.0,2.0,2022-11-30,% des classes
"Limiter les classes à 24 en grande section, CP, CE1","Part des classes de GS, CP ou CE1 ayant un effectif inférieur ou égal à 24 élèves",tx-classes-cp-ce1,45,Loiret,78.0,2020-09-30,71.0,2019-09-30,7.0,10.0,100.0,24.0,2022-09-30,% des classes
Devoirs faits au collège,Part de collégiens bénéficiant du dispositif (en %),taux-collegiens-beneficiaires,45,Loiret,34.0,2020-09-30,24.0,2018-03-31,10.0,42.0,35.0,91.0,2022-12-31,% de collégiens
Offrir une scolarisation inclusive à tous les enfants handicapés,"Nombre d’unités locales d’inclusion scolaires (ULIS) pour les élèves en situation de handicap à l’école maternelle, à l’école élémentaire, au collège et au lycée",nombre-creation-ulis,45,Loiret,120.0,2020-09-30,99.0,2017-09-30,21.0,21.0,128.0,72.0,2022-09-30,unités
Offrir une scolarisation inclusive à tous les enfants handicapés,Nombre de classes adaptées à la scolarisation des enfants autistes (UEMA/UEEA) à l’école maternelle et à l’école élémentaire,nombre-creation-ueea,45,Loiret,4.0,2020-09-30,1.0,2017-09-30,3.0,300.0,5.0,75.0,2022-09-30,classes
Déployer Parcoursup ,Taux de réussite aux examens de licence 1,tx-reussite-examens,45,Loiret,44.5,2019-10-31,42.5,2017-10-31,2.0,5.0,47.0,44.0,2022-10-31,% de réussite
Promouvoir l'engagement chez les jeunes,Nombre de volontaires ayant réalisé au moins un jour de mission de service civique dans l'année,nb-jeunes-engages,45,Loiret,1510.0,2020-12-31,1147.0,2017-12-31,363.0,32.0,,,,jeunes
