mesure,indicateur,id_indicateur,code_departement,libelle_departement,valeur_actuelle,date_valeur_actuelle,valeur_initiale,date_valeur_initiale,progression,pourcentage_progression,cible,pourcentage_cible,date_cible,unite
Aide de France Relance aux entreprises,Nombre d’entreprises industrielles (dont PME) bénéficiaires des aides à l'investissement de France Relance,nb-entreprises-industrielles-agricoles,92,Hauts-de-Seine,89.0,2021-12-31,0.0,2020-10-31,89.0,,,,,entreprises industrielles
Numérisation des petites et moyennes entreprises,Nombre d'entreprises ayant bénéficié d'un chèque numérique de 500€,nb-entreprises-cheaque-numerique,92,Hauts-de-Seine,2693.0,2022-02-28,0.0,2020-09-30,2693.0,,3690.0,73.0,2022-12-31,entreprises
Numérisation des petites et moyennes entreprises,Nombre d'entreprises ayant disposé d'un diagnostic numérique et d'un plan d'action individualisé,nb-diagnostics-individualises,92,Hauts-de-Seine,658.0,2022-02-28,0.0,2020-09-30,658.0,,603.0,100.0,2022-12-31,entreprises
Développer l’apprentissage,Nombre de contrats d’apprentissage,nombre-contrats-apprentissage,92,Hauts-de-Seine,35681.0,2021-12-31,11395.0,2017-12-31,24286.0,213.0,23263.0,100.0,2022-12-31,contrats
Plan 1 jeune 1 solution,Nombre de recrutements de jeunes,nombre-recrutements-jeunes,92,Hauts-de-Seine,81861.0,2021-07-31,93738.0,2019-07-31,-11877.0,-13.0,,,,Recrutements depuis le mois d'août précédent
Pacte d'ambition pour l'insertion par l'activité économique,Nombre de bénéficiaires en structures d'insertion par l'activité économique,nb-beneficiaires-siae,92,Hauts-de-Seine,2107.0,2021-10-31,1961.0,2017-01-31,146.0,7.0,3778.0,8.0,2022-12-31,bénéficiaires *
Supprimer la taxe d’habitation sur les résidences principales,Nombre de bénéficiaires totalement exonérés,nb-beneficiaires-suppression-taxe-habitation,92,Hauts-de-Seine,384560.0,2021-12-31,0.0,2017-12-31,384560.0,,724738.0,53.0,2023-12-31,bénéficiaires
Garantir l'égalité professionnelle entre les femmes et les hommes,Part des entreprises respectant leur obligation de publier l’index égalité professionnelle,tx-entreprise-egalite-pro,92,Hauts-de-Seine,78.0,2021-12-31,42.0,2019-03-31,36.0,86.0,90.0,75.0,2022-12-31,%
