mesure,indicateur,id_indicateur,code_departement,libelle_departement,valeur_actuelle,date_valeur_actuelle,valeur_initiale,date_valeur_initiale,progression,pourcentage_progression,cible,pourcentage_cible,date_cible,unite
Aide de France Relance aux entreprises,Nombre d’entreprises industrielles (dont PME) bénéficiaires des aides à l'investissement de France Relance,nb-entreprises-industrielles-agricoles,01,Ain,288.0,2021-11-30,0.0,2020-10-31,288.0,,,,,entreprises industrielles
Numérisation des petites et moyennes entreprises,Nombre d'entreprises ayant bénéficié d'un chèque numérique de 500€,nb-entreprises-cheaque-numerique,01,Ain,753.0,2021-12-31,0.0,2020-09-30,753.0,,878.0,86.0,2022-12-31,entreprises
Numérisation des petites et moyennes entreprises,Nombre d'entreprises ayant disposé d'un diagnostic numérique et d'un plan d'action individualisé,nb-diagnostics-individualises,01,Ain,238.0,2021-12-31,0.0,2020-09-30,238.0,,297.0,80.0,2022-12-31,entreprises
Développer l’apprentissage,Nombre de contrats d’apprentissage,nombre-contrats-apprentissage,01,Ain,4870.0,2021-09-30,2944.0,2017-12-31,1926.0,65.0,4306.0,100.0,2022-12-31,contrats
Plan 1 jeune 1 solution,Nombre de recrutements de jeunes,nombre-recrutements-jeunes,01,Ain,16295.0,2021-07-31,15831.0,2019-07-31,464.0,3.0,,,,Recrutements de jeunes
Pacte d'ambition pour l'insertion par l'activité économique,Nombre de bénéficiaires en structures d'insertion par l'activité économique,nb-beneficiaires-siae,01,Ain,1301.0,2021-09-30,974.0,2017-01-31,327.0,34.0,1873.0,36.0,2022-12-31,bénéficiaires *
Supprimer la taxe d’habitation sur les résidences principales,Nombre de bénéficiaires totalement exonérés,nb-beneficiaires-suppression-taxe-habitation,01,Ain,197066.0,2021-12-31,0.0,2017-12-31,197066.0,,276202.0,71.0,2023-12-31,bénéficiaires
Garantir l'égalité professionnelle entre les femmes et les hommes,Part des entreprises respectant leur obligation de publier l’index égalité professionnelle,tx-entreprise-egalite-pro,01,Ain,78.0,2021-12-31,67.0,2019-03-31,11.0,16.0,90.0,48.0,2022-12-31,%
