mesure,indicateur,id_indicateur,code_departement,libelle_departement,valeur_actuelle,date_valeur_actuelle,valeur_initiale,date_valeur_initiale,progression,pourcentage_progression,cible,pourcentage_cible,date_cible,unite
Aide de France Relance aux entreprises,Nombre d’entreprises industrielles (dont PME) bénéficiaires des aides à l'investissement de France Relance,nb-entreprises-industrielles-agricoles,26,Drôme,131.0,2021-12-31,0.0,2020-10-31,131.0,,,,,entreprises industrielles
Numérisation des petites et moyennes entreprises,Nombre d'entreprises ayant bénéficié d'un chèque numérique de 500€,nb-entreprises-cheaque-numerique,26,Drôme,905.0,2022-02-28,0.0,2020-09-30,905.0,,898.0,100.0,2022-12-31,entreprises
Numérisation des petites et moyennes entreprises,Nombre d'entreprises ayant disposé d'un diagnostic numérique et d'un plan d'action individualisé,nb-diagnostics-individualises,26,Drôme,293.0,2022-02-28,0.0,2020-09-30,293.0,,279.0,100.0,2022-12-31,entreprises
Développer l’apprentissage,Nombre de contrats d’apprentissage,nombre-contrats-apprentissage,26,Drôme,5390.0,2021-12-31,2353.0,2017-12-31,3037.0,129.0,4129.0,100.0,2022-12-31,contrats
Plan 1 jeune 1 solution,Nombre de recrutements de jeunes,nombre-recrutements-jeunes,26,Drôme,15922.0,2021-07-31,14604.0,2019-07-31,1318.0,9.0,,,,Recrutements depuis le mois d'août précédent
Pacte d'ambition pour l'insertion par l'activité économique,Nombre de bénéficiaires en structures d'insertion par l'activité économique,nb-beneficiaires-siae,26,Drôme,1642.0,2021-10-31,1344.0,2017-01-31,298.0,22.0,1900.0,54.0,2022-12-31,bénéficiaires *
Supprimer la taxe d’habitation sur les résidences principales,Nombre de bénéficiaires totalement exonérés,nb-beneficiaires-suppression-taxe-habitation,26,Drôme,187837.0,2021-12-31,0.0,2017-12-31,187837.0,,232200.0,81.0,2023-12-31,bénéficiaires
Garantir l'égalité professionnelle entre les femmes et les hommes,Part des entreprises respectant leur obligation de publier l’index égalité professionnelle,tx-entreprise-egalite-pro,26,Drôme,100.0,2021-12-31,67.0,2019-03-31,33.0,49.0,90.0,100.0,2022-12-31,%
