mesure,indicateur,id_indicateur,code_departement,libelle_departement,valeur_actuelle,date_valeur_actuelle,valeur_initiale,date_valeur_initiale,progression,pourcentage_progression,cible,pourcentage_cible,date_cible,unite
Aide de France Relance aux entreprises,Nombre d’entreprises industrielles (dont PME) bénéficiaires des aides à l'investissement de France Relance,nb-entreprises-industrielles-agricoles,12,Aveyron,42.0,2021-12-31,0.0,2020-10-31,42.0,,,,,entreprises industrielles
Numérisation des petites et moyennes entreprises,Nombre d'entreprises ayant bénéficié d'un chèque numérique de 500€,nb-entreprises-cheaque-numerique,12,Aveyron,612.0,2022-02-28,0.0,2020-09-30,612.0,,428.0,100.0,2022-12-31,entreprises
Numérisation des petites et moyennes entreprises,Nombre d'entreprises ayant disposé d'un diagnostic numérique et d'un plan d'action individualisé,nb-diagnostics-individualises,12,Aveyron,180.0,2022-02-28,0.0,2020-09-30,180.0,,90.0,100.0,2022-12-31,entreprises
Développer l’apprentissage,Nombre de contrats d’apprentissage,nombre-contrats-apprentissage,12,Aveyron,2681.0,2021-12-31,1411.0,2017-12-31,1270.0,90.0,1827.0,100.0,2022-12-31,contrats
Plan 1 jeune 1 solution,Nombre de recrutements de jeunes,nombre-recrutements-jeunes,12,Aveyron,6861.0,2021-07-31,6492.0,2019-07-31,369.0,6.0,,,,Recrutements depuis le mois d'août précédent
Pacte d'ambition pour l'insertion par l'activité économique,Nombre de bénéficiaires en structures d'insertion par l'activité économique,nb-beneficiaires-siae,12,Aveyron,752.0,2021-10-31,512.0,2017-01-31,240.0,47.0,1003.0,49.0,2022-12-31,bénéficiaires *
Supprimer la taxe d’habitation sur les résidences principales,Nombre de bénéficiaires totalement exonérés,nb-beneficiaires-suppression-taxe-habitation,12,Aveyron,108435.0,2021-12-31,0.0,2017-12-31,108435.0,,129645.0,84.0,2023-12-31,bénéficiaires
Garantir l'égalité professionnelle entre les femmes et les hommes,Part des entreprises respectant leur obligation de publier l’index égalité professionnelle,tx-entreprise-egalite-pro,12,Aveyron,66.0,2021-12-31,50.0,2019-09-30,16.0,32.0,90.0,40.0,2022-12-31,%
