mesure,indicateur,id_indicateur,code_departement,libelle_departement,valeur_actuelle,date_valeur_actuelle,valeur_initiale,date_valeur_initiale,progression,pourcentage_progression,cible,pourcentage_cible,date_cible,unite
Aide de France Relance aux entreprises,Nombre d’entreprises industrielles (dont PME) bénéficiaires des aides à l'investissement de France Relance,nb-entreprises-industrielles-agricoles,49,Maine-et-Loire,278.0,2022-12-31,0.0,2020-10-31,278.0,,,,,entreprises industrielles
Numérisation des petites et moyennes entreprises,Nombre d'entreprises ayant bénéficié d'un chèque numérique de 500€,nb-entreprises-cheaque-numerique,49,Maine-et-Loire,1266.0,2022-11-30,0.0,2020-09-30,1266.0,,970.0,100.0,2022-12-31,entreprises
Numérisation des petites et moyennes entreprises,Nombre d'entreprises ayant disposé d'un diagnostic numérique et d'un plan d'action individualisé,nb-diagnostics-individualises,49,Maine-et-Loire,248.0,2022-11-30,0.0,2020-09-30,248.0,,288.0,86.0,2022-12-31,entreprises
Développer l’apprentissage,Nombre de contrats d’apprentissage,nombre-contrats-apprentissage,49,Maine-et-Loire,10782.0,2022-10-31,4160.0,2017-12-31,6622.0,159.0,7062.0,100.0,2022-12-31,contrats
Plan 1 jeune 1 solution,Nombre de recrutements de jeunes,nombre-recrutements-jeunes,49,Maine-et-Loire,32909.0,2022-07-31,24460.0,2019-07-31,8449.0,35.0,,,,Recrutements depuis le mois d'août précédent
Pacte d'ambition pour l'insertion par l'activité économique,Nombre de bénéficiaires en structures d'insertion par l'activité économique,nb-beneficiaires-siae,49,Maine-et-Loire,2505.0,2022-09-30,2458.0,2017-01-31,47.0,2.0,3961.0,3.0,2022-12-31,bénéficiaires *
Supprimer la taxe d’habitation sur les résidences principales,Nombre de bénéficiaires totalement exonérés,nb-beneficiaires-suppression-taxe-habitation,49,Maine-et-Loire,299235.0,2022-12-31,0.0,2017-12-31,299235.0,,368110.0,81.0,2023-12-31,bénéficiaires
Garantir l'égalité professionnelle entre les femmes et les hommes,Part des entreprises respectant leur obligation de publier l’index égalité professionnelle,tx-entreprise-egalite-pro,49,Maine-et-Loire,86.0,2022-12-31,44.0,2019-03-31,42.0,95.0,90.0,91.0,2022-12-31,%
