mesure,indicateur,id_indicateur,code_departement,libelle_departement,valeur_actuelle,date_valeur_actuelle,valeur_initiale,date_valeur_initiale,progression,pourcentage_progression,cible,pourcentage_cible,date_cible,unite
Aide de France Relance aux entreprises,Nombre d'entreprises industrielles et organismes agricoles bénéficiaires des aides à l'investissement de France Relance,nb-entreprises-industrielles-agricoles,90,Territoire de Belfort,0.0,2021-06-30,0.0,,0.0,,,,,entreprises industrielles et agricoles
Numérisation des petites et moyennes entreprises,Nombre d'entreprises ayant bénéficié d'un chèque numérique de 500€,nb-entreprises-cheaque-numerique,90,Territoire de Belfort,91.0,2021-06-30,6.0,2021-02-28,85.0,1417.0,155.0,57.0,2022-12-31,entreprises
Numérisation des petites et moyennes entreprises,Nombre d'entreprises ayant disposé d'un diagnostic numérique et d'un plan d'action individualisé,nb-diagnostics-individualises,90,Territoire de Belfort,39.0,2021-06-30,11.0,2021-01-31,28.0,255.0,87.0,37.0,2022-12-31,entreprises
Développer l’apprentissage,Nombre de contrats d’apprentissage,nombre-contrats-apprentissage,90,Territoire de Belfort,926.0,2020-12-31,751.0,2017-12-31,175.0,23.0,921.0,100.0,2022-12-31,contrats
Plan 1 jeune 1 solution,Nombre de recrutements de jeunes,nombre-recrutements-jeunes,90,Territoire de Belfort,2285.0,2021-02-28,2549.0,2019-02-28,-264.0,-10.0,,,,Recrutements de jeunes
Pacte d'ambition pour l'insertion par l'activité économique,Nombre de bénéficiaires en structures d'insertion par l'activité économique,nb-beneficiaires-siae,90,Territoire de Belfort,472.0,2021-03-31,417.0,2017-01-31,55.0,13.0,687.0,20.0,2022-12-31,bénéficiaires *
Supprimer la taxe d’habitation sur les résidences principales,Nombre de bénéficiaires totalement exonérés,nb-beneficiaires-suppression-taxe-habitation,90,Territoire de Belfort,48753.0,2020-12-31,0.0,2017-01-01,48753.0,,63762.0,76.0,2023-12-31,bénéficiaires
Garantir l'égalité professionnelle entre les femmes et les hommes,Part des entreprises respectant leur obligation de publier l’index égalité professionnelle,tx-entreprise-egalite-pro,90,Territoire de Belfort,33.0,2021-06-30,25.0,2019-03-31,8.0,32.0,90.0,12.0,2022-12-31,%
