mesure,indicateur,id_indicateur,code_departement,libelle_departement,valeur_actuelle,date_valeur_actuelle,valeur_initiale,date_valeur_initiale,progression,pourcentage_progression,cible,pourcentage_cible,date_cible,unite
Aide de France Relance aux entreprises,Nombre d'entreprises industrielles et organismes agricoles bénéficiaires des aides à l'investissement de France Relance,nb-entreprises-industrielles-agricoles,22,Côtes-d'Armor,309.0,2021-10-31,0.0,,309.0,,244.0,100.0,2022-12-31,entreprises industrielles et agricoles
Numérisation des petites et moyennes entreprises,Nombre d'entreprises ayant bénéficié d'un chèque numérique de 500€,nb-entreprises-cheaque-numerique,22,Côtes-d'Armor,806.0,2021-10-31,44.0,2021-02-28,762.0,1732.0,768.0,100.0,2022-12-31,entreprises
Numérisation des petites et moyennes entreprises,Nombre d'entreprises ayant disposé d'un diagnostic numérique et d'un plan d'action individualisé,nb-diagnostics-individualises,22,Côtes-d'Armor,202.0,2021-10-31,45.0,2021-01-31,157.0,349.0,255.0,75.0,2022-12-31,entreprises
Développer l’apprentissage,Nombre de contrats d’apprentissage,nombre-contrats-apprentissage,22,Côtes-d'Armor,4390.0,2020-12-31,2571.0,2017-12-31,1819.0,71.0,4386.0,100.0,2022-12-31,contrats
Plan 1 jeune 1 solution,Nombre de recrutements de jeunes,nombre-recrutements-jeunes,22,Côtes-d'Armor,15147.0,2021-07-31,13445.0,2019-07-31,1702.0,13.0,,,,Recrutements de jeunes
Pacte d'ambition pour l'insertion par l'activité économique,Nombre de bénéficiaires en structures d'insertion par l'activité économique,nb-beneficiaires-siae,22,Côtes-d'Armor,1571.0,2021-06-30,1254.0,2017-01-31,317.0,25.0,2178.0,34.0,2022-12-31,bénéficiaires *
Supprimer la taxe d’habitation sur les résidences principales,Nombre de bénéficiaires totalement exonérés,nb-beneficiaires-suppression-taxe-habitation,22,Côtes-d'Armor,234819.0,2021-12-31,0.0,2017-01-01,234819.0,,284863.0,82.0,2023-12-31,bénéficiaires
Garantir l'égalité professionnelle entre les femmes et les hommes,Part des entreprises respectant leur obligation de publier l’index égalité professionnelle,tx-entreprise-egalite-pro,22,Côtes-d'Armor,100.0,2021-09-30,67.0,2019-03-31,33.0,49.0,90.0,100.0,2022-12-31,%
