mesure,indicateur,id_indicateur,code_departement,libelle_departement,valeur_actuelle,date_valeur_actuelle,valeur_initiale,date_valeur_initiale,progression,pourcentage_progression,cible,pourcentage_cible,date_cible,unite
Aide de France Relance aux entreprises,Nombre d'entreprises industrielles et organismes agricoles bénéficiaires des aides à l'investissement de France Relance,nb-entreprises-industrielles-agricoles,47,Lot-et-Garonne,270.0,2021-10-31,0.0,,270.0,,161.0,100.0,2022-12-31,entreprises industrielles et agricoles
Numérisation des petites et moyennes entreprises,Nombre d'entreprises ayant bénéficié d'un chèque numérique de 500€,nb-entreprises-cheaque-numerique,47,Lot-et-Garonne,522.0,2021-10-31,29.0,2021-02-28,493.0,1700.0,504.0,100.0,2022-12-31,entreprises
Numérisation des petites et moyennes entreprises,Nombre d'entreprises ayant disposé d'un diagnostic numérique et d'un plan d'action individualisé,nb-diagnostics-individualises,47,Lot-et-Garonne,212.0,2021-10-31,35.0,2021-01-31,177.0,506.0,150.0,100.0,2022-12-31,entreprises
Développer l’apprentissage,Nombre de contrats d’apprentissage,nombre-contrats-apprentissage,47,Lot-et-Garonne,2413.0,2020-12-31,1316.0,2017-12-31,1097.0,83.0,2413.0,100.0,2022-12-31,contrats
Plan 1 jeune 1 solution,Nombre de recrutements de jeunes,nombre-recrutements-jeunes,47,Lot-et-Garonne,8375.0,2021-07-31,7121.0,2019-07-31,1254.0,18.0,,,,Recrutements de jeunes
Pacte d'ambition pour l'insertion par l'activité économique,Nombre de bénéficiaires en structures d'insertion par l'activité économique,nb-beneficiaires-siae,47,Lot-et-Garonne,697.0,2021-06-30,659.0,2017-01-31,38.0,6.0,1112.0,8.0,2022-12-31,bénéficiaires *
Supprimer la taxe d’habitation sur les résidences principales,Nombre de bénéficiaires totalement exonérés,nb-beneficiaires-suppression-taxe-habitation,47,Lot-et-Garonne,129508.0,2021-12-31,0.0,2017-01-01,129508.0,,153214.0,85.0,2023-12-31,bénéficiaires
Garantir l'égalité professionnelle entre les femmes et les hommes,Part des entreprises respectant leur obligation de publier l’index égalité professionnelle,tx-entreprise-egalite-pro,47,Lot-et-Garonne,100.0,2021-09-30,0.0,2019-03-31,100.0,,90.0,100.0,2022-12-31,%
