mesure,indicateur,id_indicateur,code_departement,libelle_departement,valeur_actuelle,date_valeur_actuelle,valeur_initiale,date_valeur_initiale,progression,pourcentage_progression,cible,pourcentage_cible,date_cible,unite
Aide de France Relance aux entreprises,Nombre d'entreprises industrielles et organismes agricoles bénéficiaires des aides à l'investissement de France Relance,nb-entreprises-industrielles-agricoles,54,Meurthe-et-Moselle,2.0,2021-06-30,0.0,,2.0,,,,,entreprises industrielles et agricoles
Numérisation des petites et moyennes entreprises,Nombre d'entreprises ayant bénéficié d'un chèque numérique de 500€,nb-entreprises-cheaque-numerique,54,Meurthe-et-Moselle,461.0,2021-06-30,40.0,2021-02-28,421.0,1052.0,826.0,54.0,2022-12-31,entreprises
Numérisation des petites et moyennes entreprises,Nombre d'entreprises ayant disposé d'un diagnostic numérique et d'un plan d'action individualisé,nb-diagnostics-individualises,54,Meurthe-et-Moselle,123.0,2021-06-30,27.0,2021-01-31,96.0,356.0,243.0,44.0,2022-12-31,entreprises
Développer l’apprentissage,Nombre de contrats d’apprentissage,nombre-contrats-apprentissage,54,Meurthe-et-Moselle,5109.0,2020-12-31,3292.0,2017-12-31,1817.0,55.0,5083.0,100.0,2022-12-31,contrats
Plan 1 jeune 1 solution,Nombre de recrutements de jeunes,nombre-recrutements-jeunes,54,Meurthe-et-Moselle,13180.0,2021-02-28,12539.0,2019-02-28,641.0,5.0,,,,Recrutements de jeunes
Pacte d'ambition pour l'insertion par l'activité économique,Nombre de bénéficiaires en structures d'insertion par l'activité économique,nb-beneficiaires-siae,54,Meurthe-et-Moselle,1923.0,2021-03-31,1742.0,2017-01-31,181.0,10.0,3067.0,14.0,2022-12-31,bénéficiaires *
Supprimer la taxe d’habitation sur les résidences principales,Nombre de bénéficiaires totalement exonérés,nb-beneficiaires-suppression-taxe-habitation,54,Meurthe-et-Moselle,259170.0,2020-12-31,0.0,2017-01-01,259170.0,,334979.0,77.0,2023-12-31,bénéficiaires
Garantir l'égalité professionnelle entre les femmes et les hommes,Part des entreprises respectant leur obligation de publier l’index égalité professionnelle,tx-entreprise-egalite-pro,54,Meurthe-et-Moselle,96.0,2021-06-30,38.0,2019-03-31,58.0,153.0,90.0,100.0,2022-12-31,%
