mesure,indicateur,id_indicateur,code_departement,libelle_departement,valeur_actuelle,date_valeur_actuelle,valeur_initiale,date_valeur_initiale,progression,pourcentage_progression,cible,pourcentage_cible,date_cible,unite
Aide de France Relance aux entreprises,Nombre d'entreprises industrielles et organismes agricoles bénéficiaires des aides à l'investissement de France Relance,nb-entreprises-industrielles-agricoles,68,Haut-Rhin,12.0,2021-03-31,0.0,,12.0,,,,,entreprises industrielles et agricoles
Numérisation des petites et moyennes entreprises,Nombre d'entreprises ayant bénéficié d'un chèque numérique de 500€,nb-entreprises-cheaque-numerique,68,Haut-Rhin,323.0,2021-04-30,56.0,2021-02-28,267.0,477.0,993.0,28.0,2022-12-31,entreprises
Numérisation des petites et moyennes entreprises,Nombre d'entreprises ayant disposé d'un diagnostic numérique et un plan d'action individualisé,nb-diagnostics-individualises,68,Haut-Rhin,165.0,2021-04-30,20.0,2021-01-31,145.0,725.0,492.0,31.0,2022-12-31,entreprises
Développer l’apprentissage,Nombre de contrats d’apprentissage,nombre-contrats-apprentissage,68,Haut-Rhin,5364.0,2020-12-31,3389.0,2017-12-31,1975.0,58.0,,,,contrats
Plan 1 jeune 1 solution,Nombre de recrutements de jeunes,nombre-recrutements-jeunes,68,Haut-Rhin,10936.0,2020-12-31,11167.0,2018-12-31,-231.0,-2.0,,,,Recrutements de jeunes
Pacte d'ambition pour l'insertion par l'activité économique,Nombre de bénéficiaires en structures d'insertion par l'activité économique,nb-beneficiaires-siae,68,Haut-Rhin,2042.0,2020-12-31,2339.0,2017-01-31,-297.0,-13.0,,,,bénéficiaires
Supprimer la taxe d’habitation sur les résidences principales,Nombre de bénéficiaires totalement exonérés,nb-beneficiaires-suppression-taxe-habitation,68,Haut-Rhin,240145.0,2020-12-31,0.0,2017-01-01,240145.0,,333028.0,72.0,2023-12-31,bénéficiaires
