mesure,indicateur,id_indicateur,code_departement,libelle_departement,valeur_actuelle,date_valeur_actuelle,valeur_initiale,date_valeur_initiale,progression,pourcentage_progression,cible,pourcentage_cible,date_cible,unite
Aide de France Relance aux entreprises,Nombre d'entreprises industrielles et organismes agricoles bénéficiaires des aides à l'investissement de France Relance,nb-entreprises-industrielles-agricoles,30,Gard,10.0,2021-03-31,0.0,,10.0,,,,,entreprises industrielles et agricoles
Numérisation des petites et moyennes entreprises,Nombre d'entreprises ayant bénéficié d'un chèque numérique de 500€,nb-entreprises-cheaque-numerique,30,Gard,439.0,2021-04-30,88.0,2021-02-28,351.0,399.0,1326.0,28.0,2022-12-31,entreprises
Numérisation des petites et moyennes entreprises,Nombre d'entreprises ayant disposé d'un diagnostic numérique et un plan d'action individualisé,nb-diagnostics-individualises,30,Gard,181.0,2021-04-30,46.0,2021-01-31,135.0,293.0,420.0,36.0,2022-12-31,entreprises
Développer l’apprentissage,Nombre de contrats d’apprentissage,nombre-contrats-apprentissage,30,Gard,4884.0,2020-12-31,3011.0,2017-12-31,1873.0,62.0,,,,contrats
Plan 1 jeune 1 solution,Nombre de recrutements de jeunes,nombre-recrutements-jeunes,30,Gard,9219.0,2020-12-31,7721.0,2018-12-31,1498.0,19.0,,,,Recrutements de jeunes
Pacte d'ambition pour l'insertion par l'activité économique,Nombre de bénéficiaires en structures d'insertion par l'activité économique,nb-beneficiaires-siae,30,Gard,1041.0,2020-12-31,1492.0,2017-01-31,-451.0,-30.0,,,,bénéficiaires
Supprimer la taxe d’habitation sur les résidences principales,Nombre de bénéficiaires totalement exonérés,nb-beneficiaires-suppression-taxe-habitation,30,Gard,278967.0,2020-12-31,0.0,2017-01-01,278967.0,,341624.0,82.0,2023-12-31,bénéficiaires
