mesure,indicateur,id_indicateur,code_departement,libelle_departement,valeur_actuelle,date_valeur_actuelle,valeur_initiale,date_valeur_initiale,progression,pourcentage_progression,cible,pourcentage_cible,date_cible,unite
Aide de France Relance aux entreprises,Nombre d'entreprises industrielles et organismes agricoles bénéficiaires des aides à l'investissement de France Relance,nb-entreprises-industrielles-agricoles,07,Ardèche,132.0,2021-10-31,0.0,,132.0,,99.0,100.0,2022-12-31,entreprises industrielles et agricoles
Numérisation des petites et moyennes entreprises,Nombre d'entreprises ayant bénéficié d'un chèque numérique de 500€,nb-entreprises-cheaque-numerique,07,Ardèche,536.0,2021-10-31,38.0,2021-02-28,498.0,1311.0,510.0,100.0,2022-12-31,entreprises
Numérisation des petites et moyennes entreprises,Nombre d'entreprises ayant disposé d'un diagnostic numérique et d'un plan d'action individualisé,nb-diagnostics-individualises,07,Ardèche,118.0,2021-10-31,10.0,2021-01-31,108.0,1080.0,81.0,100.0,2022-12-31,entreprises
Développer l’apprentissage,Nombre de contrats d’apprentissage,nombre-contrats-apprentissage,07,Ardèche,1832.0,2020-12-31,1144.0,2017-12-31,688.0,60.0,1823.0,100.0,2022-12-31,contrats
Plan 1 jeune 1 solution,Nombre de recrutements de jeunes,nombre-recrutements-jeunes,07,Ardèche,6780.0,2021-07-31,6265.0,2019-07-31,515.0,8.0,,,,Recrutements de jeunes
Pacte d'ambition pour l'insertion par l'activité économique,Nombre de bénéficiaires en structures d'insertion par l'activité économique,nb-beneficiaires-siae,07,Ardèche,625.0,2021-06-30,493.0,2017-01-31,132.0,27.0,874.0,35.0,2022-12-31,bénéficiaires *
Supprimer la taxe d’habitation sur les résidences principales,Nombre de bénéficiaires totalement exonérés,nb-beneficiaires-suppression-taxe-habitation,07,Ardèche,123595.0,2021-12-31,0.0,2017-01-01,123595.0,,147475.0,84.0,2023-12-31,bénéficiaires
Garantir l'égalité professionnelle entre les femmes et les hommes,Part des entreprises respectant leur obligation de publier l’index égalité professionnelle,tx-entreprise-egalite-pro,07,Ardèche,58.0,2021-09-30,76.0,2019-09-30,-18.0,-24.0,90.0,0.0,2022-12-31,%
