mesure,indicateur,id_indicateur,code_departement,libelle_departement,valeur_actuelle,date_valeur_actuelle,valeur_initiale,date_valeur_initiale,progression,pourcentage_progression,cible,pourcentage_cible,date_cible,unite
Aide de France Relance aux entreprises,Nombre d’entreprises industrielles (dont PME) bénéficiaires des aides à l'investissement de France Relance,nb-entreprises-industrielles-agricoles,75,Paris,118.0,2021-11-30,0.0,2020-10-31,118.0,,,,,entreprises industrielles
Numérisation des petites et moyennes entreprises,Nombre d'entreprises ayant bénéficié d'un chèque numérique de 500€,nb-entreprises-cheaque-numerique,75,Paris,8140.0,2021-12-31,0.0,2020-09-30,8140.0,,11678.0,70.0,2022-12-31,entreprises
Numérisation des petites et moyennes entreprises,Nombre d'entreprises ayant disposé d'un diagnostic numérique et d'un plan d'action individualisé,nb-diagnostics-individualises,75,Paris,1083.0,2021-12-31,0.0,2020-09-30,1083.0,,1719.0,63.0,2022-12-31,entreprises
Développer l’apprentissage,Nombre de contrats d’apprentissage,nombre-contrats-apprentissage,75,Paris,39640.0,2021-09-30,16693.0,2017-12-31,22947.0,137.0,35644.0,100.0,2022-12-31,contrats
Plan 1 jeune 1 solution,Nombre de recrutements de jeunes,nombre-recrutements-jeunes,75,Paris,166025.0,2021-07-31,203704.0,2019-07-31,-37679.0,-18.0,,,,Recrutements de jeunes
Pacte d'ambition pour l'insertion par l'activité économique,Nombre de bénéficiaires en structures d'insertion par l'activité économique,nb-beneficiaires-siae,75,Paris,3325.0,2021-09-30,3206.0,2017-01-31,119.0,4.0,6540.0,4.0,2022-12-31,bénéficiaires *
Supprimer la taxe d’habitation sur les résidences principales,Nombre de bénéficiaires totalement exonérés,nb-beneficiaires-suppression-taxe-habitation,75,Paris,592839.0,2021-12-31,0.0,2017-12-31,592839.0,,1126478.0,53.0,2023-12-31,bénéficiaires
Garantir l'égalité professionnelle entre les femmes et les hommes,Part des entreprises respectant leur obligation de publier l’index égalité professionnelle,tx-entreprise-egalite-pro,75,Paris,100.0,2021-12-31,41.0,2019-03-31,59.0,144.0,90.0,100.0,2022-12-31,%
