mesure,indicateur,id_indicateur,code_departement,libelle_departement,valeur_actuelle,date_valeur_actuelle,valeur_initiale,date_valeur_initiale,progression,pourcentage_progression,cible,pourcentage_cible,date_cible,unite
Aide de France Relance aux entreprises,Nombre d'entreprises industrielles et organismes agricoles bénéficiaires des aides à l'investissement de France Relance,nb-entreprises-industrielles-agricoles,24,Dordogne,61.0,2021-06-30,0.0,,61.0,,,,,entreprises industrielles et agricoles
Numérisation des petites et moyennes entreprises,Nombre d'entreprises ayant bénéficié d'un chèque numérique de 500€,nb-entreprises-cheaque-numerique,24,Dordogne,505.0,2021-06-30,47.0,2021-02-28,458.0,974.0,697.0,70.0,2022-12-31,entreprises
Numérisation des petites et moyennes entreprises,Nombre d'entreprises ayant disposé d'un diagnostic numérique et d'un plan d'action individualisé,nb-diagnostics-individualises,24,Dordogne,90.0,2021-06-30,22.0,2021-01-31,68.0,309.0,210.0,36.0,2022-12-31,entreprises
Développer l’apprentissage,Nombre de contrats d’apprentissage,nombre-contrats-apprentissage,24,Dordogne,2750.0,2020-12-31,1727.0,2017-12-31,1023.0,59.0,2738.0,100.0,2022-12-31,contrats
Plan 1 jeune 1 solution,Nombre de recrutements de jeunes,nombre-recrutements-jeunes,24,Dordogne,5484.0,2021-02-28,5037.0,2019-02-28,447.0,9.0,,,,Recrutements de jeunes
Pacte d'ambition pour l'insertion par l'activité économique,Nombre de bénéficiaires en structures d'insertion par l'activité économique,nb-beneficiaires-siae,24,Dordogne,891.0,2021-03-31,720.0,2017-01-31,171.0,24.0,1297.0,30.0,2022-12-31,bénéficiaires *
Supprimer la taxe d’habitation sur les résidences principales,Nombre de bénéficiaires totalement exonérés,nb-beneficiaires-suppression-taxe-habitation,24,Dordogne,165775.0,2020-12-31,0.0,2017-01-01,165775.0,,196561.0,84.0,2023-12-31,bénéficiaires
Garantir l'égalité professionnelle entre les femmes et les hommes,Part des entreprises respectant leur obligation de publier l’index égalité professionnelle,tx-entreprise-egalite-pro,24,Dordogne,34.0,2021-06-30,0.0,2019-03-31,34.0,,90.0,38.0,2022-12-31,%
