mesure,indicateur,id_indicateur,code_departement,libelle_departement,valeur_actuelle,date_valeur_actuelle,valeur_initiale,date_valeur_initiale,progression,pourcentage_progression,cible,pourcentage_cible,date_cible,unite
Aide de France Relance aux entreprises,Nombre d'entreprises industrielles et organismes agricoles bénéficiaires des aides à l'investissement de France Relance,nb-entreprises-industrielles-agricoles,973,Guyane,6.0,2021-03-31,0.0,,6.0,,,,,entreprises industrielles et agricoles
Numérisation des petites et moyennes entreprises,Nombre d'entreprises ayant bénéficié d'un chèque numérique de 500€,nb-entreprises-cheaque-numerique,973,Guyane,0.0,2021-04-30,0.0,2021-02-28,0.0,,13.0,0.0,2022-12-31,entreprises
Numérisation des petites et moyennes entreprises,Nombre d'entreprises ayant disposé d'un diagnostic numérique et un plan d'action individualisé,nb-diagnostics-individualises,973,Guyane,43.0,2021-04-30,0.0,2021-01-31,43.0,,126.0,34.0,2022-12-31,entreprises
Développer l’apprentissage,Nombre de contrats d’apprentissage,nombre-contrats-apprentissage,973,Guyane,583.0,2020-12-31,346.0,2017-12-31,237.0,68.0,,,,contrats
Plan 1 jeune 1 solution,Nombre de recrutements de jeunes,nombre-recrutements-jeunes,973,Guyane,2194.0,2020-12-31,2427.0,2018-12-31,-233.0,-10.0,,,,Recrutements de jeunes
Pacte d'ambition pour l'insertion par l'activité économique,Nombre de bénéficiaires en structures d'insertion par l'activité économique,nb-beneficiaires-siae,973,Guyane,449.0,2020-12-31,225.0,2017-01-31,224.0,100.0,,,,bénéficiaires
Supprimer la taxe d’habitation sur les résidences principales,Nombre de bénéficiaires totalement exonérés,nb-beneficiaires-suppression-taxe-habitation,973,Guyane,39780.0,2020-12-31,0.0,2017-01-01,39780.0,,55789.0,71.0,2023-12-31,bénéficiaires
