mesure,indicateur,id_indicateur,code_departement,libelle_departement,valeur_actuelle,date_valeur_actuelle,valeur_initiale,date_valeur_initiale,progression,pourcentage_progression,cible,pourcentage_cible,date_cible,unite
Aide de France Relance aux entreprises,Nombre d'entreprises industrielles et organismes agricoles bénéficiaires des aides à l'investissement de France Relance,nb-entreprises-industrielles-agricoles,05,Hautes-Alpes,5.0,2021-03-31,0.0,,5.0,,,,,entreprises industrielles et agricoles
Numérisation des petites et moyennes entreprises,Nombre d'entreprises ayant bénéficié d'un chèque numérique de 500€,nb-entreprises-cheaque-numerique,05,Hautes-Alpes,89.0,2021-04-30,17.0,2021-02-28,72.0,424.0,296.0,26.0,2022-12-31,entreprises
Numérisation des petites et moyennes entreprises,Nombre d'entreprises ayant disposé d'un diagnostic numérique et un plan d'action individualisé,nb-diagnostics-individualises,05,Hautes-Alpes,45.0,2021-04-30,29.0,2021-01-31,16.0,55.0,81.0,31.0,2022-12-31,entreprises
Développer l’apprentissage,Nombre de contrats d’apprentissage,nombre-contrats-apprentissage,05,Hautes-Alpes,806.0,2020-12-31,559.0,2017-12-31,247.0,44.0,,,,contrats
Plan 1 jeune 1 solution,Nombre de recrutements de jeunes,nombre-recrutements-jeunes,05,Hautes-Alpes,2013.0,2020-12-31,3106.0,2018-12-31,-1093.0,-35.0,,,,Recrutements de jeunes
Pacte d'ambition pour l'insertion par l'activité économique,Nombre de bénéficiaires en structures d'insertion par l'activité économique,nb-beneficiaires-siae,05,Hautes-Alpes,379.0,2020-12-31,407.0,2017-01-31,-28.0,-7.0,,,,bénéficiaires
Supprimer la taxe d’habitation sur les résidences principales,Nombre de bénéficiaires totalement exonérés,nb-beneficiaires-suppression-taxe-habitation,05,Hautes-Alpes,54788.0,2020-12-31,0.0,2017-01-01,54788.0,,67148.0,82.0,2023-12-31,bénéficiaires
