mesure,indicateur,id_indicateur,code_departement,libelle_departement,valeur_actuelle,date_valeur_actuelle,valeur_initiale,date_valeur_initiale,progression,pourcentage_progression,cible,pourcentage_cible,date_cible,unite
Aide de France Relance aux entreprises,Nombre d’entreprises industrielles (dont PME) bénéficiaires des aides à l'investissement de France Relance,nb-entreprises-industrielles-agricoles,59,Nord,287.0,2022-12-31,0.0,2020-10-31,287.0,,,,,entreprises industrielles
Numérisation des petites et moyennes entreprises,Nombre d'entreprises ayant bénéficié d'un chèque numérique de 500€,nb-entreprises-cheaque-numerique,59,Nord,2802.0,2022-11-30,0.0,2020-09-30,2802.0,,3126.0,90.0,2022-12-31,entreprises
Numérisation des petites et moyennes entreprises,Nombre d'entreprises ayant disposé d'un diagnostic numérique et d'un plan d'action individualisé,nb-diagnostics-individualises,59,Nord,1106.0,2022-11-30,0.0,2020-09-30,1106.0,,954.0,100.0,2022-12-31,entreprises
Développer l’apprentissage,Nombre de contrats d’apprentissage,nombre-contrats-apprentissage,59,Nord,31861.0,2022-10-31,10773.0,2017-12-31,21088.0,196.0,18159.0,100.0,2022-12-31,contrats
Plan 1 jeune 1 solution,Nombre de recrutements de jeunes,nombre-recrutements-jeunes,59,Nord,105916.0,2022-07-31,78212.0,2019-07-31,27704.0,35.0,,,,Recrutements depuis le mois d'août précédent
Pacte d'ambition pour l'insertion par l'activité économique,Nombre de bénéficiaires en structures d'insertion par l'activité économique,nb-beneficiaires-siae,59,Nord,8856.0,2022-09-30,7074.0,2017-01-31,1782.0,25.0,14120.0,25.0,2022-12-31,bénéficiaires *
Supprimer la taxe d’habitation sur les résidences principales,Nombre de bénéficiaires totalement exonérés,nb-beneficiaires-suppression-taxe-habitation,59,Nord,896780.0,2022-12-31,0.0,2017-12-31,896780.0,,1128953.0,79.0,2023-12-31,bénéficiaires
Garantir l'égalité professionnelle entre les femmes et les hommes,Part des entreprises respectant leur obligation de publier l’index égalité professionnelle,tx-entreprise-egalite-pro,59,Nord,80.0,2022-12-31,41.0,2019-03-31,39.0,95.0,90.0,80.0,2022-12-31,%
