mesure,indicateur,id_indicateur,code_departement,libelle_departement,valeur_actuelle,date_valeur_actuelle,valeur_initiale,date_valeur_initiale,progression,pourcentage_progression,cible,pourcentage_cible,date_cible,unite
Aide de France Relance aux entreprises,Nombre d’entreprises industrielles (dont PME) bénéficiaires des aides à l'investissement de France Relance,nb-entreprises-industrielles-agricoles,52,Haute-Marne,47.0,2021-12-31,0.0,2020-10-31,47.0,,,,,entreprises industrielles
Numérisation des petites et moyennes entreprises,Nombre d'entreprises ayant bénéficié d'un chèque numérique de 500€,nb-entreprises-cheaque-numerique,52,Haute-Marne,126.0,2022-02-28,0.0,2020-09-30,126.0,,191.0,66.0,2022-12-31,entreprises
Numérisation des petites et moyennes entreprises,Nombre d'entreprises ayant disposé d'un diagnostic numérique et d'un plan d'action individualisé,nb-diagnostics-individualises,52,Haute-Marne,80.0,2022-02-28,0.0,2020-09-30,80.0,,60.0,100.0,2022-12-31,entreprises
Développer l’apprentissage,Nombre de contrats d’apprentissage,nombre-contrats-apprentissage,52,Haute-Marne,1209.0,2021-12-31,672.0,2017-12-31,537.0,80.0,930.0,100.0,2022-12-31,contrats
Plan 1 jeune 1 solution,Nombre de recrutements de jeunes,nombre-recrutements-jeunes,52,Haute-Marne,3647.0,2021-07-31,3361.0,2019-07-31,286.0,9.0,,,,Recrutements depuis le mois d'août précédent
Pacte d'ambition pour l'insertion par l'activité économique,Nombre de bénéficiaires en structures d'insertion par l'activité économique,nb-beneficiaires-siae,52,Haute-Marne,636.0,2021-10-31,521.0,2017-01-31,115.0,22.0,950.0,27.0,2022-12-31,bénéficiaires *
Supprimer la taxe d’habitation sur les résidences principales,Nombre de bénéficiaires totalement exonérés,nb-beneficiaires-suppression-taxe-habitation,52,Haute-Marne,69327.0,2021-12-31,0.0,2017-12-31,69327.0,,80533.0,86.0,2023-12-31,bénéficiaires
Garantir l'égalité professionnelle entre les femmes et les hommes,Part des entreprises respectant leur obligation de publier l’index égalité professionnelle,tx-entreprise-egalite-pro,52,Haute-Marne,100.0,2021-12-31,0.0,2019-03-31,100.0,,90.0,100.0,2022-12-31,%
