mesure,indicateur,id_indicateur,code_departement,libelle_departement,valeur_actuelle,date_valeur_actuelle,valeur_initiale,date_valeur_initiale,progression,pourcentage_progression,cible,pourcentage_cible,date_cible,unite
Aide de France Relance aux entreprises,Nombre d'entreprises industrielles et organismes agricoles bénéficiaires des aides à l'investissement de France Relance,nb-entreprises-industrielles-agricoles,40,Landes,92.0,2021-06-30,0.0,,92.0,,,,,entreprises industrielles et agricoles
Numérisation des petites et moyennes entreprises,Nombre d'entreprises ayant bénéficié d'un chèque numérique de 500€,nb-entreprises-cheaque-numerique,40,Landes,517.0,2021-06-30,47.0,2021-02-28,470.0,1000.0,645.0,79.0,2022-12-31,entreprises
Numérisation des petites et moyennes entreprises,Nombre d'entreprises ayant disposé d'un diagnostic numérique et d'un plan d'action individualisé,nb-diagnostics-individualises,40,Landes,120.0,2021-06-30,10.0,2021-01-31,110.0,1100.0,189.0,61.0,2022-12-31,entreprises
Développer l’apprentissage,Nombre de contrats d’apprentissage,nombre-contrats-apprentissage,40,Landes,2340.0,2020-12-31,1506.0,2017-12-31,834.0,55.0,2349.0,99.0,2022-12-31,contrats
Plan 1 jeune 1 solution,Nombre de recrutements de jeunes,nombre-recrutements-jeunes,40,Landes,5905.0,2021-02-28,5325.0,2019-02-28,580.0,11.0,,,,Recrutements de jeunes
Pacte d'ambition pour l'insertion par l'activité économique,Nombre de bénéficiaires en structures d'insertion par l'activité économique,nb-beneficiaires-siae,40,Landes,788.0,2021-03-31,615.0,2017-01-31,173.0,28.0,1229.0,28.0,2022-12-31,bénéficiaires *
Supprimer la taxe d’habitation sur les résidences principales,Nombre de bénéficiaires totalement exonérés,nb-beneficiaires-suppression-taxe-habitation,40,Landes,159679.0,2020-12-31,0.0,2017-01-01,159679.0,,193940.0,82.0,2023-12-31,bénéficiaires
Garantir l'égalité professionnelle entre les femmes et les hommes,Part des entreprises respectant leur obligation de publier l’index égalité professionnelle,tx-entreprise-egalite-pro,40,Landes,77.0,2021-06-30,100.0,2019-03-31,-23.0,-23.0,90.0,0.0,2022-12-31,%
