mesure,indicateur,id_indicateur,code_departement,libelle_departement,valeur_actuelle,date_valeur_actuelle,valeur_initiale,date_valeur_initiale,progression,pourcentage_progression,cible,pourcentage_cible,date_cible,unite
Aide de France Relance aux entreprises,Nombre d'entreprises industrielles et organismes agricoles bénéficiaires des aides à l'investissement de France Relance,nb-entreprises-industrielles-agricoles,49,Maine-et-Loire,68.0,2021-06-30,0.0,,68.0,,,,,entreprises industrielles et agricoles
Numérisation des petites et moyennes entreprises,Nombre d'entreprises ayant bénéficié d'un chèque numérique de 500€,nb-entreprises-cheaque-numerique,49,Maine-et-Loire,816.0,2021-06-30,55.0,2021-02-28,761.0,1384.0,970.0,83.0,2022-12-31,entreprises
Numérisation des petites et moyennes entreprises,Nombre d'entreprises ayant disposé d'un diagnostic numérique et d'un plan d'action individualisé,nb-diagnostics-individualises,49,Maine-et-Loire,142.0,2021-06-30,74.0,2021-01-31,68.0,92.0,288.0,32.0,2022-12-31,entreprises
Développer l’apprentissage,Nombre de contrats d’apprentissage,nombre-contrats-apprentissage,49,Maine-et-Loire,7028.0,2020-12-31,4160.0,2017-12-31,2868.0,69.0,7062.0,99.0,2022-12-31,contrats
Plan 1 jeune 1 solution,Nombre de recrutements de jeunes,nombre-recrutements-jeunes,49,Maine-et-Loire,18023.0,2021-02-28,16589.0,2019-02-28,1434.0,9.0,,,,Recrutements de jeunes
Pacte d'ambition pour l'insertion par l'activité économique,Nombre de bénéficiaires en structures d'insertion par l'activité économique,nb-beneficiaires-siae,49,Maine-et-Loire,2737.0,2021-03-31,2458.0,2017-01-31,279.0,11.0,3961.0,19.0,2022-12-31,bénéficiaires *
Supprimer la taxe d’habitation sur les résidences principales,Nombre de bénéficiaires totalement exonérés,nb-beneficiaires-suppression-taxe-habitation,49,Maine-et-Loire,297706.0,2020-12-31,0.0,2017-01-01,297706.0,,365100.0,82.0,2023-12-31,bénéficiaires
Garantir l'égalité professionnelle entre les femmes et les hommes,Part des entreprises respectant leur obligation de publier l’index égalité professionnelle,tx-entreprise-egalite-pro,49,Maine-et-Loire,80.0,2021-06-30,44.0,2019-03-31,36.0,82.0,90.0,78.0,2022-12-31,%
