mesure,indicateur,id_indicateur,code_departement,libelle_departement,valeur_actuelle,date_valeur_actuelle,valeur_initiale,date_valeur_initiale,progression,pourcentage_progression,cible,pourcentage_cible,date_cible,unite
Aide de France Relance aux entreprises,Nombre d'entreprises industrielles et organismes agricoles bénéficiaires des aides à l'investissement de France Relance,nb-entreprises-industrielles-agricoles,45,Loiret,313.0,2021-10-31,0.0,,313.0,,200.0,100.0,2022-12-31,entreprises industrielles et agricoles
Numérisation des petites et moyennes entreprises,Nombre d'entreprises ayant bénéficié d'un chèque numérique de 500€,nb-entreprises-cheaque-numerique,45,Loiret,885.0,2021-10-31,48.0,2021-02-28,837.0,1744.0,831.0,100.0,2022-12-31,entreprises
Numérisation des petites et moyennes entreprises,Nombre d'entreprises ayant disposé d'un diagnostic numérique et d'un plan d'action individualisé,nb-diagnostics-individualises,45,Loiret,106.0,2021-10-31,22.0,2021-01-31,84.0,382.0,195.0,49.0,2022-12-31,entreprises
Développer l’apprentissage,Nombre de contrats d’apprentissage,nombre-contrats-apprentissage,45,Loiret,5055.0,2020-12-31,3753.0,2017-12-31,1302.0,35.0,4832.0,100.0,2022-12-31,contrats
Plan 1 jeune 1 solution,Nombre de recrutements de jeunes,nombre-recrutements-jeunes,45,Loiret,20442.0,2021-07-31,19579.0,2019-07-31,863.0,4.0,,,,Recrutements de jeunes
Pacte d'ambition pour l'insertion par l'activité économique,Nombre de bénéficiaires en structures d'insertion par l'activité économique,nb-beneficiaires-siae,45,Loiret,919.0,2021-06-30,732.0,2017-01-31,187.0,26.0,1621.0,21.0,2022-12-31,bénéficiaires *
Supprimer la taxe d’habitation sur les résidences principales,Nombre de bénéficiaires totalement exonérés,nb-beneficiaires-suppression-taxe-habitation,45,Loiret,234364.0,2021-12-31,0.0,2017-01-01,234364.0,,300124.0,78.0,2023-12-31,bénéficiaires
Garantir l'égalité professionnelle entre les femmes et les hommes,Part des entreprises respectant leur obligation de publier l’index égalité professionnelle,tx-entreprise-egalite-pro,45,Loiret,100.0,2021-09-30,40.0,2019-03-31,60.0,150.0,90.0,100.0,2022-12-31,%
