mesure,indicateur,id_indicateur,code_departement,libelle_departement,valeur_actuelle,date_valeur_actuelle,valeur_initiale,date_valeur_initiale,progression,pourcentage_progression,cible,pourcentage_cible,date_cible,unite
Aide de France Relance aux entreprises,Nombre d’entreprises industrielles (dont PME) bénéficiaires des aides à l'investissement de France Relance,nb-entreprises-industrielles-agricoles,81,Tarn,69.0,2021-12-31,0.0,2020-10-31,69.0,,,,,entreprises industrielles
Numérisation des petites et moyennes entreprises,Nombre d'entreprises ayant bénéficié d'un chèque numérique de 500€,nb-entreprises-cheaque-numerique,81,Tarn,876.0,2022-02-28,0.0,2020-09-30,876.0,,567.0,100.0,2022-12-31,entreprises
Numérisation des petites et moyennes entreprises,Nombre d'entreprises ayant disposé d'un diagnostic numérique et d'un plan d'action individualisé,nb-diagnostics-individualises,81,Tarn,169.0,2022-02-28,0.0,2020-09-30,169.0,,117.0,100.0,2022-12-31,entreprises
Développer l’apprentissage,Nombre de contrats d’apprentissage,nombre-contrats-apprentissage,81,Tarn,3462.0,2021-12-31,1601.0,2017-12-31,1861.0,116.0,2458.0,100.0,2022-12-31,contrats
Plan 1 jeune 1 solution,Nombre de recrutements de jeunes,nombre-recrutements-jeunes,81,Tarn,9661.0,2021-07-31,7924.0,2019-07-31,1737.0,22.0,,,,Recrutements depuis le mois d'août précédent
Pacte d'ambition pour l'insertion par l'activité économique,Nombre de bénéficiaires en structures d'insertion par l'activité économique,nb-beneficiaires-siae,81,Tarn,768.0,2021-10-31,497.0,2017-01-31,271.0,55.0,1022.0,52.0,2022-12-31,bénéficiaires *
Supprimer la taxe d’habitation sur les résidences principales,Nombre de bénéficiaires totalement exonérés,nb-beneficiaires-suppression-taxe-habitation,81,Tarn,149606.0,2021-12-31,0.0,2017-12-31,149606.0,,178706.0,84.0,2023-12-31,bénéficiaires
Garantir l'égalité professionnelle entre les femmes et les hommes,Part des entreprises respectant leur obligation de publier l’index égalité professionnelle,tx-entreprise-egalite-pro,81,Tarn,93.0,2021-12-31,100.0,2019-03-31,-7.0,-7.0,90.0,100.0,2022-12-31,%
