mesure,indicateur,id_indicateur,code_departement,libelle_departement,valeur_actuelle,date_valeur_actuelle,valeur_initiale,date_valeur_initiale,progression,pourcentage_progression,cible,pourcentage_cible,date_cible,unite
Aide de France Relance aux entreprises,Nombre d'entreprises industrielles et organismes agricoles bénéficiaires des aides à l'investissement de France Relance,nb-entreprises-industrielles-agricoles,70,Haute-Saône,7.0,2021-03-31,0.0,,7.0,,,,,entreprises industrielles et agricoles
Numérisation des petites et moyennes entreprises,Nombre d'entreprises ayant bénéficié d'un chèque numérique de 500€,nb-entreprises-cheaque-numerique,70,Haute-Saône,71.0,2021-04-30,14.0,2021-02-28,57.0,407.0,278.0,22.0,2022-12-31,entreprises
Numérisation des petites et moyennes entreprises,Nombre d'entreprises ayant disposé d'un diagnostic numérique et un plan d'action individualisé,nb-diagnostics-individualises,70,Haute-Saône,54.0,2021-04-30,19.0,2021-01-31,35.0,184.0,93.0,47.0,2022-12-31,entreprises
Développer l’apprentissage,Nombre de contrats d’apprentissage,nombre-contrats-apprentissage,70,Haute-Saône,1572.0,2020-12-31,1064.0,2017-12-31,508.0,48.0,,,,contrats
Plan 1 jeune 1 solution,Nombre de recrutements de jeunes,nombre-recrutements-jeunes,70,Haute-Saône,2584.0,2020-12-31,2326.0,2018-12-31,258.0,11.0,,,,Recrutements de jeunes
Pacte d'ambition pour l'insertion par l'activité économique,Nombre de bénéficiaires en structures d'insertion par l'activité économique,nb-beneficiaires-siae,70,Haute-Saône,477.0,2020-12-31,428.0,2017-01-31,49.0,11.0,,,,bénéficiaires
Supprimer la taxe d’habitation sur les résidences principales,Nombre de bénéficiaires totalement exonérés,nb-beneficiaires-suppression-taxe-habitation,70,Haute-Saône,91065.0,2020-12-31,0.0,2017-01-01,91065.0,,106686.0,85.0,2023-12-31,bénéficiaires
