mesure,indicateur,id_indicateur,code_departement,libelle_departement,valeur_actuelle,date_valeur_actuelle,valeur_initiale,date_valeur_initiale,progression,pourcentage_progression,cible,pourcentage_cible,date_cible,unite
Aide de France Relance aux entreprises,Nombre d’entreprises industrielles (dont PME) bénéficiaires des aides à l'investissement de France Relance,nb-entreprises-industrielles-agricoles,36,Indre,45.0,2021-11-30,0.0,2020-10-31,45.0,,,,,entreprises industrielles
Numérisation des petites et moyennes entreprises,Nombre d'entreprises ayant bénéficié d'un chèque numérique de 500€,nb-entreprises-cheaque-numerique,36,Indre,161.0,2021-12-31,0.0,2020-09-30,161.0,,252.0,64.0,2022-12-31,entreprises
Numérisation des petites et moyennes entreprises,Nombre d'entreprises ayant disposé d'un diagnostic numérique et d'un plan d'action individualisé,nb-diagnostics-individualises,36,Indre,73.0,2021-12-31,0.0,2020-09-30,73.0,,84.0,87.0,2022-12-31,entreprises
Développer l’apprentissage,Nombre de contrats d’apprentissage,nombre-contrats-apprentissage,36,Indre,1446.0,2021-09-30,1103.0,2017-12-31,343.0,31.0,1422.0,100.0,2022-12-31,contrats
Plan 1 jeune 1 solution,Nombre de recrutements de jeunes,nombre-recrutements-jeunes,36,Indre,4709.0,2021-07-31,4530.0,2019-07-31,179.0,4.0,,,,Recrutements de jeunes
Pacte d'ambition pour l'insertion par l'activité économique,Nombre de bénéficiaires en structures d'insertion par l'activité économique,nb-beneficiaires-siae,36,Indre,726.0,2021-09-30,683.0,2017-01-31,43.0,6.0,1143.0,9.0,2022-12-31,bénéficiaires *
Supprimer la taxe d’habitation sur les résidences principales,Nombre de bénéficiaires totalement exonérés,nb-beneficiaires-suppression-taxe-habitation,36,Indre,91327.0,2021-12-31,0.0,2017-12-31,91327.0,,106174.0,86.0,2023-12-31,bénéficiaires
Garantir l'égalité professionnelle entre les femmes et les hommes,Part des entreprises respectant leur obligation de publier l’index égalité professionnelle,tx-entreprise-egalite-pro,36,Indre,100.0,2021-12-31,82.0,2019-09-30,18.0,22.0,90.0,100.0,2022-12-31,%
