mesure,indicateur,id_indicateur,code_departement,libelle_departement,valeur_actuelle,date_valeur_actuelle,valeur_initiale,date_valeur_initiale,progression,pourcentage_progression,cible,pourcentage_cible,date_cible,unite
Aide de France Relance aux entreprises,Nombre d'entreprises industrielles et organismes agricoles bénéficiaires des aides à l'investissement de France Relance,nb-entreprises-industrielles-agricoles,25,Doubs,268.0,2021-10-31,0.0,,268.0,,147.0,100.0,2022-12-31,entreprises industrielles et agricoles
Numérisation des petites et moyennes entreprises,Nombre d'entreprises ayant bénéficié d'un chèque numérique de 500€,nb-entreprises-cheaque-numerique,25,Doubs,705.0,2021-10-31,39.0,2021-02-28,666.0,1708.0,671.0,100.0,2022-12-31,entreprises
Numérisation des petites et moyennes entreprises,Nombre d'entreprises ayant disposé d'un diagnostic numérique et d'un plan d'action individualisé,nb-diagnostics-individualises,25,Doubs,110.0,2021-10-31,18.0,2021-01-31,92.0,511.0,210.0,48.0,2022-12-31,entreprises
Développer l’apprentissage,Nombre de contrats d’apprentissage,nombre-contrats-apprentissage,25,Doubs,4547.0,2020-12-31,3126.0,2017-12-31,1421.0,45.0,4508.0,100.0,2022-12-31,contrats
Plan 1 jeune 1 solution,Nombre de recrutements de jeunes,nombre-recrutements-jeunes,25,Doubs,16045.0,2021-07-31,16617.0,2019-07-31,-572.0,-3.0,,,,Recrutements de jeunes
Pacte d'ambition pour l'insertion par l'activité économique,Nombre de bénéficiaires en structures d'insertion par l'activité économique,nb-beneficiaires-siae,25,Doubs,1747.0,2021-06-30,1555.0,2017-01-31,192.0,12.0,3249.0,11.0,2022-12-31,bénéficiaires *
Supprimer la taxe d’habitation sur les résidences principales,Nombre de bénéficiaires totalement exonérés,nb-beneficiaires-suppression-taxe-habitation,25,Doubs,183340.0,2021-12-31,0.0,2017-01-01,183340.0,,246618.0,74.0,2023-12-31,bénéficiaires
Garantir l'égalité professionnelle entre les femmes et les hommes,Part des entreprises respectant leur obligation de publier l’index égalité professionnelle,tx-entreprise-egalite-pro,25,Doubs,100.0,2021-09-30,100.0,2019-03-31,0.0,0.0,90.0,100.0,2022-12-31,%
