mesure,indicateur,id_indicateur,code_departement,libelle_departement,valeur_actuelle,date_valeur_actuelle,valeur_initiale,date_valeur_initiale,progression,pourcentage_progression,cible,pourcentage_cible,date_cible,unite
Aide de France Relance aux entreprises,Nombre d'entreprises industrielles et organismes agricoles bénéficiaires des aides à l'investissement de France Relance,nb-entreprises-industrielles-agricoles,18,Cher,65.0,2021-06-30,0.0,,65.0,,,,,entreprises industrielles et agricoles
Numérisation des petites et moyennes entreprises,Nombre d'entreprises ayant bénéficié d'un chèque numérique de 500€,nb-entreprises-cheaque-numerique,18,Cher,143.0,2021-06-30,11.0,2021-02-28,132.0,1200.0,344.0,40.0,2022-12-31,entreprises
Numérisation des petites et moyennes entreprises,Nombre d'entreprises ayant disposé d'un diagnostic numérique et d'un plan d'action individualisé,nb-diagnostics-individualises,18,Cher,105.0,2021-06-30,17.0,2021-01-31,88.0,518.0,111.0,94.0,2022-12-31,entreprises
Développer l’apprentissage,Nombre de contrats d’apprentissage,nombre-contrats-apprentissage,18,Cher,1824.0,2020-12-31,1293.0,2017-12-31,531.0,41.0,1752.0,100.0,2022-12-31,contrats
Plan 1 jeune 1 solution,Nombre de recrutements de jeunes,nombre-recrutements-jeunes,18,Cher,4156.0,2021-02-28,4018.0,2019-02-28,138.0,3.0,,,,Recrutements de jeunes
Pacte d'ambition pour l'insertion par l'activité économique,Nombre de bénéficiaires en structures d'insertion par l'activité économique,nb-beneficiaires-siae,18,Cher,893.0,2021-03-31,878.0,2017-01-31,15.0,2.0,1244.0,4.0,2022-12-31,bénéficiaires *
Supprimer la taxe d’habitation sur les résidences principales,Nombre de bénéficiaires totalement exonérés,nb-beneficiaires-suppression-taxe-habitation,18,Cher,119564.0,2020-12-31,0.0,2017-01-01,119564.0,,144143.0,83.0,2023-12-31,bénéficiaires
Garantir l'égalité professionnelle entre les femmes et les hommes,Part des entreprises respectant leur obligation de publier l’index égalité professionnelle,tx-entreprise-egalite-pro,18,Cher,66.0,2021-06-30,100.0,2019-03-31,-34.0,-34.0,90.0,0.0,2022-12-31,%
