mesure,indicateur,id_indicateur,code_departement,libelle_departement,valeur_actuelle,date_valeur_actuelle,valeur_initiale,date_valeur_initiale,progression,pourcentage_progression,cible,pourcentage_cible,date_cible,unite
Aide de France Relance aux entreprises,Nombre d'entreprises industrielles et organismes agricoles bénéficiaires des aides à l'investissement de France Relance,nb-entreprises-industrielles-agricoles,21,Côte-d'Or,14.0,2021-03-31,0.0,,14.0,,,,,entreprises industrielles et agricoles
Numérisation des petites et moyennes entreprises,Nombre d'entreprises ayant bénéficié d'un chèque numérique de 500€,nb-entreprises-cheaque-numerique,21,Côte-d'Or,272.0,2021-04-30,58.0,2021-02-28,214.0,369.0,772.0,30.0,2022-12-31,entreprises
Numérisation des petites et moyennes entreprises,Nombre d'entreprises ayant disposé d'un diagnostic numérique et un plan d'action individualisé,nb-diagnostics-individualises,21,Côte-d'Or,92.0,2021-04-30,18.0,2021-01-31,74.0,411.0,234.0,34.0,2022-12-31,entreprises
Développer l’apprentissage,Nombre de contrats d’apprentissage,nombre-contrats-apprentissage,21,Côte-d'Or,4117.0,2020-12-31,2567.0,2017-12-31,1550.0,60.0,,,,contrats
Plan 1 jeune 1 solution,Nombre de recrutements de jeunes,nombre-recrutements-jeunes,21,Côte-d'Or,9811.0,2020-12-31,9764.0,2018-12-31,47.0,0.0,,,,Recrutements de jeunes
Pacte d'ambition pour l'insertion par l'activité économique,Nombre de bénéficiaires en structures d'insertion par l'activité économique,nb-beneficiaires-siae,21,Côte-d'Or,1265.0,2020-12-31,1201.0,2017-01-31,64.0,5.0,,,,bénéficiaires
Supprimer la taxe d’habitation sur les résidences principales,Nombre de bénéficiaires totalement exonérés,nb-beneficiaires-suppression-taxe-habitation,21,Côte-d'Or,189666.0,2020-12-31,0.0,2017-01-01,189666.0,,249003.0,76.0,2023-12-31,bénéficiaires
