mesure,indicateur,id_indicateur,code_departement,libelle_departement,valeur_actuelle,date_valeur_actuelle,valeur_initiale,date_valeur_initiale,progression,pourcentage_progression,cible,pourcentage_cible,date_cible,unite
Aide de France Relance aux entreprises,Nombre d'entreprises industrielles et organismes agricoles bénéficiaires des aides à l'investissement de France Relance,nb-entreprises-industrielles-agricoles,44,Loire-Atlantique,60.0,2021-06-30,0.0,,60.0,,,,,entreprises industrielles et agricoles
Numérisation des petites et moyennes entreprises,Nombre d'entreprises ayant bénéficié d'un chèque numérique de 500€,nb-entreprises-cheaque-numerique,44,Loire-Atlantique,1898.0,2021-06-30,149.0,2021-02-28,1749.0,1174.0,2078.0,91.0,2022-12-31,entreprises
Numérisation des petites et moyennes entreprises,Nombre d'entreprises ayant disposé d'un diagnostic numérique et d'un plan d'action individualisé,nb-diagnostics-individualises,44,Loire-Atlantique,316.0,2021-06-30,13.0,2021-01-31,303.0,2331.0,414.0,76.0,2022-12-31,entreprises
Développer l’apprentissage,Nombre de contrats d’apprentissage,nombre-contrats-apprentissage,44,Loire-Atlantique,12609.0,2020-12-31,6965.0,2017-12-31,5644.0,81.0,12617.0,100.0,2022-12-31,contrats
Plan 1 jeune 1 solution,Nombre de recrutements de jeunes,nombre-recrutements-jeunes,44,Loire-Atlantique,35880.0,2021-02-28,35803.0,2019-02-28,77.0,0.0,,,,Recrutements de jeunes
Pacte d'ambition pour l'insertion par l'activité économique,Nombre de bénéficiaires en structures d'insertion par l'activité économique,nb-beneficiaires-siae,44,Loire-Atlantique,3031.0,2021-03-31,2670.0,2017-01-31,361.0,14.0,4224.0,23.0,2022-12-31,bénéficiaires *
Supprimer la taxe d’habitation sur les résidences principales,Nombre de bénéficiaires totalement exonérés,nb-beneficiaires-suppression-taxe-habitation,44,Loire-Atlantique,494210.0,2020-12-31,0.0,2017-01-01,494210.0,,649824.0,76.0,2023-12-31,bénéficiaires
Garantir l'égalité professionnelle entre les femmes et les hommes,Part des entreprises respectant leur obligation de publier l’index égalité professionnelle,tx-entreprise-egalite-pro,44,Loire-Atlantique,65.0,2021-06-30,33.0,2019-03-31,32.0,97.0,90.0,56.0,2022-12-31,%
