mesure,indicateur,id_indicateur,code_departement,libelle_departement,valeur_actuelle,date_valeur_actuelle,valeur_initiale,date_valeur_initiale,progression,pourcentage_progression,cible,pourcentage_cible,date_cible,unite
Aide de France Relance aux entreprises,Nombre d’entreprises industrielles (dont PME) bénéficiaires des aides à l'investissement de France Relance,nb-entreprises-industrielles-agricoles,37,Indre-et-Loire,112.0,2021-11-30,0.0,2020-10-31,112.0,,,,,entreprises industrielles
Numérisation des petites et moyennes entreprises,Nombre d'entreprises ayant bénéficié d'un chèque numérique de 500€,nb-entreprises-cheaque-numerique,37,Indre-et-Loire,1023.0,2021-12-31,0.0,2020-09-30,1023.0,,771.0,100.0,2022-12-31,entreprises
Numérisation des petites et moyennes entreprises,Nombre d'entreprises ayant disposé d'un diagnostic numérique et d'un plan d'action individualisé,nb-diagnostics-individualises,37,Indre-et-Loire,155.0,2021-12-31,0.0,2020-09-30,155.0,,240.0,65.0,2022-12-31,entreprises
Développer l’apprentissage,Nombre de contrats d’apprentissage,nombre-contrats-apprentissage,37,Indre-et-Loire,5882.0,2021-09-30,3354.0,2017-12-31,2528.0,75.0,4918.0,100.0,2022-12-31,contrats
Plan 1 jeune 1 solution,Nombre de recrutements de jeunes,nombre-recrutements-jeunes,37,Indre-et-Loire,17855.0,2021-07-31,18195.0,2019-07-31,-340.0,-2.0,,,,Recrutements de jeunes
Pacte d'ambition pour l'insertion par l'activité économique,Nombre de bénéficiaires en structures d'insertion par l'activité économique,nb-beneficiaires-siae,37,Indre-et-Loire,1403.0,2021-09-30,1273.0,2017-01-31,130.0,10.0,1987.0,18.0,2022-12-31,bénéficiaires *
Supprimer la taxe d’habitation sur les résidences principales,Nombre de bénéficiaires totalement exonérés,nb-beneficiaires-suppression-taxe-habitation,37,Indre-et-Loire,225812.0,2021-12-31,0.0,2017-12-31,225812.0,,287146.0,79.0,2023-12-31,bénéficiaires
Garantir l'égalité professionnelle entre les femmes et les hommes,Part des entreprises respectant leur obligation de publier l’index égalité professionnelle,tx-entreprise-egalite-pro,37,Indre-et-Loire,94.0,2021-12-31,0.0,2019-03-31,94.0,,90.0,100.0,2022-12-31,%
