mesure,indicateur,id_indicateur,code_departement,libelle_departement,valeur_actuelle,date_valeur_actuelle,valeur_initiale,date_valeur_initiale,progression,pourcentage_progression,cible,pourcentage_cible,date_cible,unite
Aide de France Relance aux entreprises,Nombre d'entreprises industrielles et organismes agricoles bénéficiaires des aides à l'investissement de France Relance,nb-entreprises-industrielles-agricoles,17,Charente-Maritime,4.0,2021-03-31,0.0,,4.0,,,,,entreprises industrielles et agricoles
Numérisation des petites et moyennes entreprises,Nombre d'entreprises ayant bénéficié d'un chèque numérique de 500€,nb-entreprises-cheaque-numerique,17,Charente-Maritime,319.0,2021-04-30,53.0,2021-02-28,266.0,502.0,1119.0,25.0,2022-12-31,entreprises
Numérisation des petites et moyennes entreprises,Nombre d'entreprises ayant disposé d'un diagnostic numérique et un plan d'action individualisé,nb-diagnostics-individualises,17,Charente-Maritime,117.0,2021-04-30,23.0,2021-01-31,94.0,409.0,318.0,32.0,2022-12-31,entreprises
Développer l’apprentissage,Nombre de contrats d’apprentissage,nombre-contrats-apprentissage,17,Charente-Maritime,4718.0,2020-12-31,3271.0,2017-12-31,1447.0,44.0,,,,contrats
Plan 1 jeune 1 solution,Nombre de recrutements de jeunes,nombre-recrutements-jeunes,17,Charente-Maritime,8987.0,2020-12-31,7661.0,2018-12-31,1326.0,17.0,,,,Recrutements de jeunes
Pacte d'ambition pour l'insertion par l'activité économique,Nombre de bénéficiaires en structures d'insertion par l'activité économique,nb-beneficiaires-siae,17,Charente-Maritime,1587.0,2020-12-31,1720.0,2017-01-31,-133.0,-8.0,,,,bénéficiaires
Supprimer la taxe d’habitation sur les résidences principales,Nombre de bénéficiaires totalement exonérés,nb-beneficiaires-suppression-taxe-habitation,17,Charente-Maritime,257379.0,2020-12-31,0.0,2017-01-01,257379.0,,321378.0,80.0,2023-12-31,bénéficiaires
