mesure,indicateur,id_indicateur,code_departement,libelle_departement,valeur_actuelle,date_valeur_actuelle,valeur_initiale,date_valeur_initiale,progression,pourcentage_progression,cible,pourcentage_cible,date_cible,unite
Aide de France Relance aux entreprises,Nombre d'entreprises industrielles et organismes agricoles bénéficiaires des aides à l'investissement de France Relance,nb-entreprises-industrielles-agricoles,78,Yvelines,6.0,2021-06-30,0.0,,6.0,,,,,entreprises industrielles et agricoles
Numérisation des petites et moyennes entreprises,Nombre d'entreprises ayant bénéficié d'un chèque numérique de 500€,nb-entreprises-cheaque-numerique,78,Yvelines,1078.0,2021-06-30,53.0,2021-02-28,1025.0,1934.0,2370.0,44.0,2022-12-31,entreprises
Numérisation des petites et moyennes entreprises,Nombre d'entreprises ayant disposé d'un diagnostic numérique et d'un plan d'action individualisé,nb-diagnostics-individualises,78,Yvelines,302.0,2021-06-30,72.0,2021-01-31,230.0,319.0,921.0,27.0,2022-12-31,entreprises
Développer l’apprentissage,Nombre de contrats d’apprentissage,nombre-contrats-apprentissage,78,Yvelines,10870.0,2020-12-31,8027.0,2017-12-31,2843.0,35.0,10980.0,96.0,2022-12-31,contrats
Plan 1 jeune 1 solution,Nombre de recrutements de jeunes,nombre-recrutements-jeunes,78,Yvelines,31321.0,2021-02-28,34844.0,2019-02-28,-3523.0,-10.0,,,,Recrutements de jeunes
Pacte d'ambition pour l'insertion par l'activité économique,Nombre de bénéficiaires en structures d'insertion par l'activité économique,nb-beneficiaires-siae,78,Yvelines,1179.0,2021-03-31,1000.0,2017-01-31,179.0,18.0,2302.0,14.0,2022-12-31,bénéficiaires *
Supprimer la taxe d’habitation sur les résidences principales,Nombre de bénéficiaires totalement exonérés,nb-beneficiaires-suppression-taxe-habitation,78,Yvelines,345995.0,2020-12-31,0.0,2017-01-01,345995.0,,595942.0,58.0,2023-12-31,bénéficiaires
Garantir l'égalité professionnelle entre les femmes et les hommes,Part des entreprises respectant leur obligation de publier l’index égalité professionnelle,tx-entreprise-egalite-pro,78,Yvelines,55.0,2021-06-30,56.0,2019-03-31,-1.0,-2.0,90.0,0.0,2022-12-31,%
