mesure,indicateur,id_indicateur,code_departement,libelle_departement,valeur_actuelle,date_valeur_actuelle,valeur_initiale,date_valeur_initiale,progression,pourcentage_progression,cible,pourcentage_cible,date_cible,unite
Aide de France Relance aux entreprises,Nombre d'entreprises industrielles et organismes agricoles bénéficiaires des aides à l'investissement de France Relance,nb-entreprises-industrielles-agricoles,52,Haute-Marne,6.0,2021-03-31,0.0,,6.0,,,,,entreprises industrielles et agricoles
Numérisation des petites et moyennes entreprises,Nombre d'entreprises ayant bénéficié d'un chèque numérique de 500€,nb-entreprises-cheaque-numerique,52,Haute-Marne,35.0,2021-04-30,3.0,2021-02-28,32.0,1067.0,191.0,17.0,2022-12-31,entreprises
Numérisation des petites et moyennes entreprises,Nombre d'entreprises ayant disposé d'un diagnostic numérique et un plan d'action individualisé,nb-diagnostics-individualises,52,Haute-Marne,39.0,2021-04-30,18.0,2021-01-31,21.0,117.0,60.0,50.0,2022-12-31,entreprises
Développer l’apprentissage,Nombre de contrats d’apprentissage,nombre-contrats-apprentissage,52,Haute-Marne,895.0,2020-12-31,676.0,2017-12-31,219.0,32.0,,,,contrats
Plan 1 jeune 1 solution,Nombre de recrutements de jeunes,nombre-recrutements-jeunes,52,Haute-Marne,1889.0,2020-12-31,1790.0,2018-12-31,99.0,6.0,,,,Recrutements de jeunes
Pacte d'ambition pour l'insertion par l'activité économique,Nombre de bénéficiaires en structures d'insertion par l'activité économique,nb-beneficiaires-siae,52,Haute-Marne,541.0,2020-12-31,521.0,2017-01-31,20.0,4.0,,,,bénéficiaires
Supprimer la taxe d’habitation sur les résidences principales,Nombre de bénéficiaires totalement exonérés,nb-beneficiaires-suppression-taxe-habitation,52,Haute-Marne,69327.0,2020-12-31,0.0,2017-01-01,69327.0,,80533.0,86.0,2023-12-31,bénéficiaires
