mesure,indicateur,id_indicateur,code_departement,libelle_departement,valeur_actuelle,date_valeur_actuelle,valeur_initiale,date_valeur_initiale,progression,pourcentage_progression,cible,pourcentage_cible,date_cible,unite
Aide de France Relance aux entreprises,Nombre d’entreprises industrielles (dont PME) bénéficiaires des aides à l'investissement de France Relance,nb-entreprises-industrielles-agricoles,52,Haute-Marne,43.0,2022-12-31,0.0,2020-10-31,43.0,,,,,entreprises industrielles
Numérisation des petites et moyennes entreprises,Nombre d'entreprises ayant bénéficié d'un chèque numérique de 500€,nb-entreprises-cheaque-numerique,52,Haute-Marne,125.0,2022-11-30,0.0,2020-09-30,125.0,,191.0,65.0,2022-12-31,entreprises
Numérisation des petites et moyennes entreprises,Nombre d'entreprises ayant disposé d'un diagnostic numérique et d'un plan d'action individualisé,nb-diagnostics-individualises,52,Haute-Marne,95.0,2022-11-30,0.0,2020-09-30,95.0,,60.0,100.0,2022-12-31,entreprises
Développer l’apprentissage,Nombre de contrats d’apprentissage,nombre-contrats-apprentissage,52,Haute-Marne,1406.0,2022-10-31,672.0,2017-12-31,734.0,109.0,930.0,100.0,2022-12-31,contrats
Plan 1 jeune 1 solution,Nombre de recrutements de jeunes,nombre-recrutements-jeunes,52,Haute-Marne,4363.0,2022-07-31,3361.0,2019-07-31,1002.0,30.0,,,,Recrutements depuis le mois d'août précédent
Pacte d'ambition pour l'insertion par l'activité économique,Nombre de bénéficiaires en structures d'insertion par l'activité économique,nb-beneficiaires-siae,52,Haute-Marne,653.0,2022-09-30,521.0,2017-01-31,132.0,25.0,950.0,31.0,2022-12-31,bénéficiaires *
Supprimer la taxe d’habitation sur les résidences principales,Nombre de bénéficiaires totalement exonérés,nb-beneficiaires-suppression-taxe-habitation,52,Haute-Marne,69265.0,2022-12-31,0.0,2017-12-31,69265.0,,80570.0,86.0,2023-12-31,bénéficiaires
Garantir l'égalité professionnelle entre les femmes et les hommes,Part des entreprises respectant leur obligation de publier l’index égalité professionnelle,tx-entreprise-egalite-pro,52,Haute-Marne,90.0,2022-12-31,0.0,2019-03-31,90.0,,90.0,100.0,2022-12-31,%
