mesure,indicateur,id_indicateur,code_departement,libelle_departement,valeur_actuelle,date_valeur_actuelle,valeur_initiale,date_valeur_initiale,progression,pourcentage_progression,cible,pourcentage_cible,date_cible,unite
Aide de France Relance aux entreprises,Nombre d'entreprises industrielles et organismes agricoles bénéficiaires des aides à l'investissement de France Relance,nb-entreprises-industrielles-agricoles,01,Ain,38.0,2021-06-30,0.0,,38.0,,,,,entreprises industrielles et agricoles
Numérisation des petites et moyennes entreprises,Nombre d'entreprises ayant bénéficié d'un chèque numérique de 500€,nb-entreprises-cheaque-numerique,01,Ain,433.0,2021-06-30,27.0,2021-02-28,406.0,1504.0,878.0,48.0,2022-12-31,entreprises
Numérisation des petites et moyennes entreprises,Nombre d'entreprises ayant disposé d'un diagnostic numérique et d'un plan d'action individualisé,nb-diagnostics-individualises,01,Ain,217.0,2021-06-30,35.0,2021-01-31,182.0,520.0,297.0,69.0,2022-12-31,entreprises
Développer l’apprentissage,Nombre de contrats d’apprentissage,nombre-contrats-apprentissage,01,Ain,4353.0,2020-12-31,2944.0,2017-12-31,1409.0,48.0,4306.0,100.0,2022-12-31,contrats
Plan 1 jeune 1 solution,Nombre de recrutements de jeunes,nombre-recrutements-jeunes,01,Ain,10707.0,2021-02-28,10528.0,2019-02-28,179.0,2.0,,,,Recrutements de jeunes
Pacte d'ambition pour l'insertion par l'activité économique,Nombre de bénéficiaires en structures d'insertion par l'activité économique,nb-beneficiaires-siae,01,Ain,1181.0,2021-03-31,974.0,2017-01-31,207.0,21.0,1873.0,23.0,2022-12-31,bénéficiaires *
Supprimer la taxe d’habitation sur les résidences principales,Nombre de bénéficiaires totalement exonérés,nb-beneficiaires-suppression-taxe-habitation,01,Ain,197066.0,2020-12-31,0.0,2017-01-01,197066.0,,276202.0,71.0,2023-12-31,bénéficiaires
Garantir l'égalité professionnelle entre les femmes et les hommes,Part des entreprises respectant leur obligation de publier l’index égalité professionnelle,tx-entreprise-egalite-pro,01,Ain,64.0,2021-06-30,67.0,2019-03-31,-3.0,-4.0,90.0,0.0,2022-12-31,%
