mesure,indicateur,id_indicateur,code_departement,libelle_departement,valeur_actuelle,date_valeur_actuelle,valeur_initiale,date_valeur_initiale,progression,pourcentage_progression,cible,pourcentage_cible,date_cible,unite
Aide de France Relance aux entreprises,Nombre d'entreprises industrielles et organismes agricoles bénéficiaires des aides à l'investissement de France Relance,nb-entreprises-industrielles-agricoles,35,Ille-et-Vilaine,64.0,2021-06-30,0.0,,64.0,,,,,entreprises industrielles et agricoles
Numérisation des petites et moyennes entreprises,Nombre d'entreprises ayant bénéficié d'un chèque numérique de 500€,nb-entreprises-cheaque-numerique,35,Ille-et-Vilaine,1393.0,2021-06-30,92.0,2021-02-28,1301.0,1414.0,1399.0,100.0,2022-12-31,entreprises
Numérisation des petites et moyennes entreprises,Nombre d'entreprises ayant disposé d'un diagnostic numérique et d'un plan d'action individualisé,nb-diagnostics-individualises,35,Ille-et-Vilaine,166.0,2021-06-30,52.0,2021-01-31,114.0,219.0,408.0,32.0,2022-12-31,entreprises
Développer l’apprentissage,Nombre de contrats d’apprentissage,nombre-contrats-apprentissage,35,Ille-et-Vilaine,10412.0,2020-12-31,4888.0,2017-12-31,5524.0,113.0,10237.0,100.0,2022-12-31,contrats
Plan 1 jeune 1 solution,Nombre de recrutements de jeunes,nombre-recrutements-jeunes,35,Ille-et-Vilaine,29171.0,2021-02-28,27604.0,2019-02-28,1567.0,6.0,,,,Recrutements de jeunes
Pacte d'ambition pour l'insertion par l'activité économique,Nombre de bénéficiaires en structures d'insertion par l'activité économique,nb-beneficiaires-siae,35,Ille-et-Vilaine,1863.0,2021-03-31,1809.0,2017-01-31,54.0,3.0,2657.0,6.0,2022-12-31,bénéficiaires *
Supprimer la taxe d’habitation sur les résidences principales,Nombre de bénéficiaires totalement exonérés,nb-beneficiaires-suppression-taxe-habitation,35,Ille-et-Vilaine,374422.0,2020-12-31,0.0,2017-01-01,374422.0,,483063.0,78.0,2023-12-31,bénéficiaires
Garantir l'égalité professionnelle entre les femmes et les hommes,Part des entreprises respectant leur obligation de publier l’index égalité professionnelle,tx-entreprise-egalite-pro,35,Ille-et-Vilaine,66.0,2021-06-30,33.0,2019-03-31,33.0,100.0,90.0,58.0,2022-12-31,%
