mesure,indicateur,id_indicateur,code_departement,libelle_departement,valeur_actuelle,date_valeur_actuelle,valeur_initiale,date_valeur_initiale,progression,pourcentage_progression,cible,pourcentage_cible,date_cible,unite
Aide de France Relance aux entreprises,Nombre d'entreprises industrielles et organismes agricoles bénéficiaires des aides à l'investissement de France Relance,nb-entreprises-industrielles-agricoles,94,Val-de-Marne,53.0,2021-10-31,0.0,,53.0,,74.0,72.0,2022-12-31,entreprises industrielles et agricoles
Numérisation des petites et moyennes entreprises,Nombre d'entreprises ayant bénéficié d'un chèque numérique de 500€,nb-entreprises-cheaque-numerique,94,Val-de-Marne,1698.0,2021-10-31,47.0,2021-02-28,1651.0,3513.0,2392.0,70.0,2022-12-31,entreprises
Numérisation des petites et moyennes entreprises,Nombre d'entreprises ayant disposé d'un diagnostic numérique et d'un plan d'action individualisé,nb-diagnostics-individualises,94,Val-de-Marne,440.0,2021-10-31,49.0,2021-01-31,391.0,798.0,462.0,95.0,2022-12-31,entreprises
Développer l’apprentissage,Nombre de contrats d’apprentissage,nombre-contrats-apprentissage,94,Val-de-Marne,9094.0,2020-12-31,5483.0,2017-12-31,3611.0,66.0,9264.0,96.0,2022-12-31,contrats
Plan 1 jeune 1 solution,Nombre de recrutements de jeunes,nombre-recrutements-jeunes,94,Val-de-Marne,45367.0,2021-07-31,46351.0,2019-07-31,-984.0,-2.0,,,,Recrutements de jeunes
Pacte d'ambition pour l'insertion par l'activité économique,Nombre de bénéficiaires en structures d'insertion par l'activité économique,nb-beneficiaires-siae,94,Val-de-Marne,1131.0,2021-06-30,955.0,2017-01-31,176.0,18.0,3325.0,7.0,2022-12-31,bénéficiaires *
Supprimer la taxe d’habitation sur les résidences principales,Nombre de bénéficiaires totalement exonérés,nb-beneficiaires-suppression-taxe-habitation,94,Val-de-Marne,387947.0,2021-12-31,0.0,2017-01-01,387947.0,,588951.0,66.0,2023-12-31,bénéficiaires
Garantir l'égalité professionnelle entre les femmes et les hommes,Part des entreprises respectant leur obligation de publier l’index égalité professionnelle,tx-entreprise-egalite-pro,94,Val-de-Marne,88.0,2021-09-30,46.0,2019-03-31,42.0,91.0,90.0,95.0,2022-12-31,%
