mesure,indicateur,id_indicateur,code_departement,libelle_departement,valeur_actuelle,date_valeur_actuelle,valeur_initiale,date_valeur_initiale,progression,pourcentage_progression,cible,pourcentage_cible,date_cible,unite
Aide de France Relance aux entreprises,Nombre d'entreprises industrielles et organismes agricoles bénéficiaires des aides à l'investissement de France Relance,nb-entreprises-industrielles-agricoles,34,Hérault,73.0,2021-06-30,0.0,,73.0,,,,,entreprises industrielles et agricoles
Numérisation des petites et moyennes entreprises,Nombre d'entreprises ayant bénéficié d'un chèque numérique de 500€,nb-entreprises-cheaque-numerique,34,Hérault,2074.0,2021-06-30,127.0,2021-02-28,1947.0,1533.0,2497.0,82.0,2022-12-31,entreprises
Numérisation des petites et moyennes entreprises,Nombre d'entreprises ayant disposé d'un diagnostic numérique et d'un plan d'action individualisé,nb-diagnostics-individualises,34,Hérault,207.0,2021-06-30,52.0,2021-01-31,155.0,298.0,654.0,26.0,2022-12-31,entreprises
Développer l’apprentissage,Nombre de contrats d’apprentissage,nombre-contrats-apprentissage,34,Hérault,10726.0,2020-12-31,4979.0,2017-12-31,5747.0,115.0,10515.0,100.0,2022-12-31,contrats
Plan 1 jeune 1 solution,Nombre de recrutements de jeunes,nombre-recrutements-jeunes,34,Hérault,26520.0,2021-02-28,23612.0,2019-02-28,2908.0,12.0,,,,Recrutements de jeunes
Pacte d'ambition pour l'insertion par l'activité économique,Nombre de bénéficiaires en structures d'insertion par l'activité économique,nb-beneficiaires-siae,34,Hérault,1598.0,2021-03-31,1041.0,2017-01-31,557.0,54.0,2042.0,56.0,2022-12-31,bénéficiaires *
Supprimer la taxe d’habitation sur les résidences principales,Nombre de bénéficiaires totalement exonérés,nb-beneficiaires-suppression-taxe-habitation,34,Hérault,434340.0,2020-12-31,0.0,2017-01-01,434340.0,,551166.0,79.0,2023-12-31,bénéficiaires
Garantir l'égalité professionnelle entre les femmes et les hommes,Part des entreprises respectant leur obligation de publier l’index égalité professionnelle,tx-entreprise-egalite-pro,34,Hérault,86.0,2021-06-30,36.0,2019-03-31,50.0,139.0,90.0,93.0,2022-12-31,%
