mesure,indicateur,id_indicateur,code_departement,libelle_departement,valeur_actuelle,date_valeur_actuelle,valeur_initiale,date_valeur_initiale,progression,pourcentage_progression,cible,pourcentage_cible,date_cible,unite
Aide de France Relance aux entreprises,Nombre d'entreprises industrielles et organismes agricoles bénéficiaires des aides à l'investissement de France Relance,nb-entreprises-industrielles-agricoles,84,Vaucluse,8.0,2021-03-31,0.0,,8.0,,,,,entreprises industrielles et agricoles
Numérisation des petites et moyennes entreprises,Nombre d'entreprises ayant bénéficié d'un chèque numérique de 500€,nb-entreprises-cheaque-numerique,84,Vaucluse,362.0,2021-04-30,67.0,2021-02-28,295.0,440.0,1177.0,27.0,2022-12-31,entreprises
Numérisation des petites et moyennes entreprises,Nombre d'entreprises ayant disposé d'un diagnostic numérique et un plan d'action individualisé,nb-diagnostics-individualises,84,Vaucluse,179.0,2021-04-30,22.0,2021-01-31,157.0,714.0,321.0,53.0,2022-12-31,entreprises
Développer l’apprentissage,Nombre de contrats d’apprentissage,nombre-contrats-apprentissage,84,Vaucluse,4005.0,2020-12-31,2705.0,2017-12-31,1300.0,48.0,,,,contrats
Plan 1 jeune 1 solution,Nombre de recrutements de jeunes,nombre-recrutements-jeunes,84,Vaucluse,8227.0,2020-12-31,7714.0,2018-12-31,513.0,7.0,,,,Recrutements de jeunes
Pacte d'ambition pour l'insertion par l'activité économique,Nombre de bénéficiaires en structures d'insertion par l'activité économique,nb-beneficiaires-siae,84,Vaucluse,1285.0,2020-12-31,1224.0,2017-01-31,61.0,5.0,,,,bénéficiaires
Supprimer la taxe d’habitation sur les résidences principales,Nombre de bénéficiaires totalement exonérés,nb-beneficiaires-suppression-taxe-habitation,84,Vaucluse,206344.0,2020-12-31,0.0,2017-01-01,206344.0,,253688.0,81.0,2023-12-31,bénéficiaires
