mesure,indicateur,id_indicateur,code_departement,libelle_departement,valeur_actuelle,date_valeur_actuelle,valeur_initiale,date_valeur_initiale,progression,pourcentage_progression,cible,pourcentage_cible,date_cible,unite
Aide de France Relance aux entreprises,Nombre d'entreprises industrielles et organismes agricoles bénéficiaires des aides à l'investissement de France Relance,nb-entreprises-industrielles-agricoles,74,Haute-Savoie,39.0,2021-03-31,0.0,,39.0,,,,,entreprises industrielles et agricoles
Numérisation des petites et moyennes entreprises,Nombre d'entreprises ayant bénéficié d'un chèque numérique de 500€,nb-entreprises-cheaque-numerique,74,Haute-Savoie,314.0,2021-04-30,64.0,2021-02-28,250.0,391.0,1491.0,18.0,2022-12-31,entreprises
Numérisation des petites et moyennes entreprises,Nombre d'entreprises ayant disposé d'un diagnostic numérique et un plan d'action individualisé,nb-diagnostics-individualises,74,Haute-Savoie,136.0,2021-04-30,51.0,2021-01-31,85.0,167.0,438.0,22.0,2022-12-31,entreprises
Développer l’apprentissage,Nombre de contrats d’apprentissage,nombre-contrats-apprentissage,74,Haute-Savoie,5753.0,2020-12-31,3562.0,2017-12-31,2191.0,62.0,,,,contrats
Plan 1 jeune 1 solution,Nombre de recrutements de jeunes,nombre-recrutements-jeunes,74,Haute-Savoie,15284.0,2020-12-31,19997.0,2018-12-31,-4713.0,-24.0,,,,Recrutements de jeunes
Pacte d'ambition pour l'insertion par l'activité économique,Nombre de bénéficiaires en structures d'insertion par l'activité économique,nb-beneficiaires-siae,74,Haute-Savoie,962.0,2020-12-31,978.0,2017-01-31,-16.0,-2.0,,,,bénéficiaires
Supprimer la taxe d’habitation sur les résidences principales,Nombre de bénéficiaires totalement exonérés,nb-beneficiaires-suppression-taxe-habitation,74,Haute-Savoie,224466.0,2020-12-31,0.0,2017-01-01,224466.0,,367561.0,61.0,2023-12-31,bénéficiaires
