mesure,indicateur,id_indicateur,maille_geographique,valeur_actuelle,date_valeur_actuelle,valeur_initiale,date_valeur_initiale,progression,pourcentage_progression,cible,pourcentage_cible,date_cible,unite
Aide de France Relance aux entreprises,Nombre d’entreprises industrielles (dont PME) bénéficiaires des aides à l'investissement de France Relance,nb-entreprises-industrielles-agricoles,national,10605.0,2021-12-31,0.0,2020-10-31,10605.0,,,,,entreprises industrielles
Numérisation des petites et moyennes entreprises,Nombre d'entreprises ayant bénéficié d'un chèque numérique de 500€,nb-entreprises-cheaque-numerique,national,113180.0,2022-02-28,0.0,2020-09-30,113180.0,,110000.0,100.0,2022-12-31,entreprises
Numérisation des petites et moyennes entreprises,Nombre d'entreprises ayant disposé d'un diagnostic numérique et d'un plan d'action individualisé,nb-diagnostics-individualises,national,29026.0,2022-02-28,0.0,2020-09-30,29026.0,,30000.0,97.0,2022-12-31,entreprises
Développer l’apprentissage,Nombre de contrats d’apprentissage,nombre-contrats-apprentissage,national,731785.0,2021-12-31,305271.0,2017-12-31,426514.0,140.0,520001.0,100.0,2022-12-31,contrats
Plan 1 jeune 1 solution,Nombre de recrutements de jeunes,nombre-recrutements-jeunes,national,2191782.0,2021-07-31,2170022.0,2019-07-31,21760.0,1.0,,,,Recrutements depuis le mois d'août précédent
Pacte d'ambition pour l'insertion par l'activité économique,Nombre de bénéficiaires en structures d'insertion par l'activité économique,nb-beneficiaires-siae,national,166655.0,2021-10-31,127290.0,2017-01-31,39365.0,31.0,240000.0,35.0,2022-12-31,bénéficiaires *
Supprimer la taxe d’habitation sur les résidences principales,Nombre de bénéficiaires totalement exonérés,nb-beneficiaires-suppression-taxe-habitation,national,22792361.0,2021-12-31,0.0,2017-12-31,22792361.0,,29968301.0,76.0,2023-12-31,bénéficiaires
Renforcer les compétences de la nation - plan d'investissement dans les compétences,"Nombre d’entrées en formation pour les publics éloignés de l’emploi (jeunes, demandeurs d’emploi faiblement qualifiés, actifs en insertion, …)",nb-formation-pic,national,1556643.0,2021-12-31,805100.0,2017-12-31,751543.0,93.0,1200000.0,100.0,2022-12-31,formations
Garantir l'égalité professionnelle entre les femmes et les hommes,Part des entreprises respectant leur obligation de publier l’index égalité professionnelle,tx-entreprise-egalite-pro,national,88.0,2021-12-31,67.0,2019-03-31,21.0,31.0,90.0,91.0,2022-12-31,%
