mesure,indicateur,id_indicateur,code_departement,libelle_departement,valeur_actuelle,date_valeur_actuelle,valeur_initiale,date_valeur_initiale,progression,pourcentage_progression,cible,pourcentage_cible,date_cible,unite
Améliorer la qualité du service rendu à l’usager,Part des lieux d’accueil du public qui publient leurs résultats (national et local),tx-transparence-resultats,63,Puy-de-Dôme,77.0,2019-12-31,6.0,2017-12-31,71.0,1183.0,100.0,76.0,2022-12-31,% de réseaux
Assurer une bonne couverture en internet fixe et en téléphonie mobile pour tous les Français d'ici 2022,Taux de déploiement de la fibre,taux-deploiement-fibre,63,Puy-de-Dôme,65.0,2021-09-30,22.0,2017-12-31,43.0,195.0,,,,% de déploiement
Déployer une offre France services dans tous les territoires ,Nombre de labellisations (atteinte de l'objectif fixé),nb-labellisations-france-services,63,Puy-de-Dôme,25.0,2022-03-31,7.0,2020-01-31,18.0,257.0,36.0,62.0,2022-12-31,labellisations
Redynamiser les cœurs de ville,Nombre de logements rénovés dans les petites villes (- de 20 000 habitants),nb-logements-renoves-petites-villes,63,Puy-de-Dôme,223.0,2022-02-28,0.0,2020-09-30,223.0,,,,,logements rénovés
Redynamiser les cœurs de ville,Nombre de logements ayant bénéficié d'un accompagnement (réhabilitation ou subvention),nb-logement-accompagnement,63,Puy-de-Dôme,665.0,2022-02-28,0.0,2019-12-31,665.0,,,,,logements
Redynamiser les cœurs de ville,Nombre de logements rénovés dans les villes moyennes (+ de 20 000 habitants),nb-logement-accompagnement,63,Puy-de-Dôme,665.0,2022-02-28,0.0,2019-12-31,665.0,,,,,logements rénovés
