mesure,indicateur,id_indicateur,code_departement,libelle_departement,valeur_actuelle,date_valeur_actuelle,valeur_initiale,date_valeur_initiale,progression,pourcentage_progression,cible,pourcentage_cible,date_cible,unite
Améliorer la qualité du service rendu à l’usager,Part des lieux d’accueil du public qui publient leurs résultats (national et local),tx-transparence-resultats,35,Ille-et-Vilaine,80.0,2019-12-31,6.0,2017-12-31,74.0,1233.0,100.0,79.0,2022-12-31,% de réseaux
Assurer une bonne couverture en internet fixe et en téléphonie mobile pour tous les Français d'ici 2022,Taux de déploiement de la fibre,taux-deploiement-fibre,35,Ille-et-Vilaine,56.0,2021-09-30,22.0,2017-12-31,34.0,155.0,,,,% de déploiement
Déployer une offre France services dans tous les territoires ,Nombre de labellisations (atteinte de l'objectif fixé),nb-labellisations-france-services,35,Ille-et-Vilaine,24.0,2022-03-31,7.0,2020-01-31,17.0,243.0,30.0,74.0,2022-12-31,labellisations
Redynamiser les cœurs de ville,Nombre de logements rénovés dans les petites villes (- de 20 000 habitants),nb-logements-renoves-petites-villes,35,Ille-et-Vilaine,297.0,2022-02-28,0.0,2020-09-30,297.0,,,,,logements rénovés
Redynamiser les cœurs de ville,Nombre de logements ayant bénéficié d'un accompagnement (réhabilitation ou subvention),nb-logement-accompagnement,35,Ille-et-Vilaine,1003.0,2022-02-28,0.0,2019-12-31,1003.0,,890.0,100.0,2022-12-31,logements
Redynamiser les cœurs de ville,Nombre de logements rénovés dans les villes moyennes (+ de 20 000 habitants),nb-logement-accompagnement,35,Ille-et-Vilaine,1003.0,2022-02-28,0.0,2019-12-31,1003.0,,890.0,100.0,2022-12-31,logements rénovés
