mesure,indicateur,id_indicateur,code_departement,libelle_departement,valeur_actuelle,date_valeur_actuelle,valeur_initiale,date_valeur_initiale,progression,pourcentage_progression,cible,pourcentage_cible,date_cible,unite
Améliorer la qualité du service rendu à l’usager,Part des lieux d’accueil du public qui publient leurs résultats (national et local),tx-transparence-resultats,86,Vienne,80.0,2019-12-31,6.0,2017-12-31,74.0,1233.0,100.0,79.0,2022-12-31,% de réseaux
Assurer une bonne couverture en internet fixe et en téléphonie mobile pour tous les Français d'ici 2022,Taux de déploiement de la fibre,taux-deploiement-fibre,86,Vienne,49.0,2021-09-30,16.0,2017-12-31,33.0,206.0,,,,% de déploiement
Déployer une offre France services dans tous les territoires ,Nombre de labellisations (atteinte de l'objectif fixé),nb-labellisations-france-services,86,Vienne,19.0,2022-03-31,1.0,2020-01-31,18.0,1800.0,25.0,75.0,2022-12-31,labellisations
Redynamiser les cœurs de ville,Nombre de logements rénovés dans les petites villes (- de 20 000 habitants),nb-logements-renoves-petites-villes,86,Vienne,133.0,2022-02-28,0.0,2020-09-30,133.0,,,,,logements rénovés
Redynamiser les cœurs de ville,Nombre de logements ayant bénéficié d'un accompagnement (réhabilitation ou subvention),nb-logement-accompagnement,86,Vienne,811.0,2022-02-28,0.0,2019-12-31,811.0,,,,,logements
Redynamiser les cœurs de ville,Nombre de logements rénovés dans les villes moyennes (+ de 20 000 habitants),nb-logement-accompagnement,86,Vienne,811.0,2022-02-28,0.0,2019-12-31,811.0,,,,,logements rénovés
