mesure,indicateur,id_indicateur,code_departement,libelle_departement,valeur_actuelle,date_valeur_actuelle,valeur_initiale,date_valeur_initiale,progression,pourcentage_progression,cible,pourcentage_cible,date_cible,unite
Améliorer la qualité du service rendu à l’usager,Part des lieux d’accueil du public qui publient leurs résultats (national et local),tx-transparence-resultats,15,Cantal,74.0,2019-12-31,7.0,2017-12-31,67.0,957.0,100.0,72.0,2022-12-31,% de réseaux
Assurer une bonne couverture en internet fixe et en téléphonie mobile pour tous les Français d'ici 2022,Taux de déploiement de la fibre,taux-deploiement-fibre,15,Cantal,53.0,2021-03-31,21.0,2017-12-31,32.0,152.0,,,,% de déploiement
Déployer une offre France Services dans tous les territoires ,Nombre de labellisations (atteinte de l'objectif fixé),nb-labellisations-france-services,15,Cantal,13.0,2021-07-31,0.0,2017-01-01,13.0,,21.0,62.0,2022-12-31,labellisations
Redynamiser les cœurs de ville,Nombre de logements rénovés dans les petites villes (- de 20 000 habitants),nb-logements-renoves-petites-villes,15,Cantal,170.0,2021-05-31,,,,,,,,logements rénovés
Redynamiser les cœurs de ville,Nombre de logements ayant bénéficié d'un accompagnement (réhabilitation ou subvention),nb-logement-accompagnement,15,Cantal,515.0,2021-05-31,0.0,,515.0,,,,,logements
Redynamiser les cœurs de ville,Nombre de logements rénovés dans les villes moyennes (+ de 20 000 habitants),nb-logement-accompagnement,15,Cantal,515.0,2021-05-31,0.0,,515.0,,,,,logements rénovés
