mesure,indicateur,id_indicateur,code_departement,libelle_departement,valeur_actuelle,date_valeur_actuelle,valeur_initiale,date_valeur_initiale,progression,pourcentage_progression,cible,pourcentage_cible,date_cible,unite
Améliorer la qualité du service rendu à l’usager,Part des lieux d’accueil du public qui publient leurs résultats (national et local),tx-transparence-resultats,78,Yvelines,78.0,2022-12-31,8.0,2017-12-31,70.0,875.0,100.0,76.0,2022-12-31,% de réseaux
Assurer une bonne couverture en internet fixe et en téléphonie mobile pour tous les Français d'ici 2022,Taux de déploiement de la fibre,taux-deploiement-fibre,78,Yvelines,95.0,2022-09-30,45.0,2017-12-31,50.0,111.0,,,,% de déploiement
Déployer une offre France services dans tous les territoires ,Nombre de labellisations (atteinte de l'objectif fixé),nb-labellisations-france-services,78,Yvelines,21.0,2022-12-31,3.0,2020-01-31,18.0,600.0,20.0,100.0,2022-12-31,labellisations
Redynamiser les cœurs de ville,Nombre de logements rénovés dans les petites villes (- de 20 000 habitants),nb-logements-renoves-petites-villes,78,Yvelines,100.0,2022-06-30,0.0,2020-09-30,100.0,,,,,logements rénovés
Redynamiser les cœurs de ville,Nombre de logements ayant bénéficié d'un accompagnement (réhabilitation ou subvention),nb-logement-accompagnement,78,Yvelines,2754.0,2022-09-30,0.0,2019-12-31,2754.0,,,,,logements
Redynamiser les cœurs de ville,Nombre de logements rénovés dans les villes moyennes (+ de 20 000 habitants),nb-logement-accompagnement,78,Yvelines,2754.0,2022-09-30,0.0,2019-12-31,2754.0,,,,,logements rénovés
