mesure,indicateur,id_indicateur,code_departement,libelle_departement,valeur_actuelle,date_valeur_actuelle,valeur_initiale,date_valeur_initiale,progression,pourcentage_progression,cible,pourcentage_cible,date_cible,unite
Améliorer la qualité du service rendu à l’usager,Part des lieux d’accueil du public qui publient leurs résultats (national et local),tx-transparence-resultats,60,Oise,75.0,2019-12-31,9.0,2017-12-31,66.0,733.0,100.0,73.0,2022-12-31,% de réseaux
Assurer une bonne couverture en internet fixe et en téléphonie mobile pour tous les Français d'ici 2022,Taux de déploiement de la fibre,taux-deploiement-fibre,60,Oise,96.0,2021-09-30,46.0,2017-12-31,50.0,109.0,95.0,100.0,2022-12-31,% de déploiement
Déployer une offre France Services dans tous les territoires ,Nombre de labellisations (atteinte de l'objectif fixé),nb-labellisations-france-services,60,Oise,15.0,2021-12-31,0.0,2017-01-01,15.0,,31.0,48.0,2022-12-31,labellisations
Redynamiser les cœurs de ville,Nombre de logements rénovés dans les petites villes (- de 20 000 habitants),nb-logements-renoves-petites-villes,60,Oise,52.0,2021-11-30,,,,,,,,logements rénovés depuis octobre 2020
Redynamiser les cœurs de ville,Nombre de logements ayant bénéficié d'un accompagnement (réhabilitation ou subvention),nb-logement-accompagnement,60,Oise,996.0,2021-09-30,0.0,,996.0,,1404.0,71.0,2022-12-31,logements
Redynamiser les cœurs de ville,Nombre de logements rénovés dans les villes moyennes (+ de 20 000 habitants),nb-logement-accompagnement,60,Oise,996.0,2021-09-30,0.0,,996.0,,1404.0,71.0,2022-12-31,logements rénovés
