mesure,indicateur,id_indicateur,code_departement,libelle_departement,valeur_actuelle,date_valeur_actuelle,valeur_initiale,date_valeur_initiale,progression,pourcentage_progression,cible,pourcentage_cible,date_cible,unite
Améliorer la qualité du service rendu à l’usager,Part des lieux d’accueil du public qui publient leurs résultats (national et local),tx-transparence-resultats,94,Val-de-Marne,79.0,2019-12-31,7.0,2017-12-31,72.0,1029.0,100.0,77.0,2022-12-31,% de réseaux
Assurer une bonne couverture en internet fixe et en téléphonie mobile pour tous les Français d'ici 2022,Taux de déploiement de la fibre,taux-deploiement-fibre,94,Val-de-Marne,87.0,2021-03-31,51.0,2017-12-31,36.0,71.0,,,,% de déploiement
Déployer une offre France Services dans tous les territoires ,Nombre de labellisations (atteinte de l'objectif fixé),nb-labellisations-france-services,94,Val-de-Marne,10.0,2021-07-31,0.0,2017-01-01,10.0,,14.0,71.0,2022-12-31,labellisations
Redynamiser les cœurs de ville,Nombre de logements ayant bénéficié d'un accompagnement (réhabilitation ou subvention),nb-logement-accompagnement,94,Val-de-Marne,0.0,2021-02-28,0.0,,0.0,,,,,logements
Redynamiser les cœurs de ville,Nombre de logements rénovés dans les villes moyennes (+ de 20 000 habitants),nb-logement-accompagnement,94,Val-de-Marne,0.0,2021-02-28,0.0,,0.0,,,,,logements rénovés
