mesure,indicateur,id_indicateur,code_departement,libelle_departement,valeur_actuelle,date_valeur_actuelle,valeur_initiale,date_valeur_initiale,progression,pourcentage_progression,cible,pourcentage_cible,date_cible,unite
Améliorer la qualité du service rendu à l’usager,Part des lieux d’accueil du public qui publient leurs résultats (national et local),tx-transparence-resultats,50,Manche,77.0,2019-12-31,6.0,2017-12-31,71.0,1183.0,100.0,76.0,2022-12-31,% de réseaux
Assurer une bonne couverture en internet fixe et en téléphonie mobile pour tous les Français d'ici 2022,Taux de déploiement de la fibre,taux-deploiement-fibre,50,Manche,39.0,2021-09-30,12.0,2017-12-31,27.0,225.0,55.0,63.0,2022-12-31,% de déploiement
Déployer une offre France Services dans tous les territoires ,Nombre de labellisations (atteinte de l'objectif fixé),nb-labellisations-france-services,50,Manche,22.0,2022-03-31,8.0,2020-01-31,14.0,175.0,30.0,64.0,2022-12-31,labellisations
Redynamiser les cœurs de ville,Nombre de logements rénovés dans les petites villes (- de 20 000 habitants),nb-logements-renoves-petites-villes,50,Manche,464.0,2021-11-30,0.0,2020-09-30,464.0,,,,,logements rénovés
Redynamiser les cœurs de ville,Nombre de logements ayant bénéficié d'un accompagnement (réhabilitation ou subvention),nb-logement-accompagnement,50,Manche,860.0,2021-12-31,0.0,2019-12-31,860.0,,948.0,91.0,2022-12-31,logements
Redynamiser les cœurs de ville,Nombre de logements rénovés dans les villes moyennes (+ de 20 000 habitants),nb-logement-accompagnement,50,Manche,860.0,2021-12-31,0.0,2019-12-31,860.0,,948.0,91.0,2022-12-31,logements rénovés
