mesure,indicateur,id_indicateur,code_departement,libelle_departement,valeur_actuelle,date_valeur_actuelle,valeur_initiale,date_valeur_initiale,progression,pourcentage_progression,cible,pourcentage_cible,date_cible,unite
Améliorer la qualité du service rendu à l’usager,Part des lieux d’accueil du public qui publient leurs résultats (national et local),tx-transparence-resultats,60,Oise,75.0,2019-12-31,9.0,2017-12-31,66.0,733.0,100.0,73.0,2022-12-31,% de réseaux
Assurer une bonne couverture en internet fixe et en téléphonie mobile pour tous les Français d'ici 2022,Taux de déploiement de la fibre,taux-deploiement-fibre,60,Oise,96.0,2021-09-30,46.0,2017-12-31,50.0,109.0,,,,% de déploiement
Déployer une offre France services dans tous les territoires ,Nombre de labellisations (atteinte de l'objectif fixé),nb-labellisations-france-services,60,Oise,25.0,2022-03-31,6.0,2020-01-31,19.0,317.0,31.0,76.0,2022-12-31,labellisations
Redynamiser les cœurs de ville,Nombre de logements rénovés dans les petites villes (- de 20 000 habitants),nb-logements-renoves-petites-villes,60,Oise,98.0,2022-02-28,0.0,2020-09-30,98.0,,,,,logements rénovés
Redynamiser les cœurs de ville,Nombre de logements ayant bénéficié d'un accompagnement (réhabilitation ou subvention),nb-logement-accompagnement,60,Oise,1236.0,2022-02-28,0.0,2019-12-31,1236.0,,1404.0,88.0,2022-12-31,logements
Redynamiser les cœurs de ville,Nombre de logements rénovés dans les villes moyennes (+ de 20 000 habitants),nb-logement-accompagnement,60,Oise,1236.0,2022-02-28,0.0,2019-12-31,1236.0,,1404.0,88.0,2022-12-31,logements rénovés
