mesure,indicateur,id_indicateur,code_region,libelle_region,valeur_actuelle,date_valeur_actuelle,valeur_initiale,date_valeur_initiale,progression,pourcentage_progression,cible,pourcentage_cible,date_cible,unite
Aide de France Relance aux entreprises,Nombre d'entreprises industrielles et organismes agricoles bénéficiaires des aides à l'investissement de France Relance,nb-entreprises-industrielles-agricoles,44,Grand Est,192.0,2021-06-30,0.0,,192.0,,,,,entreprises industrielles et agricoles
Numérisation des petites et moyennes entreprises,Nombre d'entreprises ayant bénéficié d'un chèque numérique de 500€,nb-entreprises-cheaque-numerique,44,Grand Est,4348.0,2021-06-30,324.0,2021-02-28,4024.0,1242.0,7028.0,60.0,2022-12-31,entreprises
Numérisation des petites et moyennes entreprises,Nombre d'entreprises ayant disposé d'un diagnostic numérique et d'un plan d'action individualisé,nb-diagnostics-individualises,44,Grand Est,1354.0,2021-06-30,326.0,2021-01-31,1028.0,315.0,2196.0,55.0,2022-12-31,entreprises
Développer l’apprentissage,Nombre de contrats d’apprentissage,nombre-contrats-apprentissage,44,Grand Est,39096.0,2020-12-31,25587.0,2017-12-31,13509.0,53.0,38983.0,100.0,2022-12-31,contrats
Plan 1 jeune 1 solution,Nombre de recrutements de jeunes,nombre-recrutements-jeunes,44,Grand Est,114266.0,2021-04-30,115325.0,2019-04-30,-1059.0,-1.0,,,,Recrutements de jeunes
Pacte d'ambition pour l'insertion par l'activité économique,Nombre de bénéficiaires en structures d'insertion par l'activité économique,nb-beneficiaires-siae,44,Grand Est,15550.0,2021-03-31,14334.0,2017-01-31,1216.0,8.0,24937.0,11.0,2022-12-31,bénéficiaires *
Supprimer la taxe d’habitation sur les résidences principales,Nombre de bénéficiaires totalement exonérés,nb-beneficiaires-suppression-taxe-habitation,44,Grand Est,1926559.0,2020-12-31,0.0,2017-01-01,1926559.0,,2485617.0,78.0,2023-12-31,bénéficiaires
Renforcer les compétences de la nation - plan d'investissement dans les compétences,"Nombre d’entrées en formation pour les publics éloignés de l’emploi (jeunes, demandeurs d’emploi faiblement qualifiés, actifs en insertion, …)",nb-formation-pic,44,Grand Est,91700.0,2020-12-31,69800.0,2017-12-31,21900.0,31.0,101900.0,68.0,2022-12-31,formations
Garantir l'égalité professionnelle entre les femmes et les hommes,Part des entreprises respectant leur obligation de publier l’index égalité professionnelle,tx-entreprise-egalite-pro,44,Grand Est,81.0,2021-06-30,52.0,2019-03-31,29.0,56.0,90.0,76.0,2022-12-31,%
