mesure,indicateur,id_indicateur,code_region,libelle_region,valeur_actuelle,date_valeur_actuelle,valeur_initiale,date_valeur_initiale,progression,pourcentage_progression,cible,pourcentage_cible,date_cible,unite
Aide de France Relance aux entreprises,Nombre d'entreprises industrielles et organismes agricoles bénéficiaires des aides à l'investissement de France Relance,nb-entreprises-industrielles-agricoles,11,Île-de-France,18.0,2021-06-30,0.0,,18.0,,,,,entreprises industrielles et agricoles
Numérisation des petites et moyennes entreprises,Nombre d'entreprises ayant bénéficié d'un chèque numérique de 500€,nb-entreprises-cheaque-numerique,11,Île-de-France,10885.0,2021-06-30,706.0,2021-02-28,10179.0,1442.0,29499.0,35.0,2022-12-31,entreprises
Numérisation des petites et moyennes entreprises,Nombre d'entreprises ayant disposé d'un diagnostic numérique et d'un plan d'action individualisé,nb-diagnostics-individualises,11,Île-de-France,2583.0,2021-06-30,688.0,2021-01-31,1895.0,275.0,5649.0,38.0,2022-12-31,entreprises
Développer l’apprentissage,Nombre de contrats d’apprentissage,nombre-contrats-apprentissage,11,Île-de-France,113064.0,2020-12-31,64155.0,2017-12-31,48909.0,76.0,113790.0,99.0,2022-12-31,contrats
Plan 1 jeune 1 solution,Nombre de recrutements de jeunes,nombre-recrutements-jeunes,11,Île-de-France,403479.0,2021-04-30,468955.0,2019-04-30,-65476.0,-14.0,,,,Recrutements de jeunes
Pacte d'ambition pour l'insertion par l'activité économique,Nombre de bénéficiaires en structures d'insertion par l'activité économique,nb-beneficiaires-siae,11,Île-de-France,15447.0,2021-03-31,13229.0,2017-01-31,2218.0,17.0,29594.0,14.0,2022-12-31,bénéficiaires *
Supprimer la taxe d’habitation sur les résidences principales,Nombre de bénéficiaires totalement exonérés,nb-beneficiaires-suppression-taxe-habitation,11,Île-de-France,3300887.0,2020-12-31,0.0,2017-01-01,3300887.0,,5233253.0,63.0,2023-12-31,bénéficiaires
Renforcer les compétences de la nation - plan d'investissement dans les compétences,"Nombre d’entrées en formation pour les publics éloignés de l’emploi (jeunes, demandeurs d’emploi faiblement qualifiés, actifs en insertion, …)",nb-formation-pic,11,Île-de-France,186300.0,2020-12-31,98000.0,2017-12-31,88300.0,90.0,221600.0,71.0,2022-12-31,formations
Garantir l'égalité professionnelle entre les femmes et les hommes,Part des entreprises respectant leur obligation de publier l’index égalité professionnelle,tx-entreprise-egalite-pro,11,Île-de-France,57.0,2021-06-30,43.0,2019-03-31,14.0,33.0,90.0,30.0,2022-12-31,%
