mesure,indicateur,id_indicateur,code_region,libelle_region,valeur_actuelle,date_valeur_actuelle,valeur_initiale,date_valeur_initiale,progression,pourcentage_progression,cible,pourcentage_cible,date_cible,unite
Aide de France Relance aux entreprises,Nombre d'entreprises industrielles et organismes agricoles bénéficiaires des aides à l'investissement de France Relance,nb-entreprises-industrielles-agricoles,94,Corse,8.0,2021-03-31,0.0,,8.0,,,,,entreprises industrielles et agricoles
Numérisation des petites et moyennes entreprises,Nombre d'entreprises ayant bénéficié d'un chèque numérique de 500€,nb-entreprises-cheaque-numerique,94,Corse,296.0,2021-04-30,61.0,2021-02-28,235.0,385.0,910.0,28.0,2022-12-31,entreprises
Numérisation des petites et moyennes entreprises,Nombre d'entreprises ayant disposé d'un diagnostic numérique et un plan d'action individualisé,nb-diagnostics-individualises,94,Corse,111.0,2021-04-30,33.0,2021-01-31,78.0,236.0,243.0,37.0,2022-12-31,entreprises
Développer l’apprentissage,Nombre de contrats d’apprentissage,nombre-contrats-apprentissage,94,Corse,0.0,2020-12-31,1440.0,2017-12-31,-1440.0,-100.0,,,,contrats
Plan 1 jeune 1 solution,Nombre de recrutements de jeunes,nombre-recrutements-jeunes,94,Corse,4700.0,2021-02-28,4361.0,2019-02-28,339.0,8.0,,,,Recrutements de jeunes
Pacte d'ambition pour l'insertion par l'activité économique,Nombre de bénéficiaires en structures d'insertion par l'activité économique,nb-beneficiaires-siae,94,Corse,456.0,2020-12-31,392.0,2017-01-31,64.0,16.0,,,,bénéficiaires
Supprimer la taxe d’habitation sur les résidences principales,Nombre de bénéficiaires totalement exonérés,nb-beneficiaires-suppression-taxe-habitation,94,Corse,103384.0,2020-12-31,0.0,2017-01-01,103384.0,,134528.0,77.0,2023-12-31,bénéficiaires
