mesure,indicateur,id_indicateur,code_region,libelle_region,valeur_actuelle,date_valeur_actuelle,valeur_initiale,date_valeur_initiale,progression,pourcentage_progression,cible,pourcentage_cible,date_cible,unite
Aide de France Relance aux entreprises,Nombre d’entreprises industrielles (dont PME) bénéficiaires des aides à l'investissement de France Relance,nb-entreprises-industrielles-agricoles,28,Normandie,613.0,2021-11-30,0.0,2020-10-31,613.0,,,,,entreprises industrielles
Numérisation des petites et moyennes entreprises,Nombre d'entreprises ayant bénéficié d'un chèque numérique de 500€,nb-entreprises-cheaque-numerique,28,Normandie,3540.0,2021-12-31,0.0,2020-09-30,3540.0,,4054.0,87.0,2022-12-31,entreprises
Numérisation des petites et moyennes entreprises,Nombre d'entreprises ayant disposé d'un diagnostic numérique et d'un plan d'action individualisé,nb-diagnostics-individualises,28,Normandie,1294.0,2021-12-31,0.0,2020-09-30,1294.0,,1440.0,90.0,2022-12-31,entreprises
Développer l’apprentissage,Nombre de contrats d’apprentissage,nombre-contrats-apprentissage,28,Normandie,29560.0,2021-09-30,16259.0,2017-12-31,13301.0,82.0,26462.0,100.0,2022-12-31,contrats
Plan 1 jeune 1 solution,Nombre de recrutements de jeunes,nombre-recrutements-jeunes,28,Normandie,91635.0,2021-07-31,87144.0,2019-07-31,4491.0,5.0,,,,Recrutements de jeunes
Pacte d'ambition pour l'insertion par l'activité économique,Nombre de bénéficiaires en structures d'insertion par l'activité économique,nb-beneficiaires-siae,28,Normandie,9662.0,2021-09-30,8173.0,2017-01-31,1489.0,18.0,14604.0,23.0,2022-12-31,bénéficiaires *
Supprimer la taxe d’habitation sur les résidences principales,Nombre de bénéficiaires totalement exonérés,nb-beneficiaires-suppression-taxe-habitation,28,Normandie,1211967.0,2021-12-31,0.0,2017-12-31,1211967.0,,1497322.0,81.0,2023-12-31,bénéficiaires
Renforcer les compétences de la nation - plan d'investissement dans les compétences,"Nombre d’entrées en formation pour les publics éloignés de l’emploi (jeunes, demandeurs d’emploi faiblement qualifiés, actifs en insertion, …)",nb-formation-pic,28,Normandie,73839.0,2021-12-31,43300.0,2017-12-31,30539.0,71.0,68100.0,100.0,2022-12-31,formations
Garantir l'égalité professionnelle entre les femmes et les hommes,Part des entreprises respectant leur obligation de publier l’index égalité professionnelle,tx-entreprise-egalite-pro,28,Normandie,74.0,2021-12-31,36.0,2019-03-31,38.0,106.0,90.0,70.0,2022-12-31,%
