mesure,indicateur,id_indicateur,code_region,libelle_region,valeur_actuelle,date_valeur_actuelle,valeur_initiale,date_valeur_initiale,progression,pourcentage_progression,cible,pourcentage_cible,date_cible,unite
Aide de France Relance aux entreprises,Nombre d'entreprises industrielles et organismes agricoles bénéficiaires des aides à l'investissement de France Relance,nb-entreprises-industrielles-agricoles,01,Guadeloupe,4.0,2021-03-31,0.0,,4.0,,,,,entreprises industrielles et agricoles
Numérisation des petites et moyennes entreprises,Nombre d'entreprises ayant bénéficié d'un chèque numérique de 500€,nb-entreprises-cheaque-numerique,01,Guadeloupe,3.0,2021-04-30,0.0,2021-02-28,3.0,,46.0,7.0,2022-12-31,entreprises
Numérisation des petites et moyennes entreprises,Nombre d'entreprises ayant disposé d'un diagnostic numérique et un plan d'action individualisé,nb-diagnostics-individualises,01,Guadeloupe,66.0,2021-04-30,28.0,2021-01-31,38.0,136.0,255.0,17.0,2022-12-31,entreprises
Développer l’apprentissage,Nombre de contrats d’apprentissage,nombre-contrats-apprentissage,01,Guadeloupe,1330.0,2020-12-31,950.0,2017-12-31,380.0,40.0,,,,contrats
Plan 1 jeune 1 solution,Nombre de recrutements de jeunes,nombre-recrutements-jeunes,01,Guadeloupe,4542.0,2021-02-28,4305.0,2019-02-28,237.0,6.0,,,,Recrutements de jeunes
Pacte d'ambition pour l'insertion par l'activité économique,Nombre de bénéficiaires en structures d'insertion par l'activité économique,nb-beneficiaires-siae,01,Guadeloupe,498.0,2020-12-31,638.0,2017-01-31,-140.0,-22.0,,,,bénéficiaires
Supprimer la taxe d’habitation sur les résidences principales,Nombre de bénéficiaires totalement exonérés,nb-beneficiaires-suppression-taxe-habitation,01,Guadeloupe,121583.0,2020-12-31,0.0,2017-01-01,121583.0,,151745.0,80.0,2023-12-31,bénéficiaires
