mesure,indicateur,id_indicateur,code_region,libelle_region,valeur_actuelle,date_valeur_actuelle,valeur_initiale,date_valeur_initiale,progression,pourcentage_progression,cible,pourcentage_cible,date_cible,unite
Aide de France Relance aux entreprises,Nombre d’entreprises industrielles (dont PME) bénéficiaires des aides à l'investissement de France Relance,nb-entreprises-industrielles-agricoles,01,Guadeloupe,13.0,2022-12-31,0.0,2020-10-31,13.0,,,,,entreprises industrielles
Numérisation des petites et moyennes entreprises,Nombre d'entreprises ayant bénéficié d'un chèque numérique de 500€,nb-entreprises-cheaque-numerique,01,Guadeloupe,530.0,2022-11-30,0.0,2020-09-30,530.0,,46.0,100.0,2022-12-31,entreprises
Numérisation des petites et moyennes entreprises,Nombre d'entreprises ayant disposé d'un diagnostic numérique et d'un plan d'action individualisé,nb-diagnostics-individualises,01,Guadeloupe,210.0,2022-11-30,0.0,2020-09-30,210.0,,255.0,82.0,2022-12-31,entreprises
Développer l’apprentissage,Nombre de contrats d’apprentissage,nombre-contrats-apprentissage,01,Guadeloupe,3116.0,2022-10-31,834.0,2017-12-31,2282.0,274.0,1446.0,100.0,2022-12-31,contrats
Plan 1 jeune 1 solution,Nombre de recrutements de jeunes,nombre-recrutements-jeunes,01,Guadeloupe,7526.0,2022-07-31,6347.0,2019-07-31,1179.0,19.0,,,,Recrutements depuis le mois d'août précédent
Pacte d'ambition pour l'insertion par l'activité économique,Nombre de bénéficiaires en structures d'insertion par l'activité économique,nb-beneficiaires-siae,01,Guadeloupe,676.0,2022-09-30,638.0,2017-01-31,38.0,6.0,1726.0,3.0,2022-12-31,bénéficiaires *
Supprimer la taxe d’habitation sur les résidences principales,Nombre de bénéficiaires totalement exonérés,nb-beneficiaires-suppression-taxe-habitation,01,Guadeloupe,121868.0,2022-12-31,0.0,2017-12-31,121868.0,,151710.0,80.0,2023-12-31,bénéficiaires
Renforcer les compétences de la nation - plan d'investissement dans les compétences,"Nombre d’entrées en formation pour les publics éloignés de l’emploi (jeunes, demandeurs d’emploi faiblement qualifiés, actifs en insertion, …)",nb-formation-pic,01,Guadeloupe,11743.0,2022-12-31,5800.0,2017-12-31,5943.0,102.0,9100.0,100.0,2022-12-31,formations
Garantir l'égalité professionnelle entre les femmes et les hommes,Part des entreprises respectant leur obligation de publier l’index égalité professionnelle,tx-entreprise-egalite-pro,01,Guadeloupe,50.0,2022-12-31,100.0,2019-03-31,-50.0,-50.0,90.0,0.0,2022-12-31,%
