mesure,indicateur,id_indicateur,code_region,libelle_region,valeur_actuelle,date_valeur_actuelle,valeur_initiale,date_valeur_initiale,progression,pourcentage_progression,cible,pourcentage_cible,date_cible,unite
Aide de France Relance aux entreprises,Nombre d’entreprises industrielles (dont PME) bénéficiaires des aides à l'investissement de France Relance,nb-entreprises-industrielles-agricoles,44,Grand Est,684.0,2022-12-31,0.0,2020-10-31,684.0,,,,,entreprises industrielles
Numérisation des petites et moyennes entreprises,Nombre d'entreprises ayant bénéficié d'un chèque numérique de 500€,nb-entreprises-cheaque-numerique,44,Grand Est,7546.0,2022-11-30,0.0,2020-09-30,7546.0,,7028.0,100.0,2022-12-31,entreprises
Numérisation des petites et moyennes entreprises,Nombre d'entreprises ayant disposé d'un diagnostic numérique et d'un plan d'action individualisé,nb-diagnostics-individualises,44,Grand Est,2756.0,2022-11-30,0.0,2020-09-30,2756.0,,2196.0,100.0,2022-12-31,entreprises
Développer l’apprentissage,Nombre de contrats d’apprentissage,nombre-contrats-apprentissage,44,Grand Est,58932.0,2022-10-31,25587.0,2017-12-31,33345.0,130.0,38983.0,100.0,2022-12-31,contrats
Plan 1 jeune 1 solution,Nombre de recrutements de jeunes,nombre-recrutements-jeunes,44,Grand Est,185894.0,2022-07-31,146014.0,2019-07-31,39880.0,27.0,,,,Recrutements depuis le mois d'août précédent
Pacte d'ambition pour l'insertion par l'activité économique,Nombre de bénéficiaires en structures d'insertion par l'activité économique,nb-beneficiaires-siae,44,Grand Est,16044.0,2022-09-30,14335.0,2017-01-31,1709.0,12.0,24937.0,16.0,2022-12-31,bénéficiaires *
Supprimer la taxe d’habitation sur les résidences principales,Nombre de bénéficiaires totalement exonérés,nb-beneficiaires-suppression-taxe-habitation,44,Grand Est,1925171.0,2022-12-31,0.0,2017-12-31,1925171.0,,2501969.0,77.0,2023-12-31,bénéficiaires
Renforcer les compétences de la nation - plan d'investissement dans les compétences,"Nombre d’entrées en formation pour les publics éloignés de l’emploi (jeunes, demandeurs d’emploi faiblement qualifiés, actifs en insertion, …)",nb-formation-pic,44,Grand Est,110652.0,2022-12-31,69800.0,2017-12-31,40852.0,59.0,105100.0,100.0,2022-12-31,formations
Garantir l'égalité professionnelle entre les femmes et les hommes,Part des entreprises respectant leur obligation de publier l’index égalité professionnelle,tx-entreprise-egalite-pro,44,Grand Est,85.0,2022-12-31,52.0,2019-03-31,33.0,63.0,90.0,87.0,2022-12-31,%
