mesure,indicateur,id_indicateur,code_region,libelle_region,valeur_actuelle,date_valeur_actuelle,valeur_initiale,date_valeur_initiale,progression,pourcentage_progression,cible,pourcentage_cible,date_cible,unite
Aide de France Relance aux entreprises,Nombre d’entreprises industrielles (dont PME) bénéficiaires des aides à l'investissement de France Relance,nb-entreprises-industrielles-agricoles,76,Occitanie,591.0,2022-12-31,0.0,2020-10-31,591.0,,,,,entreprises industrielles
Numérisation des petites et moyennes entreprises,Nombre d'entreprises ayant bénéficié d'un chèque numérique de 500€,nb-entreprises-cheaque-numerique,76,Occitanie,14216.0,2022-11-30,0.0,2020-09-30,14216.0,,10338.0,100.0,2022-12-31,entreprises
Numérisation des petites et moyennes entreprises,Nombre d'entreprises ayant disposé d'un diagnostic numérique et d'un plan d'action individualisé,nb-diagnostics-individualises,76,Occitanie,3534.0,2022-11-30,0.0,2020-09-30,3534.0,,2853.0,100.0,2022-12-31,entreprises
Développer l’apprentissage,Nombre de contrats d’apprentissage,nombre-contrats-apprentissage,76,Occitanie,74029.0,2022-10-31,24420.0,2017-12-31,49609.0,203.0,44563.0,100.0,2022-12-31,contrats
Plan 1 jeune 1 solution,Nombre de recrutements de jeunes,nombre-recrutements-jeunes,76,Occitanie,231466.0,2022-07-31,174116.0,2019-07-31,57350.0,33.0,,,,Recrutements depuis le mois d'août précédent
Pacte d'ambition pour l'insertion par l'activité économique,Nombre de bénéficiaires en structures d'insertion par l'activité économique,nb-beneficiaires-siae,76,Occitanie,9377.0,2022-09-30,8368.0,2017-01-31,1009.0,12.0,14912.0,15.0,2022-12-31,bénéficiaires *
Supprimer la taxe d’habitation sur les résidences principales,Nombre de bénéficiaires totalement exonérés,nb-beneficiaires-suppression-taxe-habitation,76,Occitanie,2233271.0,2022-12-31,0.0,2017-12-31,2233271.0,,2808419.0,80.0,2023-12-31,bénéficiaires
Renforcer les compétences de la nation - plan d'investissement dans les compétences,"Nombre d’entrées en formation pour les publics éloignés de l’emploi (jeunes, demandeurs d’emploi faiblement qualifiés, actifs en insertion, …)",nb-formation-pic,76,Occitanie,139848.0,2022-12-31,92300.0,2017-12-31,47548.0,52.0,125700.0,100.0,2022-12-31,formations
Garantir l'égalité professionnelle entre les femmes et les hommes,Part des entreprises respectant leur obligation de publier l’index égalité professionnelle,tx-entreprise-egalite-pro,76,Occitanie,80.0,2022-12-31,40.0,2019-03-31,40.0,100.0,90.0,80.0,2022-12-31,%
