mesure,indicateur,id_indicateur,code_region,libelle_region,valeur_actuelle,date_valeur_actuelle,valeur_initiale,date_valeur_initiale,progression,pourcentage_progression,cible,pourcentage_cible,date_cible,unite
Aide de France Relance aux entreprises,Nombre d’entreprises industrielles (dont PME) bénéficiaires des aides à l'investissement de France Relance,nb-entreprises-industrielles-agricoles,28,Normandie,571.0,2022-12-31,0.0,2020-10-31,571.0,,,,,entreprises industrielles
Numérisation des petites et moyennes entreprises,Nombre d'entreprises ayant bénéficié d'un chèque numérique de 500€,nb-entreprises-cheaque-numerique,28,Normandie,3530.0,2022-11-30,0.0,2020-09-30,3530.0,,4054.0,87.0,2022-12-31,entreprises
Numérisation des petites et moyennes entreprises,Nombre d'entreprises ayant disposé d'un diagnostic numérique et d'un plan d'action individualisé,nb-diagnostics-individualises,28,Normandie,1658.0,2022-11-30,0.0,2020-09-30,1658.0,,1440.0,100.0,2022-12-31,entreprises
Développer l’apprentissage,Nombre de contrats d’apprentissage,nombre-contrats-apprentissage,28,Normandie,38460.0,2022-10-31,16259.0,2017-12-31,22201.0,137.0,26462.0,100.0,2022-12-31,contrats
Plan 1 jeune 1 solution,Nombre de recrutements de jeunes,nombre-recrutements-jeunes,28,Normandie,109877.0,2022-07-31,87174.0,2019-07-31,22703.0,26.0,,,,Recrutements depuis le mois d'août précédent
Pacte d'ambition pour l'insertion par l'activité économique,Nombre de bénéficiaires en structures d'insertion par l'activité économique,nb-beneficiaires-siae,28,Normandie,9195.0,2022-09-30,8170.0,2017-01-31,1025.0,13.0,14604.0,16.0,2022-12-31,bénéficiaires *
Supprimer la taxe d’habitation sur les résidences principales,Nombre de bénéficiaires totalement exonérés,nb-beneficiaires-suppression-taxe-habitation,28,Normandie,1216739.0,2022-12-31,0.0,2017-12-31,1216739.0,,1508976.0,81.0,2023-12-31,bénéficiaires
Renforcer les compétences de la nation - plan d'investissement dans les compétences,"Nombre d’entrées en formation pour les publics éloignés de l’emploi (jeunes, demandeurs d’emploi faiblement qualifiés, actifs en insertion, …)",nb-formation-pic,28,Normandie,76155.0,2022-12-31,43300.0,2017-12-31,32855.0,76.0,65300.0,100.0,2022-12-31,formations
Garantir l'égalité professionnelle entre les femmes et les hommes,Part des entreprises respectant leur obligation de publier l’index égalité professionnelle,tx-entreprise-egalite-pro,28,Normandie,84.0,2022-12-31,36.0,2019-03-31,48.0,133.0,90.0,89.0,2022-12-31,%
