mesure,indicateur,id_indicateur,code_region,libelle_region,valeur_actuelle,date_valeur_actuelle,valeur_initiale,date_valeur_initiale,progression,pourcentage_progression,cible,pourcentage_cible,date_cible,unite
Aide de France Relance aux entreprises,Nombre d'entreprises industrielles et organismes agricoles bénéficiaires des aides à l'investissement de France Relance,nb-entreprises-industrielles-agricoles,53,Bretagne,243.0,2021-06-30,0.0,,243.0,,,,,entreprises industrielles et agricoles
Numérisation des petites et moyennes entreprises,Nombre d'entreprises ayant bénéficié d'un chèque numérique de 500€,nb-entreprises-cheaque-numerique,53,Bretagne,3896.0,2021-06-30,287.0,2021-02-28,3609.0,1257.0,4294.0,90.0,2022-12-31,entreprises
Numérisation des petites et moyennes entreprises,Nombre d'entreprises ayant disposé d'un diagnostic numérique et d'un plan d'action individualisé,nb-diagnostics-individualises,53,Bretagne,700.0,2021-06-30,212.0,2021-01-31,488.0,230.0,1344.0,43.0,2022-12-31,entreprises
Développer l’apprentissage,Nombre de contrats d’apprentissage,nombre-contrats-apprentissage,53,Bretagne,26428.0,2020-12-31,14196.0,2017-12-31,12232.0,86.0,26065.0,100.0,2022-12-31,contrats
Plan 1 jeune 1 solution,Nombre de recrutements de jeunes,nombre-recrutements-jeunes,53,Bretagne,77940.0,2021-04-30,74336.0,2019-04-30,3604.0,5.0,,,,Recrutements de jeunes
Pacte d'ambition pour l'insertion par l'activité économique,Nombre de bénéficiaires en structures d'insertion par l'activité économique,nb-beneficiaires-siae,53,Bretagne,5724.0,2021-03-31,5389.0,2017-01-31,335.0,6.0,8797.0,10.0,2022-12-31,bénéficiaires *
Supprimer la taxe d’habitation sur les résidences principales,Nombre de bénéficiaires totalement exonérés,nb-beneficiaires-suppression-taxe-habitation,53,Bretagne,1249460.0,2020-12-31,0.0,2017-01-01,1249460.0,,1561406.0,80.0,2023-12-31,bénéficiaires
Renforcer les compétences de la nation - plan d'investissement dans les compétences,"Nombre d’entrées en formation pour les publics éloignés de l’emploi (jeunes, demandeurs d’emploi faiblement qualifiés, actifs en insertion, …)",nb-formation-pic,53,Bretagne,68000.0,2020-12-31,47100.0,2017-12-31,20900.0,44.0,50200.0,100.0,2022-12-31,formations
Garantir l'égalité professionnelle entre les femmes et les hommes,Part des entreprises respectant leur obligation de publier l’index égalité professionnelle,tx-entreprise-egalite-pro,53,Bretagne,59.0,2021-06-30,51.0,2019-03-31,8.0,16.0,90.0,21.0,2022-12-31,%
