mesure,indicateur,id_indicateur,code_region,libelle_region,valeur_actuelle,date_valeur_actuelle,valeur_initiale,date_valeur_initiale,progression,pourcentage_progression,cible,pourcentage_cible,date_cible,unite
Aide de France Relance aux entreprises,Nombre d’entreprises industrielles (dont PME) bénéficiaires des aides à l'investissement de France Relance,nb-entreprises-industrielles-agricoles,11,Île-de-France,889.0,2021-11-30,0.0,2020-10-31,889.0,,,,,entreprises industrielles
Numérisation des petites et moyennes entreprises,Nombre d'entreprises ayant bénéficié d'un chèque numérique de 500€,nb-entreprises-cheaque-numerique,11,Île-de-France,20694.0,2021-12-31,0.0,2020-09-30,20694.0,,29499.0,70.0,2022-12-31,entreprises
Numérisation des petites et moyennes entreprises,Nombre d'entreprises ayant disposé d'un diagnostic numérique et d'un plan d'action individualisé,nb-diagnostics-individualises,11,Île-de-France,4799.0,2021-12-31,0.0,2020-09-30,4799.0,,5649.0,85.0,2022-12-31,entreprises
Développer l’apprentissage,Nombre de contrats d’apprentissage,nombre-contrats-apprentissage,11,Île-de-France,121709.0,2021-09-30,64155.0,2017-12-31,57554.0,90.0,113790.0,100.0,2022-12-31,contrats
Plan 1 jeune 1 solution,Nombre de recrutements de jeunes,nombre-recrutements-jeunes,11,Île-de-France,516636.0,2021-07-31,576587.0,2019-07-31,-59951.0,-10.0,,,,Recrutements de jeunes
Pacte d'ambition pour l'insertion par l'activité économique,Nombre de bénéficiaires en structures d'insertion par l'activité économique,nb-beneficiaires-siae,11,Île-de-France,15608.0,2021-09-30,13229.0,2017-01-31,2379.0,18.0,29594.0,15.0,2022-12-31,bénéficiaires *
Supprimer la taxe d’habitation sur les résidences principales,Nombre de bénéficiaires totalement exonérés,nb-beneficiaires-suppression-taxe-habitation,11,Île-de-France,3300887.0,2021-12-31,0.0,2017-12-31,3300887.0,,5233253.0,63.0,2023-12-31,bénéficiaires
Renforcer les compétences de la nation - plan d'investissement dans les compétences,"Nombre d’entrées en formation pour les publics éloignés de l’emploi (jeunes, demandeurs d’emploi faiblement qualifiés, actifs en insertion, …)",nb-formation-pic,11,Île-de-France,290588.0,2021-12-31,98000.0,2017-12-31,192588.0,197.0,221600.0,100.0,2022-12-31,formations
Garantir l'égalité professionnelle entre les femmes et les hommes,Part des entreprises respectant leur obligation de publier l’index égalité professionnelle,tx-entreprise-egalite-pro,11,Île-de-France,80.0,2021-12-31,43.0,2019-03-31,37.0,86.0,90.0,79.0,2022-12-31,%
