mesure,indicateur,id_indicateur,code_region,libelle_region,valeur_actuelle,date_valeur_actuelle,valeur_initiale,date_valeur_initiale,progression,pourcentage_progression,cible,pourcentage_cible,date_cible,unite
Aide de France Relance aux entreprises,Nombre d'entreprises industrielles et organismes agricoles bénéficiaires des aides à l'investissement de France Relance,nb-entreprises-industrielles-agricoles,84,Auvergne-Rhône-Alpes,3816.0,2021-10-31,0.0,,3816.0,,2100.0,100.0,2022-12-31,entreprises industrielles et agricoles
Numérisation des petites et moyennes entreprises,Nombre d'entreprises ayant bénéficié d'un chèque numérique de 500€,nb-entreprises-cheaque-numerique,84,Auvergne-Rhône-Alpes,14010.0,2021-10-31,507.0,2021-02-28,13503.0,2663.0,13272.0,100.0,2022-12-31,entreprises
Numérisation des petites et moyennes entreprises,Nombre d'entreprises ayant disposé d'un diagnostic numérique et d'un plan d'action individualisé,nb-diagnostics-individualises,84,Auvergne-Rhône-Alpes,2701.0,2021-10-31,495.0,2021-01-31,2206.0,446.0,3885.0,65.0,2022-12-31,entreprises
Développer l’apprentissage,Nombre de contrats d’apprentissage,nombre-contrats-apprentissage,84,Auvergne-Rhône-Alpes,65148.0,2020-12-31,35407.0,2017-12-31,29741.0,84.0,64722.0,100.0,2022-12-31,contrats
Plan 1 jeune 1 solution,Nombre de recrutements de jeunes,nombre-recrutements-jeunes,84,Auvergne-Rhône-Alpes,276919.0,2021-07-31,281682.0,2019-07-31,-4763.0,-2.0,,,,Recrutements de jeunes
Pacte d'ambition pour l'insertion par l'activité économique,Nombre de bénéficiaires en structures d'insertion par l'activité économique,nb-beneficiaires-siae,84,Auvergne-Rhône-Alpes,17509.0,2021-06-30,14274.0,2017-01-31,3235.0,23.0,26738.0,26.0,2022-12-31,bénéficiaires *
Supprimer la taxe d’habitation sur les résidences principales,Nombre de bénéficiaires totalement exonérés,nb-beneficiaires-suppression-taxe-habitation,84,Auvergne-Rhône-Alpes,2707436.0,2021-12-31,0.0,2017-01-01,2707436.0,,3617744.0,75.0,2023-12-31,bénéficiaires
Renforcer les compétences de la nation - plan d'investissement dans les compétences,"Nombre d’entrées en formation pour les publics éloignés de l’emploi (jeunes, demandeurs d’emploi faiblement qualifiés, actifs en insertion, …)",nb-formation-pic,84,Auvergne-Rhône-Alpes,114400.0,2020-12-31,86900.0,2017-12-31,27500.0,32.0,104000.0,100.0,2022-12-31,formations
Garantir l'égalité professionnelle entre les femmes et les hommes,Part des entreprises respectant leur obligation de publier l’index égalité professionnelle,tx-entreprise-egalite-pro,84,Auvergne-Rhône-Alpes,86.0,2021-09-30,57.0,2019-03-31,29.0,51.0,90.0,88.0,2022-12-31,%
