mesure,indicateur,id_indicateur,code_region,libelle_region,valeur_actuelle,date_valeur_actuelle,valeur_initiale,date_valeur_initiale,progression,pourcentage_progression,cible,pourcentage_cible,date_cible,unite
Aide de France Relance aux entreprises,Nombre d’entreprises industrielles (dont PME) bénéficiaires des aides à l'investissement de France Relance,nb-entreprises-industrielles-agricoles,52,Pays de la Loire,1010.0,2022-12-31,0.0,2020-10-31,1010.0,,,,,entreprises industrielles
Numérisation des petites et moyennes entreprises,Nombre d'entreprises ayant bénéficié d'un chèque numérique de 500€,nb-entreprises-cheaque-numerique,52,Pays de la Loire,6949.0,2022-11-30,0.0,2020-09-30,6949.0,,4891.0,100.0,2022-12-31,entreprises
Numérisation des petites et moyennes entreprises,Nombre d'entreprises ayant disposé d'un diagnostic numérique et d'un plan d'action individualisé,nb-diagnostics-individualises,52,Pays de la Loire,1607.0,2022-11-30,0.0,2020-09-30,1607.0,,1242.0,100.0,2022-12-31,entreprises
Développer l’apprentissage,Nombre de contrats d’apprentissage,nombre-contrats-apprentissage,52,Pays de la Loire,51443.0,2022-10-31,19742.0,2017-12-31,31701.0,161.0,33253.0,100.0,2022-12-31,contrats
Plan 1 jeune 1 solution,Nombre de recrutements de jeunes,nombre-recrutements-jeunes,52,Pays de la Loire,157682.0,2022-07-31,123117.0,2019-07-31,34565.0,28.0,,,,Recrutements depuis le mois d'août précédent
Pacte d'ambition pour l'insertion par l'activité économique,Nombre de bénéficiaires en structures d'insertion par l'activité économique,nb-beneficiaires-siae,52,Pays de la Loire,8540.0,2022-09-30,8647.0,2017-01-31,-107.0,-1.0,13783.0,0.0,2022-12-31,bénéficiaires *
Supprimer la taxe d’habitation sur les résidences principales,Nombre de bénéficiaires totalement exonérés,nb-beneficiaires-suppression-taxe-habitation,52,Pays de la Loire,1387378.0,2022-12-31,0.0,2017-12-31,1387378.0,,1733724.0,80.0,2023-12-31,bénéficiaires
Renforcer les compétences de la nation - plan d'investissement dans les compétences,"Nombre d’entrées en formation pour les publics éloignés de l’emploi (jeunes, demandeurs d’emploi faiblement qualifiés, actifs en insertion, …)",nb-formation-pic,52,Pays de la Loire,74630.0,2022-12-31,47200.0,2017-12-31,27430.0,58.0,64900.0,100.0,2022-12-31,formations
Garantir l'égalité professionnelle entre les femmes et les hommes,Part des entreprises respectant leur obligation de publier l’index égalité professionnelle,tx-entreprise-egalite-pro,52,Pays de la Loire,89.0,2022-12-31,37.0,2019-03-31,52.0,141.0,90.0,98.0,2022-12-31,%
