mesure,indicateur,id_indicateur,code_region,libelle_region,valeur_actuelle,date_valeur_actuelle,valeur_initiale,date_valeur_initiale,progression,pourcentage_progression,cible,pourcentage_cible,date_cible,unite
Aide de France Relance aux entreprises,Nombre d’entreprises industrielles (dont PME) bénéficiaires des aides à l'investissement de France Relance,nb-entreprises-industrielles-agricoles,06,Mayotte,2.0,2021-12-31,0.0,2020-10-31,2.0,,,,,entreprises industrielles
Numérisation des petites et moyennes entreprises,Nombre d'entreprises ayant bénéficié d'un chèque numérique de 500€,nb-entreprises-cheaque-numerique,06,Mayotte,29.0,2022-02-28,0.0,2020-09-30,29.0,,17.0,100.0,2022-12-31,entreprises
Numérisation des petites et moyennes entreprises,Nombre d'entreprises ayant disposé d'un diagnostic numérique et d'un plan d'action individualisé,nb-diagnostics-individualises,06,Mayotte,50.0,2022-02-28,0.0,2020-09-30,50.0,,54.0,93.0,2022-12-31,entreprises
Développer l’apprentissage,Nombre de contrats d’apprentissage,nombre-contrats-apprentissage,06,Mayotte,260.0,2021-12-31,14.0,2017-12-31,246.0,1757.0,269.0,96.0,2022-12-31,contrats
Plan 1 jeune 1 solution,Nombre de recrutements de jeunes,nombre-recrutements-jeunes,06,Mayotte,0.0,2021-07-31,0.0,2019-07-31,0.0,,,,,Recrutements depuis le mois d'août précédent
Pacte d'ambition pour l'insertion par l'activité économique,Nombre de bénéficiaires en structures d'insertion par l'activité économique,nb-beneficiaires-siae,06,Mayotte,656.0,2021-10-31,0.0,2017-01-31,656.0,,1691.0,39.0,2022-12-31,bénéficiaires *
Supprimer la taxe d’habitation sur les résidences principales,Nombre de bénéficiaires totalement exonérés,nb-beneficiaires-suppression-taxe-habitation,06,Mayotte,6591.0,2021-12-31,0.0,2017-12-31,6591.0,,11644.0,57.0,2023-12-31,bénéficiaires
Renforcer les compétences de la nation - plan d'investissement dans les compétences,"Nombre d’entrées en formation pour les publics éloignés de l’emploi (jeunes, demandeurs d’emploi faiblement qualifiés, actifs en insertion, …)",nb-formation-pic,06,Mayotte,4318.0,2021-12-31,1700.0,2017-12-31,2618.0,154.0,12400.0,24.0,2022-12-31,formations
Garantir l'égalité professionnelle entre les femmes et les hommes,Part des entreprises respectant leur obligation de publier l’index égalité professionnelle,tx-entreprise-egalite-pro,06,Mayotte,82.0,2021-12-31,33.0,2019-09-30,49.0,148.0,90.0,86.0,2022-12-31,%
