mesure,indicateur,id_indicateur,code_region,libelle_region,valeur_actuelle,date_valeur_actuelle,valeur_initiale,date_valeur_initiale,progression,pourcentage_progression,cible,pourcentage_cible,date_cible,unite
Aide de France Relance aux entreprises,Nombre d'entreprises industrielles et organismes agricoles bénéficiaires des aides à l'investissement de France Relance,nb-entreprises-industrielles-agricoles,27,Bourgogne-Franche-Comté,170.0,2021-06-30,0.0,,170.0,,,,,entreprises industrielles et agricoles
Numérisation des petites et moyennes entreprises,Nombre d'entreprises ayant bénéficié d'un chèque numérique de 500€,nb-entreprises-cheaque-numerique,27,Bourgogne-Franche-Comté,2280.0,2021-06-30,241.0,2021-02-28,2039.0,846.0,3630.0,60.0,2022-12-31,entreprises
Numérisation des petites et moyennes entreprises,Nombre d'entreprises ayant disposé d'un diagnostic numérique et d'un plan d'action individualisé,nb-diagnostics-individualises,27,Bourgogne-Franche-Comté,794.0,2021-06-30,139.0,2021-01-31,655.0,471.0,1161.0,64.0,2022-12-31,entreprises
Développer l’apprentissage,Nombre de contrats d’apprentissage,nombre-contrats-apprentissage,27,Bourgogne-Franche-Comté,20182.0,2020-12-31,13807.0,2017-12-31,6375.0,46.0,20149.0,100.0,2022-12-31,contrats
Plan 1 jeune 1 solution,Nombre de recrutements de jeunes,nombre-recrutements-jeunes,27,Bourgogne-Franche-Comté,56249.0,2021-04-30,57597.0,2019-04-30,-1348.0,-2.0,,,,Recrutements de jeunes
Pacte d'ambition pour l'insertion par l'activité économique,Nombre de bénéficiaires en structures d'insertion par l'activité économique,nb-beneficiaires-siae,27,Bourgogne-Franche-Comté,8442.0,2021-03-31,7216.0,2017-01-31,1226.0,17.0,15480.0,15.0,2022-12-31,bénéficiaires *
Supprimer la taxe d’habitation sur les résidences principales,Nombre de bénéficiaires totalement exonérés,nb-beneficiaires-suppression-taxe-habitation,27,Bourgogne-Franche-Comté,1035697.0,2020-12-31,0.0,2017-01-01,1035697.0,,1296244.0,80.0,2023-12-31,bénéficiaires
Renforcer les compétences de la nation - plan d'investissement dans les compétences,"Nombre d’entrées en formation pour les publics éloignés de l’emploi (jeunes, demandeurs d’emploi faiblement qualifiés, actifs en insertion, …)",nb-formation-pic,27,Bourgogne-Franche-Comté,40700.0,2020-12-31,28600.0,2017-12-31,12100.0,42.0,40300.0,100.0,2022-12-31,formations
Garantir l'égalité professionnelle entre les femmes et les hommes,Part des entreprises respectant leur obligation de publier l’index égalité professionnelle,tx-entreprise-egalite-pro,27,Bourgogne-Franche-Comté,80.0,2021-06-30,38.0,2019-03-31,42.0,111.0,90.0,81.0,2022-12-31,%
