mesure,indicateur,id_indicateur,code_region,libelle_region,valeur_actuelle,date_valeur_actuelle,valeur_initiale,date_valeur_initiale,progression,pourcentage_progression,cible,pourcentage_cible,date_cible,unite
Aide de France Relance aux entreprises,Nombre d'entreprises industrielles et organismes agricoles bénéficiaires des aides à l'investissement de France Relance,nb-entreprises-industrielles-agricoles,24,Centre-Val de Loire,92.0,2021-03-31,0.0,,92.0,,,,,entreprises industrielles et agricoles
Numérisation des petites et moyennes entreprises,Nombre d'entreprises ayant bénéficié d'un chèque numérique de 500€,nb-entreprises-cheaque-numerique,24,Centre-Val de Loire,914.0,2021-04-30,141.0,2021-02-28,773.0,548.0,3134.0,26.0,2022-12-31,entreprises
Numérisation des petites et moyennes entreprises,Nombre d'entreprises ayant disposé d'un diagnostic numérique et un plan d'action individualisé,nb-diagnostics-individualises,24,Centre-Val de Loire,352.0,2021-04-30,112.0,2021-01-31,240.0,214.0,978.0,28.0,2022-12-31,entreprises
Développer l’apprentissage,Nombre de contrats d’apprentissage,nombre-contrats-apprentissage,24,Centre-Val de Loire,17443.0,2020-12-31,13490.0,2017-12-31,3953.0,29.0,,,,contrats
Plan 1 jeune 1 solution,Nombre de recrutements de jeunes,nombre-recrutements-jeunes,24,Centre-Val de Loire,44501.0,2021-02-28,43867.0,2019-02-28,634.0,1.0,,,,Recrutements de jeunes
Pacte d'ambition pour l'insertion par l'activité économique,Nombre de bénéficiaires en structures d'insertion par l'activité économique,nb-beneficiaires-siae,24,Centre-Val de Loire,4685.0,2020-12-31,4967.0,2017-01-31,-282.0,-6.0,,,,bénéficiaires
Supprimer la taxe d’habitation sur les résidences principales,Nombre de bénéficiaires totalement exonérés,nb-beneficiaires-suppression-taxe-habitation,24,Centre-Val de Loire,943945.0,2020-12-31,0.0,2017-01-01,943945.0,,1176371.0,80.0,2023-12-31,bénéficiaires
